Item Title,Publication Title,Book Series Title,Journal Volume,Journal Issue,Item DOI,Authors,Publication Year,URL,Content Type
Contextualized Multidimensional Personality Recognition using Combination of Deep Neural Network and Ensemble Learning,Neural Processing Letters,,,,10.1007/s11063-022-10787-9,Fatemeh Mohades DeilamiHossein SadrMorteza Tarkhan,2022,https://link.springer.com/article/10.1007/s11063-022-10787-9,Article
A Deep Learning Approach to Forecast SARS-CoV-2 on the Peruvian Coast,Computational Science and Its Applications – ICCSA 2021,,,,10.1007/978-3-030-86970-0_22,I. Luis AguilarMiguel Ibáñez-ReluzJuan C. Z. AguilarElí W. Zavaleta-AguilarL. Antonio Aguilar,2021,https://link.springer.com/chapter/10.1007/978-3-030-86970-0_22,Conference paper
Automatic Classification of Diagnosis-Related Groups Using ANN and XGBoost Models,Applications of Computational Intelligence,,,,10.1007/978-3-030-69774-7_7,Angelower Santana-VelásquezJohn Freddy Duitama M.Julián D. Arias-Londoño,2021,https://link.springer.com/chapter/10.1007/978-3-030-69774-7_7,Conference paper
How to Optimize Student Learning Using Student Models That Adapt Rapidly to Individual Differences,International Journal of Artificial Intelligence in Education,,,,10.1007/s40593-022-00296-0,Luke G. EglingtonPhilip I. Pavlik Jr,2022,https://link.springer.com/article/10.1007/s40593-022-00296-0,Article
A Novel Three-Staged Generative Model for Skeletonizing Chinese Characters with Versatile Styles,Journal of Computer Science and Technology,,,,10.1007/s11390-023-1337-8,Ye-Chuan TianSong-Hua XuCheickna Sylla,2023,https://link.springer.com/article/10.1007/s11390-023-1337-8,Article
Can explainable artificial intelligence support software modelers in model comprehension?,Software and Systems Modeling,,,,10.1007/s10270-024-01251-4,Francisco Javier AlcaideJosé Raúl RomeroAurora Ramírez,2025,https://link.springer.com/article/10.1007/s10270-024-01251-4,Article
Optimization of vector convolutional deep neural network using binary real cumulative incarnation for detection of distributed denial of service attacks,Neural Computing and Applications,,,,10.1007/s00521-021-06565-8,N. G. Bhuvaneswari AmmaS. Selvakumar,2021,https://link.springer.com/article/10.1007/s00521-021-06565-8,Article
Machine Learning and Deep Learning Based Time Series Prediction and Forecasting of Ten Nations’ COVID-19 Pandemic,SN Computer Science,,,,10.1007/s42979-022-01493-3,Yogesh KumarApeksha KoulSukhpreet KaurYu-Chen Hu,2022,https://link.springer.com/article/10.1007/s42979-022-01493-3,Article
A k-Anonymised Federated Learning Framework with Decision Trees,"Data Privacy Management, Cryptocurrencies and Blockchain Technology",,,,10.1007/978-3-030-93944-1_7,Saloni KwatraVicenç Torra,2022,https://link.springer.com/chapter/10.1007/978-3-030-93944-1_7,Conference paper
MSUP: Model for the Searching of Unidentified People Comparing Binary Vectors Using Jaccard and Dice,Advances in Computational Intelligence,,,,10.1007/978-3-030-60887-3_30,José-Sergio Ruiz-CastillaFarid García-LamontJosé Ángel Regalado-GarcíaAdán Vidal-PeraltaCarlos Rafael Hernández-Magos,2020,https://link.springer.com/chapter/10.1007/978-3-030-60887-3_30,Conference paper
An empirical study on the potential of word embedding techniques in bug report management tasks,Empirical Software Engineering,,,,10.1007/s10664-024-10510-3,Bingting ChenWeiqin ZouBiyu CaiQianshuang MengWenjie LiuPiji LiLin Chen,2024,https://link.springer.com/article/10.1007/s10664-024-10510-3,Article
Adversarial training and ensemble learning for automatic code summarization,Neural Computing and Applications,,,,10.1007/s00521-021-05907-w,Ziyi ZhouHuiqun YuGuisheng Fan,2021,https://link.springer.com/article/10.1007/s00521-021-05907-w,Article
Simulation of Performance and Emissions Related Parameters in a Thermal Engine Using a Deep Learning Approach,SN Computer Science,,,,10.1007/s42979-021-00976-z,Nelson Junior Issondj BantaFlorence OffoleDieudonne EssolaVidal Giovani Tchato YotchouClaude Valery Ngayihi AbbeRuben Mouangue,2021,https://link.springer.com/article/10.1007/s42979-021-00976-z,Article
Digital forgetting in large language models: a survey of unlearning methods,Artificial Intelligence Review,,,,10.1007/s10462-024-11078-6,Alberto Blanco-JusticiaNajeeb JebreelBenet Manzanares-SalorDavid SánchezJosep Domingo-FerrerGuillem CollellKuan Eeik Tan,2025,https://link.springer.com/article/10.1007/s10462-024-11078-6,Article
A comparative study of handling imbalanced data using generative adversarial networks for machine learning based software fault prediction,Applied Intelligence,,,,10.1007/s10489-024-05930-z,Ha Thi Minh PhuongPham Vu Thu NguyetNguyen Huu Nhat MinhLe Thi My HanhNguyen Thanh Binh,2025,https://link.springer.com/article/10.1007/s10489-024-05930-z,Article
A CNN–LSTM model for gold price time-series forecasting,Neural Computing and Applications,,,,10.1007/s00521-020-04867-x,Ioannis E. LivierisEmmanuel PintelasPanagiotis Pintelas,2020,https://link.springer.com/article/10.1007/s00521-020-04867-x,Article
Learning Fault Localisation for both Humans and Machines Using Multi-objective GP,Search-Based Software Engineering,,,,10.1007/978-3-319-99241-9_20,Kabdo ChoiJeongju SohnShin Yoo,2018,https://link.springer.com/chapter/10.1007/978-3-319-99241-9_20,Conference paper
Item trend learning for sequential recommendation system using gated graph neural network,Neural Computing and Applications,,,,10.1007/s00521-021-05723-2,Ye TaoCan WangLina YaoWeimin LiYonghong Yu,2021,https://link.springer.com/article/10.1007/s00521-021-05723-2,Article
A Motivating Case Study on&#xa0;Code Variant Selection by&#xa0;Reinforcement Learning,High Performance Computing,,,,10.1007/978-3-031-07312-0_15,Oliver HackerMatthias KorchJohannes Seiferth,2022,https://link.springer.com/chapter/10.1007/978-3-031-07312-0_15,Conference paper
Personalized POI Recommendation: Spatio-Temporal Representation Learning with Social Tie,Database Systems for Advanced Applications,,,,10.1007/978-3-030-73194-6_37,Shaojie DaiYanwei YuHao FanJunyu Dong,2021,https://link.springer.com/chapter/10.1007/978-3-030-73194-6_37,Conference paper
Spatio-Temporal Representation Learning with Social Tie for Personalized POI Recommendation,Data Science and Engineering,,,,10.1007/s41019-022-00180-w,Shaojie DaiYanwei YuHao FanJunyu Dong,2022,https://link.springer.com/article/10.1007/s41019-022-00180-w,Article
HOB-net: high-order block network via deep metric learning for person re-identification,Applied Intelligence,,,,10.1007/s10489-021-02450-y,Dongyue ChenPengfei WuTong JiaFangbin Xu,2021,https://link.springer.com/article/10.1007/s10489-021-02450-y,Article
A survey of long short term memory and its associated models in sustainable wind energy predictive analytics,Artificial Intelligence Review,,,,10.1007/s10462-023-10554-9,Sherry GargRajalakshmi Krishnamurthi,2023,https://link.springer.com/article/10.1007/s10462-023-10554-9,Article
Learning minimal automata with recurrent neural networks,Software and Systems Modeling,,,,10.1007/s10270-024-01160-6,Bernhard K. AichernigSandra KönigCristinel MateisAndrea PferscherMartin Tappler,2024,https://link.springer.com/article/10.1007/s10270-024-01160-6,Article
Constrained Training of&#xa0;Recurrent Neural Networks for&#xa0;Automata Learning,Software Engineering and Formal Methods,,,,10.1007/978-3-031-17108-6_10,Bernhard K. AichernigSandra KönigCristinel MateisAndrea PferscherDominik SchmidtMartin Tappler,2022,https://link.springer.com/chapter/10.1007/978-3-031-17108-6_10,Conference paper
Deep learning on multi-view sequential data: a survey,Artificial Intelligence Review,,,,10.1007/s10462-022-10332-z,Zhuyang XieYan YangYiling ZhangJie WangShengdong Du,2022,https://link.springer.com/article/10.1007/s10462-022-10332-z,Article
Auto-DL: A Platform to Generate Deep Learning Models,Soft Computing in Data Science,,,,10.1007/978-981-16-7334-4_7,Aditya SrivastavaTanvi ShindeRaj JoshiSameer Ahmed AnsariNupur Giri,2021,https://link.springer.com/chapter/10.1007/978-981-16-7334-4_7,Conference paper
Manthan: A Data-Driven Approach for Boolean Function Synthesis,Computer Aided Verification,,,,10.1007/978-3-030-53291-8_31,Priyanka GoliaSubhajit RoyKuldeep S. Meel,2020,https://link.springer.com/chapter/10.1007/978-3-030-53291-8_31,Conference paper
An Empirical Study on Training Paradigms for Deep Supervised Hashing,International Journal of Computer Vision,,,,10.1007/s11263-025-02506-3,Yang ShenPeng WangXiu-Shen WeiYazhou Yao,2025,https://link.springer.com/article/10.1007/s11263-025-02506-3,Article
An adaptive backpropagation algorithm for long-term electricity load forecasting,Neural Computing and Applications,,,,10.1007/s00521-021-06384-x,Nooriya A. MohammedAmmar Al-Bazi,2021,https://link.springer.com/article/10.1007/s00521-021-06384-x,Article
Classification and pattern extraction of incidents: a deep learning-based approach,Neural Computing and Applications,,,,10.1007/s00521-021-06780-3,Sobhan SarkarSammangi VinayChawki DjeddiJ. Maiti,2022,https://link.springer.com/article/10.1007/s00521-021-06780-3,Article
Parameter-efficient fine-tuning in large language models: a survey of methodologies,Artificial Intelligence Review,,,,10.1007/s10462-025-11236-4,Luping WangSheng ChenLinnan JiangShu PanRunze CaiSen YangFei Yang,2025,https://link.springer.com/article/10.1007/s10462-025-11236-4,Article
JEMMA: An extensible Java dataset for ML4Code applications,Empirical Software Engineering,,,,10.1007/s10664-022-10275-7,Anjan KarmakarMiltiadis AllamanisRomain Robbes,2023,https://link.springer.com/article/10.1007/s10664-022-10275-7,Article
Kernelized Linear Autoencoder,Neural Processing Letters,,,,10.1007/s11063-021-10467-0,Angshul Majumdar,2021,https://link.springer.com/article/10.1007/s11063-021-10467-0,Article
"Deep neural-based vulnerability discovery demystified: data, model and performance",Neural Computing and Applications,,,,10.1007/s00521-021-05954-3,Guanjun LinWei XiaoLeo Yu ZhangShang GaoYonghang TaiJun Zhang,2021,https://link.springer.com/article/10.1007/s00521-021-05954-3,Article
Group-based recurrent neural network for human mobility prediction,Neural Computing and Applications,,,,10.1007/s00521-022-06971-6,Shengren KeMeiyi XieHong ZhuZhongsheng Cao,2022,https://link.springer.com/article/10.1007/s00521-022-06971-6,Article
From Individual to Whole: Reducing Intra-class Variance by Feature Aggregation,International Journal of Computer Vision,,,,10.1007/s11263-021-01569-2,Zhaoxiang ZhangChuanchen LuoHaiping WuYuntao ChenNaiyan WangChunfeng Song,2022,https://link.springer.com/article/10.1007/s11263-021-01569-2,Article
PDPNN: Modeling User Personal Dynamic Preference for Next Point-of-Interest Recommendation,Computational Science – ICCS 2020,,,,10.1007/978-3-030-50433-5_4,Jinwen ZhongCan MaJiang ZhouWeiping Wang,2020,https://link.springer.com/chapter/10.1007/978-3-030-50433-5_4,Conference paper
Provenance Supporting Hyperparameter Analysis in Deep Neural Networks,Provenance and Annotation of Data and Processes,,,,10.1007/978-3-030-80960-7_2,Débora PinaLiliane KunstmannDaniel de OliveiraPatrick ValduriezMarta Mattoso,2021,https://link.springer.com/chapter/10.1007/978-3-030-80960-7_2,Conference paper
Enabling Machine Learning on the Edge Using SRAM Conserving Efficient Neural Networks Execution Approach,Machine Learning and Knowledge Discovery in Databases. Applied Data Science Track,,,,10.1007/978-3-030-86517-7_2,Bharath SudharsanPankesh PatelJohn G. BreslinMuhammad Intizar Ali,2021,https://link.springer.com/chapter/10.1007/978-3-030-86517-7_2,Conference paper
Automatically recommending components for issue reports using deep learning,Empirical Software Engineering,,,,10.1007/s10664-020-09898-5,Morakot ChoetkiertikulHoa Khanh DamTruyen TranTrang PhamChaiyong RagkhitwetsagulAditya Ghose,2021,https://link.springer.com/article/10.1007/s10664-020-09898-5,Article
Predicting Human Mobility with Self-attention and Feature Interaction,Web and Big Data,,,,10.1007/978-3-030-60290-1_9,Jingang JiangShuo TaoDefu LianZhenya HuangEnhong Chen,2020,https://link.springer.com/chapter/10.1007/978-3-030-60290-1_9,Conference paper
Algebraic aggregation of random forests: towards explainability and rapid evaluation,International Journal on Software Tools for Technology Transfer,,,,10.1007/s10009-021-00635-x,Frederik GossenBernhard Steffen,2021,https://link.springer.com/article/10.1007/s10009-021-00635-x,Article
TCL: Tensor-CNN-LSTM for Travel Time Prediction with Sparse Trajectory Data,Database Systems for Advanced Applications,,,,10.1007/978-3-030-18590-9_39,Yibin ShenJiaxun HuaCheqing JinDingjiang Huang,2019,https://link.springer.com/chapter/10.1007/978-3-030-18590-9_39,Conference paper
Improving graph-based label propagation algorithm with group partition for fraud detection,Applied Intelligence,,,,10.1007/s10489-020-01724-1,Jiahui WangYi GuoXinxiu WenZhihong WangZhen LiMinwei Tang,2020,https://link.springer.com/article/10.1007/s10489-020-01724-1,Article
Long-term time-series pollution forecast using statistical and deep learning methods,Neural Computing and Applications,,,,10.1007/s00521-021-05901-2,Pritthijit NathPratik SahaAsif Iqbal MiddyaSarbani Roy,2021,https://link.springer.com/article/10.1007/s00521-021-05901-2,Article
Predicting Traffic Flow Based on Encoder-Decoder Framework,"Collaborative Computing: Networking, Applications and Worksharing",,,,10.1007/978-3-030-30146-0_36,Xiaosen ZhengZikun YangLiwen LiuLi Kuang,2019,https://link.springer.com/chapter/10.1007/978-3-030-30146-0_36,Conference paper
A Drift-Based Dynamic Ensemble Members Selection Using Clustering for Time Series Forecasting,Machine Learning and Knowledge Discovery in Databases,,,,10.1007/978-3-030-46150-8_40,Amal SaadallahFlorian PriebeKatharina Morik,2020,https://link.springer.com/chapter/10.1007/978-3-030-46150-8_40,Conference paper
A comprehensive survey of loss functions and metrics in deep learning,Artificial Intelligence Review,,,,10.1007/s10462-025-11198-7,Juan TervenDiana-Margarita Cordova-EsparzaJulio-Alejandro Romero-GonzálezAlfonso Ramírez-PedrazaE. A. Chávez-Urbiola,2025,https://link.springer.com/article/10.1007/s10462-025-11198-7,Article
Neural Networks Merging Semantic and Non-semantic Features for Opinion Spam Detection,Natural Language Processing and Chinese Computing,,,,10.1007/978-3-030-32233-5_45,Chengzhi JiangXianguo Zhang,2019,https://link.springer.com/chapter/10.1007/978-3-030-32233-5_45,Conference paper
Discrimination-Aware Domain Adversarial Neural Network,Journal of Computer Science and Technology,,,,10.1007/s11390-020-9969-4,Yun-Yun WangJian-Min GuChao WangSong-Can ChenHui Xue,2020,https://link.springer.com/article/10.1007/s11390-020-9969-4,Article
Introducing a Vector Space Model to Perform a Proactive Credit Scoring,"Knowledge Discovery, Knowledge Engineering and Knowledge Management",,,,10.1007/978-3-319-99701-8_6,Roberto SaiaSalvatore Carta,2019,https://link.springer.com/chapter/10.1007/978-3-319-99701-8_6,Conference paper
A survey of deep learning for industrial visual anomaly detection,Artificial Intelligence Review,,,,10.1007/s10462-025-11287-7,Zhuo LiYuhao YanXiangheng WangYifei GeLin Meng,2025,https://link.springer.com/article/10.1007/s10462-025-11287-7,Article
Flood Forecasting Using Artificial Neural Network for Kalu Ganga,Artificial Intelligence,,,,10.1007/978-981-13-9129-3_7,Dhananjali GamageKalani Ilmini,2019,https://link.springer.com/chapter/10.1007/978-981-13-9129-3_7,Conference paper
COLIN: A Cache-Conscious Dynamic Learned Index with High Read/Write Performance,Journal of Computer Science and Technology,,,,10.1007/s11390-021-1348-2,Zhou ZhangPei-Quan JinXiao-Liang WangYan-Qi LvShou-Hong WanXi-Ke Xie,2021,https://link.springer.com/article/10.1007/s11390-021-1348-2,Article
The importance of interpretability and visualization in machine learning for applications in medicine and health care,Neural Computing and Applications,,,,10.1007/s00521-019-04051-w,Alfredo Vellido,2019,https://link.springer.com/article/10.1007/s00521-019-04051-w,Article
CPAS: the UK’s national machine learning-based hospital capacity planning system for COVID-19,Machine Learning,,,,10.1007/s10994-020-05921-4,Zhaozhi QianAhmed M. AlaaMihaela van der Schaar,2020,https://link.springer.com/article/10.1007/s10994-020-05921-4,Article
A General Framework for Deep Supervised Discrete Hashing,International Journal of Computer Vision,,,,10.1007/s11263-020-01327-w,Qi LiZhenan SunRan HeTieniu Tan,2020,https://link.springer.com/article/10.1007/s11263-020-01327-w,Article
Run-Time Class Generation: Algorithms for Union of Homogeneous and Inhomogeneous Classes,Information and Software Technologies,,,,10.1007/978-3-030-30275-7_12,Dmytro O. Terletskyi,2019,https://link.springer.com/chapter/10.1007/978-3-030-30275-7_12,Conference paper
Bigflow: A General Optimization Layer for Distributed Computing Frameworks,Journal of Computer Science and Technology,,,,10.1007/s11390-020-9702-3,Yun-Cong ZhangXiao-Yang WangCong WangYao XuJian-Wei ZhangXiao-Dong LinGuang-Yu SunGong-Lin ZhengShan-Hui YinXian-Jin YeLi LiZhan SongDong-Dong Miao,2020,https://link.springer.com/article/10.1007/s11390-020-9702-3,Article
Multiple Instance Learning with Bag-Level Randomized Trees,Machine Learning and Knowledge Discovery in Databases,,,,10.1007/978-3-030-10925-7_16,Tomáš KomárekPetr Somol,2019,https://link.springer.com/chapter/10.1007/978-3-030-10925-7_16,Conference paper
Towards Automated Support for Conceptual Model Diagnosis and Repair,Advances in Conceptual Modeling,,,,10.1007/978-3-030-65847-2_2,Mattia FumagalliTiago Prince SalesGiancarlo Guizzardi,2020,https://link.springer.com/chapter/10.1007/978-3-030-65847-2_2,Conference paper
Bedsore Ulcer Detection Using Support Vector Machine,Data Science and Analytics,,,,10.1007/978-981-15-5827-6_2,Anand UpadhyayNida BaigAnishka Pereira,2020,https://link.springer.com/chapter/10.1007/978-981-15-5827-6_2,Conference paper
Enhancing the Programmability and Performance Portability of GPU Tensor Operations,Euro-Par 2019: Parallel Processing,,,,10.1007/978-3-030-29400-7_16,Arya MazaheriJohannes SchulteMatthew W. MoskewiczFelix WolfAli Jannesari,2019,https://link.springer.com/chapter/10.1007/978-3-030-29400-7_16,Conference paper
AutoMSC: Automatic Assignment of Mathematics Subject Classification Labels,Intelligent Computer Mathematics,,,,10.1007/978-3-030-53518-6_15,Moritz SchubotzPhilipp ScharpfOlaf TeschkeAndreas KühnemundCorinna BreitingerBela Gipp,2020,https://link.springer.com/chapter/10.1007/978-3-030-53518-6_15,Conference paper
Constructive Aggregation and Its Application to Forecasting with Dynamic Ensembles,Machine Learning and Knowledge Discovery in Databases,,,,10.1007/978-3-030-10925-7_38,Vitor CerqueiraFabio PintoLuis TorgoCarlos SoaresNuno Moniz,2019,https://link.springer.com/chapter/10.1007/978-3-030-10925-7_38,Conference paper
Recent trends in deep learning based personality detection,Artificial Intelligence Review,,,,10.1007/s10462-019-09770-z,Yash MehtaNavonil MajumderAlexander GelbukhErik Cambria,2019,https://link.springer.com/article/10.1007/s10462-019-09770-z,Article
Accelerating Deep Learning Inference with Cross-Layer Data Reuse on GPUs,Euro-Par 2020: Parallel Processing,,,,10.1007/978-3-030-57675-2_14,Xueying WangGuangli LiXiao DongJiansong LiLei LiuXiaobing Feng,2020,https://link.springer.com/chapter/10.1007/978-3-030-57675-2_14,Conference paper
A Neuro-fuzzy approach for user behaviour classification and prediction,Journal of Cloud Computing,,,,10.1186/s13677-019-0144-9,Atta-ur-RahmanSujata DashAshish Kr. LuhachNaveen ChilamkurtiSeungmin BaekYunyoung Nam,2019,https://link.springer.com/article/10.1186/s13677-019-0144-9,Article
Complex Localization in the Multiple Instance Learning Context,New Frontiers in Mining Complex Patterns,,,,10.1007/978-3-319-78680-3_7,Dan-Ovidiu GraurRăzvan-Alexandru MarişRodica PotoleaMihaela DînşoreanuCamelia Lemnaru,2018,https://link.springer.com/chapter/10.1007/978-3-319-78680-3_7,Conference paper
Improving Symbolic Automata Learning with Concolic Execution,Fundamental Approaches to Software Engineering,,,,10.1007/978-3-030-45234-6_1,Donato ClunPhillip van HeerdenAntonio FilieriWillem Visser,2020,https://link.springer.com/chapter/10.1007/978-3-030-45234-6_1,Conference paper
Feature-Based Time Series Classification for Service Request Opening Prediction in the Telecom Industry,Progress in Artificial Intelligence,,,,10.1007/978-3-030-30244-3_11,Fabíola S. F. PereiraAndré C. P. L. F. CarvalhoRafael AssisMaxley CostaElaine R. FariaRita Maria Silva JuliaUmberto BarcelosJony Melo,2019,https://link.springer.com/chapter/10.1007/978-3-030-30244-3_11,Conference paper
Using meta-heuristics and machine learning for software optimization of parallel computing systems: a systematic literature review,Computing,,,,10.1007/s00607-018-0614-9,Suejb MemetiSabri PllanaAlécio BinottoJoanna KołodziejIvona Brandic,2018,https://link.springer.com/article/10.1007/s00607-018-0614-9,Article
Inferring Personality Traits from Attentive Regions of User Liked Images Via Weakly Supervised Dual Convolutional Network,Neural Processing Letters,,,,10.1007/s11063-019-09987-7,Hancheng ZhuLeida LiHongyan JiangAllen Tan,2019,https://link.springer.com/article/10.1007/s11063-019-09987-7,Article
"EnsP<sup>KDE</sup>&amp;IncL<sup>KDE</sup>: a hybrid time series prediction algorithm integrating dynamic ensemble pruning, incremental learning, and kernel density estimation",Applied Intelligence,,,,10.1007/s10489-020-01802-4,Gangliang ZhuQun Dai,2020,https://link.springer.com/article/10.1007/s10489-020-01802-4,Article
Multi-task Network Learning Representation Features of Attributes and Identity for Person Re-identification,Biometric Recognition,,,,10.1007/978-3-319-97909-0_73,Junqian WangMengsi Lyu,2018,https://link.springer.com/chapter/10.1007/978-3-319-97909-0_73,Conference paper
Expert2Vec: Distributed Expert Representation Learning in Question Answering Community,Advanced Data Mining and Applications,,,,10.1007/978-3-030-35231-8_21,Xiaocong ChenChaoran HuangXiang ZhangXianzhi WangWei LiuLina Yao,2019,https://link.springer.com/chapter/10.1007/978-3-030-35231-8_21,Conference paper
Unified Framework for Joint Attribute Classification and Person Re-identification,Artificial Neural Networks and Machine Learning – ICANN 2018,,,,10.1007/978-3-030-01418-6_63,Chenxin SunNa JiangLei ZhangYuehua WangWei WuZhong Zhou,2018,https://link.springer.com/chapter/10.1007/978-3-030-01418-6_63,Conference paper
Improving Multiple-Instance Learning via Disambiguation by Considering Generalization,Wireless Internet,,,,10.1007/978-3-319-90802-1_37,Lu ZhaoYoujian YuHao ChenLiming Yuan,2018,https://link.springer.com/chapter/10.1007/978-3-319-90802-1_37,Conference paper
Efficient feature selection and classification algorithm based on PSO and rough sets,Neural Computing and Applications,,,,10.1007/s00521-017-3317-9,Ramesh Kumar HudaHaider Banka,2018,https://link.springer.com/article/10.1007/s00521-017-3317-9,Article
Automated Cash Mining Attacks on Mobile Advertising Networks,Information Security and Privacy,,,,10.1007/978-3-030-21548-4_40,Woojoong JiTaeyun KimKuyju KimHyoungshick Kim,2019,https://link.springer.com/chapter/10.1007/978-3-030-21548-4_40,Conference paper
Weighted Multi-view Deep Neural Networks for Weather Forecasting,Artificial Neural Networks and Machine Learning – ICANN 2018,,,,10.1007/978-3-030-01424-7_48,Zahra KarevanLynn HouthuysJohan A. K. Suykens,2018,https://link.springer.com/chapter/10.1007/978-3-030-01424-7_48,Conference paper
The Day-Ahead Electricity Price Forecasting Based on Stacked CNN and LSTM,Intelligence Science and Big Data Engineering,,,,10.1007/978-3-030-02698-1_19,Xiaolong XieWei XuHongzhi Tan,2018,https://link.springer.com/chapter/10.1007/978-3-030-02698-1_19,Conference paper
Performance Analysis of Time Series Forecasting Using Machine Learning Algorithms for Prediction of Ebola Casualties,Applications of Computing and Communication Technologies,,,,10.1007/978-981-13-2035-4_28,Manish Kumar PandeyKarthikeyan Subbiah,2018,https://link.springer.com/chapter/10.1007/978-981-13-2035-4_28,Conference paper
Using Dynamic Compilation to Achieve Ninja Performance for CNN Training on Many-Core Processors,Euro-Par 2018: Parallel Processing,,,,10.1007/978-3-319-96983-1_19,Ankush MandalRajkishore BarikVivek Sarkar,2018,https://link.springer.com/chapter/10.1007/978-3-319-96983-1_19,Conference paper
CHIRPS: Explaining random forest classification,Artificial Intelligence Review,,,,10.1007/s10462-020-09833-6,Julian HatwellMohamed Medhat GaberR. Muhammad Atif Azad,2020,https://link.springer.com/article/10.1007/s10462-020-09833-6,Article
Improved Review Sentiment Analysis with a Syntax-Aware Encoder,Web and Big Data,,,,10.1007/978-3-030-26075-0_6,Jiangfeng ZengMing YangKe ZhouXiao MaYangtao WangXiaodong XuZhili Xiao,2019,https://link.springer.com/chapter/10.1007/978-3-030-26075-0_6,Conference paper
The Study of Neural Networks Effective Architectures for Patents Images Processing,Creativity in Intelligent Technologies and Data Science,,,,10.1007/978-3-030-29750-3_3,Alla G. KravetsSergey KolesnikovNatalia SalnikovaMikhail LempertOlga Poplavskaya,2019,https://link.springer.com/chapter/10.1007/978-3-030-29750-3_3,Conference paper
Multi-level Sequence GAN for Group Activity Recognition,Computer Vision – ACCV 2018,,,,10.1007/978-3-030-20887-5_21,Harshala GammulleSimon DenmanSridha SridharanClinton Fookes,2019,https://link.springer.com/chapter/10.1007/978-3-030-20887-5_21,Conference paper
Supervised Hashing with Recurrent Scaling,Web and Big Data,,,,10.1007/978-3-030-26075-0_4,Xiyao FuYi BinZheng WangQin WeiSi Chen,2019,https://link.springer.com/chapter/10.1007/978-3-030-26075-0_4,Conference paper
