"Named Entity Recognition Based on Large Language Model and Instruction Tuning","S. Yang; M. Li; L. Xu","Artificial Intelligence Institute of China Electronics Technology, Group Corporation, Beijing, China; Artificial Intelligence Institute of China Electronics Technology, Group Corporation, Beijing, China; Artificial Intelligence Institute of China Electronics Technology, Group Corporation, Beijing, China",2024 5th International Conference on Big Data & Artificial Intelligence & Software Engineering (ICBASE),"26 Nov 2024","2024","","","336","343","In recent years, with the development of deep learning technology, Large Language models (LLMs) perform well on many natural language processing tasks, but the performance on named entity recognition tasks are average. This is because of the difference between named entity recognition and Large Language Model: the former is essentially a sequence labeling task, while the latter is a text generation model. Therefore, in this paper, we propose a named entity recognition method based on large language model and instruction fine-tuning. First, combining the idea of prompt engineering, we reconstruct the data set format of named entities by constructing instruction prompt to fit the generation task. The instruction cue consists of four parts: task description, entity definition, task example and input text. In addition, this paper also adopts the method of instruction fine-tuning to further improve the capability of named entity recognition for large language models. Finally, this paper selects the CLUENER2020 Chinese named entity recognition dataset for experimental validation, and compares with several traditional named entity recognition methods. The results show that the method proposed in this paper performs better.","","979-8-3315-0661-2","10.1109/ICBASE63199.2024.10762152","","https://ieeexplore.ieee.org/stamp/stamp.jsp?arnumber=10762152","component;large language model;named entity recognition;prompt engineering;instruction tuning","Training;Deep learning;Large language models;Named entity recognition;Hardware;Data models;Prompt engineering;Labeling;Tuning;Software engineering","","","","28","IEEE","26 Nov 2024","","","IEEE","IEEE Conferences"
"Using Self-Organizing Architectures to Mitigate the Impacts of Denial-of-Service Attacks on Voltage Control Schemes","C. Cameron; C. Patsios; P. C. Taylor; Z. Pourmirza","School of Electrical and Electronic Engineering, Newcastle University, Newcastle upon Tyne, U.K.; School of Electrical and Electronic Engineering, Newcastle University, Newcastle upon Tyne, U.K.; School of Electrical and Electronic Engineering, Newcastle University, Newcastle upon Tyne, U.K.; School of Electrical and Electronic Engineering, Newcastle University, Newcastle upon Tyne, U.K.",IEEE Transactions on Smart Grid,"22 Apr 2019","2019","10","3","3010","3019","Modern power systems are becoming increasingly decentralized, with a greater degree of observability provided through a network of sensors and local controllers in addition to existing centralized supervisory control and data acquisition platforms. However, the interconnectivity between sensors and controllers creates potential vulnerabilities which can be exploited by a cyber-attack. The majority of components installed on the grid were designed with little or no consideration for aspects of cyber-security and therefore leaving the network at risk of economic loss, asset damage or widespread blackouts. Present research in cyber-attack events and electrical grid resilience, often treats these in isolation. Furthermore, the ICT infrastructure in modern electrical networks is not tested as rigorously in terms of reliability and security as the physical assets. Therefore, an integrated approach is needed for the analysis of cyber-threats against power systems, linking the attack mechanisms in the ICT layer and the physical impacts at the electrical layer. This paper introduces a method of self-organizing communication architectures that for the first time has been applied to the problem of mitigating the negative impacts of denial of service cyber-attacks in the smart grid and demonstrates the benefits of this in a novel integrated environment connecting power system modeling and communication layer simulation. This paper demonstrates and quantifies the advantages of self-organization in terms of computational burden and voltage control in a distribution network experiencing multiple attack formats and increasing numbers of attackers.","1949-3061","","10.1109/TSG.2018.2817046","Engineering and Physical Sciences Research Council; ","https://ieeexplore.ieee.org/stamp/stamp.jsp?arnumber=8330052","Smart grid;self-organizing systems;multi-agent systems;cyber-security;voltage control","Smart grids;Computer security;Voltage control;Sensors;Information and communication technology","","46","","44","CCBY","3 Apr 2018","","","IEEE","IEEE Journals"
"Evolutionary Computation in the Era of Large Language Model: Survey and Roadmap","X. Wu; S. -H. Wu; J. Wu; L. Feng; K. C. Tan","Department of Data Science and Artificial Intelligence, The Hong Kong Polytechnic University, Hong Kong, China; Department of Data Science and Artificial Intelligence, The Hong Kong Polytechnic University, Hong Kong, China; Department of Data Science and Artificial Intelligence and the Department of Computing, The Hong Kong Polytechnic University, Hong Kong, China; College of Computer Science, Chongqing University, Chongqing, China; Department of Data Science and Artificial Intelligence, The Hong Kong Polytechnic University, Hong Kong, China",IEEE Transactions on Evolutionary Computation,"1 Apr 2025","2025","29","2","534","554","Large language models (LLMs) have not only revolutionized natural language processing but also extended their prowess to various domains, marking a significant stride toward artificial general intelligence. The interplay between LLMs and evolutionary algorithms (EAs), despite differing in objectives and methodologies, share a common pursuit of applicability in complex problems. Meanwhile, EA can provide an optimization framework for LLM’s further enhancement under closed box settings, empowering LLM with flexible global search capacities. On the other hand, the abundant domain knowledge inherent in LLMs could enable EA to conduct more intelligent searches. Furthermore, the text processing and generative capabilities of LLMs would aid in deploying EAs across a wide range of tasks. Based on these complementary advantages, this article provides a thorough review and a forward-looking roadmap, categorizing the reciprocal inspiration into two main avenues: 1) LLM-enhanced EA and 2) EA-enhanced LLM. Some integrated synergy methods are further introduced to exemplify the complementarity between LLMs and EAs in diverse scenarios, including code generation, software engineering, neural architecture search, and various generation tasks. As the first comprehensive review focused on the EA research in the era of LLMs, this article provides a foundational stepping stone for understanding the collaborative potential of LLMs and EAs. The identified challenges and future directions offer guidance for researchers and practitioners to unlock the full potential of this innovative collaboration in propelling advancements in optimization and artificial intelligence. We have created a GitHub repository to index the relevant papers: https://github.com/wuxingyu-ai/LLM4EC.","1941-0026","","10.1109/TEVC.2024.3506731","National Key Research and Development Program of China(grant numbers:2022YFC3801700); Research Grants Council of the Hong Kong SAR(grant numbers:PolyU25216423,PolyU11211521,PolyU15218622,PolyU15215623,C5052-23G); Hong Kong Polytechnic University(grant numbers:P0043563,P0046094); National Natural Science Foundation of China(grant numbers:62306259,U21A20512); ","https://ieeexplore.ieee.org/stamp/stamp.jsp?arnumber=10767756","Algorithm generation;evolutionary algorithm (EA);large language model (LLM);neural architecture search (NAS);optimization problem;prompt engineering","Optimization;Closed box;Reviews;Evolutionary computation;Codes;Search problems;Collaboration;Surveys;Software engineering;Prompt engineering","","18","","164","IEEE","27 Nov 2024","","","IEEE","IEEE Journals"
"Cyberattack Correlation and Mitigation for Distribution Systems via Machine Learning","J. Appiah-Kubi; C. -C. Liu","The Bradley Department of Electrical and Computer Engineering, Virginia Polytechnic Institute and State University, Blacksburg, VA, USA; The Bradley Department of Electrical and Computer Engineering, Virginia Polytechnic Institute and State University, Blacksburg, VA, USA",IEEE Open Access Journal of Power and Energy,"24 Jan 2023","2023","10","","128","140","Cyber-physical system security for electric distribution systems is critical. In direct switching attacks, often coordinated, attackers seek to toggle remote-controlled switches in the distribution network. Due to the typically radial operation, certain configurations may lead to outages and/or voltage violations. Existing optimization methods that model the interactions between the attacker and the power system operator (defender) assume knowledge of the attacker’s parameters. This reduces their usability. Furthermore, the trend with coordinated cyberattack detection has been the use of centralized mechanisms, correlating data from dispersed security systems. This can be prone to single point failures. In this paper, novel mathematical models are presented for the attacker and the defender. The models do not assume any knowledge of the attacker’s parameters by the defender. Instead, a machine learning (ML) technique implemented by a multi-agent system correlates detected attacks in a decentralized manner, predicting the targets of the attacker. Furthermore, agents learn optimal mitigation of the communication level through Q-learning. The learned attacker motive is also used by the defender to determine a new configuration of the distribution network. Simulations of the technique have been performed using the IEEE 123-Node Test Feeder. The simulation results validate the capability and performance of the algorithm.","2687-7910","","10.1109/OAJPE.2023.3236429","U.S. National Science Foundation(grant numbers:1837359); projects(grant numbers:PR6ZBSTA); 5GPG sponsored by Commonwealth Cyber Initiative (CCI), State of Virginia; ","https://ieeexplore.ieee.org/stamp/stamp.jsp?arnumber=10015858","Intrusion detection;cyber security;anomaly detection;q-learning;reinforcement learning;multi-agent systems;entropy;distribution automation;distribution reconfiguration","Distribution networks;Cyberattack;Intrusion detection;Anomaly detection;Q-learning;Reinforcement learning;Multi-agent systems;Entropy","","9","","19","CCBY","12 Jan 2023","","","IEEE","IEEE Journals"
"Real-Time Implementation of Secure Distributed State Estimation for Networked Microgrids","M. Cintuglu; A. Kondabathini; D. Ishchenko",NA; NA; NA,2020 IEEE 6th World Forum on Internet of Things (WF-IoT),"13 Oct 2020","2020","","","1","6","State estimation functionality is essential for future power grids operations especially with the increased Distributed Energy Resources (DER) and microgrids penetration, as it can enhance system observability and help improving DER management and control in DER-rich energy delivery systems. Decentralized nature of the power grids with high DER penetration necessitates distributed implementation for both state estimation and control applications, as centralized approaches may no longer be feasible due to intermittent nature of DER and communication latencies of traditional SCADA. Secure distributed state estimation (SDSE) further enhances the distributed state estimation algorithm by addressing misbehaving node detection and isolation issues in a distributed environment.This paper presents a framework for real-time implementation and verification of cyber-physical SDSE. The developed framework is comprised of power-hardware-in-the-loop setup representing the electrical model of networked microgrids and the distributed microgrid control platform with peer-to-peer communications as the cyber infrastructure.Communication and interoperability architectures within a microgrid are established by leveraging IEC 61850 DER data model extensions. IEC 61850 GOOSE is applied for inter-microgrid communication, while intra-microgrid communication uses Open Field Message Bus (OpenFMB) data model with Data Distribution Service (DDS) protocol for distributed publish/subscribe messaging. The case study investigation illustrates how the developed real-time cyber-physical security framework addresses the emerging data integrity and false data injection security problems in a multi-microgrid environment.","","978-1-7281-5503-6","10.1109/WF-IoT48130.2020.9221310","","https://ieeexplore.ieee.org/stamp/stamp.jsp?arnumber=9221310","cyber-physical security;OpenFMB;DDS;distributed state estimation;misbehaving node detection;IEC 61850;microgrid;multi-agent systems;privacy","Protocols;Data integrity;Microgrids;Real-time systems;Data models;Peer-to-peer computing;Security","","4","","20","IEEE","13 Oct 2020","","","IEEE","IEEE Conferences"
"""Revolutionizing Farming: GAN-Enhanced Imaging, CNN Disease Detection, and LLM Farmer Assistant""","C. Dhavale; T. Pawar; A. Singh; S. Pole; K. Sabat","Information Technology Department, Xavier Institute of Engineering, Mumbai, India; Information Technology Department, Xavier Institute of Engineering, Mumbai, India; Information Technology Department, Xavier Institute of Engineering, Mumbai, India; Information Technology Department, Xavier Institute of Engineering, Mumbai, India; Information Technology Department, Xavier Institute of Engineering, Mumbai, India","2024 2nd International Conference on Computer, Communication and Control (IC4)","4 Apr 2024","2024","","","1","6","Crop disease recognition is a crucial aspect of modern agriculture that can significantly impact crop yield, quality, and overall food security. This paper introduces an innovative approach to crop disease recognition and farmer support by combining Generative AI and Langchain Llama Model for chatbot development. In the proposed system, Generative AI, specifically deep learning models, are employed to analyze images of crop leaves for early signs of diseases. This approach enhances the accuracy and efficiency of disease diagnosis, enabling farmers to take timely corrective actions and reduce the use of pesticides. A Generative Adversarial Network (GAN) is employed for image augmentation due to the limited dataset size. A Convolutional Neural Network (CNN) is utilized for precise crop disease recognition based on image analysis. To bridge the gap between technology and farmers, the Langchain Llama Model, a state-of-the-art conversational AI model, is integrated to create an interactive and user-friendly chatbot interface. The results of this research project demonstrate the potential of cutting-edge AI technology to transform agriculture, making it more accessible, efficient, and environmentally friendly. By empowering farmers with a sophisticated chatbot interface, this system paves the way for a smarter and more sustainable agricultural future.","","979-8-3503-8793-3","10.1109/IC457434.2024.10486501","","https://ieeexplore.ieee.org/stamp/stamp.jsp?arnumber=10486501","Crop disease recognition;Generative AI;CNN;Langchain LLaMa Model;chatbot","Training;Generative AI;Computational modeling;Crops;Transforms;Chatbots;Generative adversarial networks","","5","","16","IEEE","4 Apr 2024","","","IEEE","IEEE Conferences"
"Decomposition, Synthesis, and Attack: A Multi-Instruction Fusion Method for Jailbreaking LLMs","S. Jiang; X. Chen; K. Xu; L. Chen; H. Ren; R. Tang","School of Cyber Science and Engineering, Sichuan University, Chengdu, China; School of Cyber Science and Engineering, Sichuan University, Chengdu, China; School of Cyber Science and Engineering, Sichuan University, Chengdu, China; School of Cyber Science and Engineering, Sichuan University, Chengdu, China; School of Cyber Science and Engineering, Sichuan University, Chengdu, China; School of Cyber Science and Engineering, Sichuan University, Chengdu, China",IEEE Internet of Things Journal,"8 Apr 2025","2025","12","8","9420","9434","Large language models (LLMs) can transform natural language instructions into executable commands for IoT devices like autonomous aerial vehicles (AAVs), creating new development opportunities. However, safety concerns about LLMs translating commands into machine or program control instructions cannot be overlooked. Currently, jailbreak instructions used to test the LLM security are often restricted to specific modes or tasks, resulting in a lack of diversity and leaving some tasks unexplored. To address this issue, we introduce a multi-instruction fusion (MIF) method that can automatically fuse harmful prompts and various task instructions into jailbreaks. First, we adopt a reverse decomposition strategy to acquire sufficient supervised data for fusing harmful prompts and harmless task instructions into jailbreaks and construct a task instruction synthesizer based on it. Then, to determine the optimal instruction combinations in the vast combination space, we propose a representative-node-based selection strategy, ReNB, to rank and filter the instruction combinations on a few representative samples, thereby accelerating the identification of the valid ones. Experimental results demonstrate that MIF significantly improves the attack success rate (ASR), achieving over 90% on GPT-4o-mini, LLaMa2-70B, and Qwen2-7B models, outperforming the state-of-the-art (SOTA) baselines.","2327-4662","","10.1109/JIOT.2025.3525741","National Natural Science Foundation of China(grant numbers:62202320,62402331); Natural Science Foundation of Sichuan Province(grant numbers:2024NSFSC1449); Fundamental Research Funds for the Central Universities(grant numbers:SCU2024D012,YJ202429); Science and Engineering Connotation Development Project of Sichuan University(grant numbers:2020SCUNG129); ","https://ieeexplore.ieee.org/stamp/stamp.jsp?arnumber=10824840","Jailbreak attacks;large language model (LLM);autonomous aerial vehicles (AAVs)","Autonomous aerial vehicles;Natural languages;Synthesizers;Safety;Airports;Security;Internet of Things;Planning;Drones;Translation","","2","","78","IEEE","3 Jan 2025","","","IEEE","IEEE Journals"
"Are LLMs Correctly Integrated into Software Systems?","Y. Shao; Y. Huang; J. Shen; L. Ma; T. Su; C. Wan","East China Normal University, Shanghai, China; The University of Tokyo, Tokyo, Japan; East China Normal University, Shanghai, China; The University of Tokyo, Tokyo, Japan; East China Normal University, Shanghai, China; East China Normal University, Shanghai, China",2025 IEEE/ACM 47th International Conference on Software Engineering (ICSE),"23 Jun 2025","2025","","","1178","1190","Large language models (LLMs) provide effective solutions in various application scenarios, with the support of retrieval-augmented generation (RAG). However, developers face challenges in integrating LLM and RAG into software systems, due to lacking interface specifications, various requirements from software context, and complicated system management. In this paper, we have conducted a comprehensive study of 100 open-source applications that incorporate LLMs with RAG support, and identified 18 defect patterns. Our study reveals that 77 % of these applications contain more than three types of integration defects that degrade software functionality, efficiency, and security. Guided by our study, we propose systematic guidelines for resolving these defects in software life cycle. We also construct an open-source defect library HYDRANGEA [1].","1558-1225","979-8-3315-0569-1","10.1109/ICSE55347.2025.00204","National Natural Science Foundation of China(grant numbers:62402183,23CGA33); ","https://ieeexplore.ieee.org/stamp/stamp.jsp?arnumber=11029854","LLM;defects;empirical software engineering","Systematics;Large language models;Retrieval augmented generation;Software systems;Libraries;Security;Faces;Software engineering;Guidelines","","","","103","IEEE","23 Jun 2025","","","IEEE","IEEE Conferences"
"Evaluating Prompt Engineering for Generalized Power Line Segmentation","A. Hossain; M. Hasan; R. Abdelfattah; D. Scott; K. Abdelfatah; A. Sherif","School of Computing Sciences and Computer Engineering, University of Southern, Mississippi, MS, USA; School of Computing Sciences and Computer Engineering, University of Southern, Mississippi, MS, USA; School of Computing Sciences and Computer Engineering, University of Southern, Mississippi, MS, USA; Department of Computing Sciences, University of South, Carolina, SC, USA; CareerBuilder, Canada, CO ON, Canada; School of Computing Sciences and Computer Engineering, University of Southern, Mississippi, MS, USA",SoutheastCon 2025,"25 Apr 2025","2025","","","508","513","Power line segmentation is a critical task in infrastructure monitoring, UAV-based inspection, and autonomous navigation. Detecting power lines in aerial images presents significant challenges due to their thin structure, varying backgrounds, and occlusions caused by environmental elements. Recent advancements in multimodal large language models (MLLMs) and vision-based segmentation frameworks provide a new direction for improving segmentation accuracy using natural language instructions. This study investigates the effectiveness of prompt engineering in enhancing power line segmentation performance within the Generalized Segmentation Vision Assistant (GSVA) framework. By systematically evaluating different prompt strategies, we analyze how varying levels of prompt specificity influence the balance between precision, recall, and segmentation completeness. Our findings demonstrate that carefully structured prompts improve the model's ability to detect power lines while minimizing false positives from visually similar structures. Furthermore, we propose an optimized prompt that enhances segmentation performance by leveraging contrast-awareness, structural positioning, and adaptive instruction tuning. The results highlight the importance of prompt optimization in improving segmentation accuracy, particularly for thin-object detection in complex backgrounds.","1558-058X","979-8-3315-0484-7","10.1109/SoutheastCon56624.2025.10971697","","https://ieeexplore.ieee.org/stamp/stamp.jsp?arnumber=10971697","","Image segmentation;Adaptation models;Accuracy;Natural languages;Reliability engineering;Power grids;Safety;Prompt engineering;Optimization;Monitoring","","","","23","IEEE","25 Apr 2025","","","IEEE","IEEE Conferences"
"Generative AI for Education: A Retrieval-Augmented System for Effective Feedback in Self-Assessment","J. Martinez-Romo; L. Araujo; L. Plaza; F. López-Ostenero","Computer Systems and Languages Department, Universidad Nacional de Educación a Distancia (UNED), Madrid, Spain; Computer Systems and Languages Department, Universidad Nacional de Educación a Distancia (UNED), Madrid, Spain; Computer Systems and Languages Department, Universidad Nacional de Educación a Distancia (UNED), Madrid, Spain; Computer Systems and Languages Department, Universidad Nacional de Educación a Distancia (UNED), Madrid, Spain",2025 IEEE Global Engineering Education Conference (EDUCON),"3 Jun 2025","2025","","","1","9","The application of generative AI in education has shown significant potential to enhance learning outcomes by providing personalized, adaptive feedback to students. In this work, we present a novel Retrieval-Augmented Generation (RAG) system designed to improve the explanations and feedback provided to students during self-assessment activities. The system we developed is grounded in the course's reference material, ensuring that the feedback remains accurate, consistent, and contextually relevant to the student's curriculum. The system retrieves information directly from the textbook, reducing ambiguity and interpretation errors, and generates responses tailored to the specific needs of each student. The feedback is not only designed to correct misconceptions but also to reinforce key concepts, making the system a valuable tool for self-guided learning. In this study, we also explore the importance of prompt engineering in creating effective AI-generated feedback. We detail the iterative process used to optimize the prompts and the strategies employed to ensure high-quality, interpretable responses. The findings from this work suggest that generative AI, when integrated with subject-specific textbooks and careful prompt engineering, can significantly enhance the educational experience by providing dynamic, and contextually accurate feedback. This approach opens new possibilities for AI-driven education tools, contributing to more personalized and effective learning experiences.","2165-9567","979-8-3315-3949-8","10.1109/EDUCON62633.2025.11016446","","https://ieeexplore.ieee.org/stamp/stamp.jsp?arnumber=11016446","Self-assessment tools;formative feedback;computer science;generative IA;Retrieval augmented generation","Computer science;Accuracy;Retrieval augmented generation;Prompt engineering;Iterative methods;Engineering education","","1","","34","IEEE","3 Jun 2025","","","IEEE","IEEE Conferences"
