"The Machine Learning Solutions Architect Handbook: Practical strategies and best practices on the ML lifecycle, system design, MLOps, and generative AI","D. Ping",NA,"The Machine Learning Solutions Architect Handbook: Practical strategies and best practices on the ML lifecycle, system design, MLOps, and generative AI","","2024","","","","","Design, build, and secure scalable machine learning (ML) systems to solve real-world business problems with Python and AWS Purchase of the print or Kindle book includes a free PDF eBookKey FeaturesGo in-depth into the ML lifecycle, from ideation and data management to deployment and scalingApply risk management techniques in the ML lifecycle and design architectural patterns for various ML platforms and solutionsUnderstand the generative AI lifecycle, its core technologies, and implementation risksBook DescriptionDavid Ping, Head of GenAI and ML Solution Architecture for global industries at AWS, provides expert insights and practical examples to help you become a proficient ML solutions architect, linking technical architecture to business-related skills. You'll learn about ML algorithms, cloud infrastructure, system design, MLOps , and how to apply ML to solve real-world business problems. David explains the generative AI project lifecycle and examines Retrieval Augmented Generation (RAG), an effective architecture pattern for generative AI applications. You’ll also learn about open-source technologies, such as Kubernetes/Kubeflow, for building a data science environment and ML pipelines before building an enterprise ML architecture using AWS. As well as ML risk management and the different stages of AI/ML adoption, the biggest new addition to the handbook is the deep exploration of generative AI. By the end of this book , you’ll have gained a comprehensive understanding of AI/ML across all key aspects, including business use cases, data science, real-world solution architecture, risk management, and governance. You’ll possess the skills to design and construct ML solutions that effectively cater to common use cases and follow established ML architecture patterns, enabling you to excel as a true professional in the field.What you will learnApply ML methodologies to solve business problems across industriesDesign a practical enterprise ML platform architectureGain an understanding of AI risk management frameworks and techniquesBuild an end-to-end data management architecture using AWSTrain large-scale ML models and optimize model inference latencyCreate a business application using artificial intelligence services and custom modelsDive into generative AI with use cases, architecture patterns, and RAGWho this book is forThis book is for solutions architects working on ML projects, ML engineers transitioning to ML solution architect roles, and MLOps engineers. Additionally, data scientists and analysts who want to enhance their practical knowledge of ML systems engineering, as well as AI/ML product managers and risk officers who want to gain an understanding of ML solutions and AI risk management, will also find this book useful. A basic knowledge of Python, AWS, linear algebra, probability, and cloud infrastructure is required before you get started with this handbook.","","9781805124825","","","https://ieeexplore.ieee.org/xpl/ebooks/bookPdfWithBanner.jsp?fileName=10522581.pdf&bkn=10522580&pdfType=book","","","","","","","","8 May 2024","","","Packt Publishing","Packt Publishing eBooks"
"Enhancing Agricultural Advisory Services with Multilingual LLaMA and RAG","G. B. Mohan; C. M. J. Adhitya; A. Mithilesh","Department of Computer Science and Engineering, Amrita School of Computing, Amrita Vishwa Vidyapeetham, Chennai, India; Department of Computer Science and Engineering, Amrita School of Computing, Amrita Vishwa Vidyapeetham, Chennai, India; Department of Computer Science and Engineering, Amrita School of Computing, Amrita Vishwa Vidyapeetham, Chennai, India",2025 International Conference on Next Generation Communication & Information Processing (INCIP),"9 Jun 2025","2025","","","550","556","Agriculture, being a vital component of global food security, necessitates the development of innovative solutions to address the knowledge gap experienced by numerous farmers, particularly in developing countries where access to expert advice is scarce. In these areas, agricultural producers often depend on helplines for essential guidance, but the exorbitant costs and limited accessibility of these services create substantial obstacles. By automating responses to agricultural inquiries, the burden on traditional helpline systems can be alleviated, enabling farmers to access prompt and precise information. The combination of artificial intelligence and agriculture offers a chance to tackle these challenges, with advanced language models, especially transformers, demonstrating significant potential in comprehending intricate agricultural queries and delivering appropriate responses. This paper investigates how large language models (llms) can simplify the process of finding answers for farmers by utilizing their advanced language processing abilities. By analyzing a vast collection of over four million farmer inquiries from tamil nadu, india, encompassing diverse agricultural scenarios, this study showcases the efficacy of llms in bridging information gaps and equipping farmers with immediate access to crucial knowledge.","","979-8-3315-2814-0","10.1109/INCIP64058.2025.11019716","","https://ieeexplore.ieee.org/stamp/stamp.jsp?arnumber=11019716","Agriculture;Artificial Intelligence (AI);Large Language Models (LLMs);Transformers;Farmer Inquiries;Natural Language Processing (NLP);Precision Agriculture;Agricultural Information Systems","Precision agriculture;Large language models;Biological system modeling;Food security;Information processing;Metadata;Transformers;Solids;Natural language processing;Multilingual","","","","17","IEEE","9 Jun 2025","","","IEEE","IEEE Conferences"
"An RE'23 Workshop on Environment-Driven Requirements Engineering (EnviRE'23)","Z. Jin; N. Niu; Y. Yu","Peking University, Beijing, China; University of Cincinnati, Cincinnati, OH, USA; The Open University, Milton Keynes, UK",2023 IEEE 31st International Requirements Engineering Conference Workshops (REW),"28 Sep 2023","2023","","","168","169","We organize a one-day workshop on Environment-Driven Requirements Engineering (EnviRE'23) in conjunction with the 31st IEEE International Requirements Engineering Conference. With the rising influence of AI, IoT, and cyber-physical systems, we realize that the environment, in which the software operates, becomes more open and evolves rapidly with stakeholders' changing needs. EnviRE'23 features one keynote and seven accepted papers. In addition, we organize an interactive session with workshop participants to explore the role of large language models (LLMs), specifically ChatGPT, in requirements elicitation and modeling. Overall, the workshop is aimed at bringing the interested researchers and practitioners together, exchanging ideas and visions, and exploring a set of open problems to pursue in the years to come. Since the first edition of EnviRE in 2021, this is the first time that our workshop is held in person. We are excited to continue our workshop after the pandemic.","2770-6834","979-8-3503-2691-8","10.1109/REW57809.2023.00034","","https://ieeexplore.ieee.org/stamp/stamp.jsp?arnumber=10260948","open environment;modeling;adaptation;learning;requirements elicitation;AI-based systems","Pandemics;Conferences;Cyber-physical systems;Chatbots;Software;Requirements engineering;Stakeholders","","","","10","IEEE","28 Sep 2023","","","IEEE","IEEE Conferences"
"Zero-Shot and Few-Shot Learning for Telugu News Classification: A Large Language Model Approach","K. Boyina; G. M. Reddy; G. Akshita; P. C. Nair","Dept. of Computer Science and Engineering, Amrita School of Computing, Amrita Vishwa Vidyapeetham, Bengaluru, India; Dept. of Computer Science and Engineering, Amrita School of Computing, Amrita Vishwa Vidyapeetham, Bengaluru, India; Dept. of Computer Science and Engineering, Amrita School of Computing, Amrita Vishwa Vidyapeetham, Bengaluru, India; Dept. of Computer Science and Engineering, Amrita School of Computing, Amrita Vishwa Vidyapeetham, Bengaluru, India",2024 15th International Conference on Computing Communication and Networking Technologies (ICCCNT),"4 Nov 2024","2024","","","1","7","Telugu news classification involves categorizing news articles written in the Telugu language into five categories: business, editorial, entertainment, nation, and sport. Zero-shot classification enables categorization into unseen classes without any prior training on those specific classes. Few-shot classification generalizes with minimal training data by leveraging a limited number of labeled examples per class. This work leverages Large Language Models (LLMs) such as mBERT, Indic-BERT, XLM-Roberta, and Flan-T5 Large for zero-shot classification. For few-shot classification, models like Flan-T5 and BART are used in 1 -shot, 3 -shot, and 5 -shot scenarios. Traditional machine learning models including Support Vector Machines (SVM), Naive Bayes, AdaBoost, Random Forest, and Logistic Regression are also explored for comparison. Prompt engineering is employed with various prompts to enhance zero-shot classification performance. Among the LLMs, mBERT achieves the highest F1-score of 0.58 in zero-shot classification. For few-shot classification, Flan-T5 achieved an F1-score of $\mathbf{0. 2 3}$.","2473-7674","979-8-3503-7024-9","10.1109/ICCCNT61001.2024.10724558","","https://ieeexplore.ieee.org/stamp/stamp.jsp?arnumber=10724558","Zero-shot;Few-shot;Large Language Models;Prompt Engineering;mBERT;Flan-T5;Text Classification","Support vector machines;Training;Logistic regression;Large language models;Computational modeling;Training data;Prompt engineering;Few shot learning;Random forests;Sports","","5","","32","IEEE","4 Nov 2024","","","IEEE","IEEE Conferences"
"Detecting Security Requirements in GitHub Issues -Novel Dataset and SmallBERT-based model","P. Minina; A. Sadovykh; V. Ivanov","SOFTEAM, Paris, France; SOFTEAM, Paris, France; SOFTEAM, Paris, France",2023 IEEE International Conference on Cloud Computing Technology and Science (CloudCom),"25 Mar 2024","2023","","","315","318","Cloud application security initiates with the analysis of security requirements in DevOps. This involves gathering, managing, and tracking requirements within integrated issue-tracking systems found in repositories like GitHub. DevOps offers advantages in cloud app development, such as accelerated deployment, improved collaboration, and enhanced reliability. In DevOps, while many security verification tools are automated, security requirements analysis often relies on manual procedures. User feedback plays a pivotal role in shaping cloud application requirements, and the industry actively seeks automation solutions to expedite development. Prior research has demonstrated the limited performance of conventional NLP models trained on established datasets, such as PROMISE, when employed in the context of GitHub Issues. Recent studies have explored the integration of deep learning, particularly leveraging modern large language models and transfer learning architectures, to address requirements engineering challenges. However, a significant issue persists - the transferability of these models. While these models excel when applied to datasets similar to those they were trained on, their performance often drastically falls when dealing with external domains.In our paper, we introduce an automated method for classifying requirements within issue trackers. This method utilizes a novel dataset comprising 12,000 security and non-security issues collected from open GitHub repositories. We employed a SmallBERT-based model for training and conducted a series of experiments. Our research reaffirms the challenge related to the transferability of NLP models. Simultaneously, our model yields highly promising results when applied to GitHub Issues, even in challenging scenarios involving issues from projects that were not part of the training dataset and structured requirements texts from the PROMISE dataset. In summary, our approach significantly contributes to enhancing DevOps practices within cloud applications by automating security requirements analysis.","2380-8004","979-8-3503-3982-6","10.1109/CloudCom59040.2023.00058","","https://ieeexplore.ieee.org/stamp/stamp.jsp?arnumber=10475803","Security requirements;GitHub Issues;NLP;Classification;Dataset;Machine Learning;Deep learning;BERT","Training;Cloud computing;DevOps;Transfer learning;Natural language processing;Data models;Security","","","","34","IEEE","25 Mar 2024","","","IEEE","IEEE Conferences"
"Implementation of Graphical User Interface using Virtual Assistants based on LLMs","L. Bajčetić; D. Drašković; D. Bojić","School of Electrical Engineering, Innovation Center, University of Belgrade; School of Electrical Engineering, University of Belgrade, Belgrade, Serbia; School of Electrical Engineering, University of Belgrade, Belgrade, Serbia",2023 31st Telecommunications Forum (TELFOR),"1 Jan 2024","2023","","","1","4","This paper describes the process of implementing a graphical user interface (GUI) using two currently popular virtual assistants: ChatGPT 3.5 (OpenAI) and Bard (Google). The implementation process was divided into three phases: in the first phase, we defined the features of our GUI and selected Python Tkinter as the framework for building the application; in the second phase the user interface was implemented, and in the third phase the generated code was refactored and evaluated using the Flake8 linter. We have shown that virtual assistants can be efficient and convenient in the process of implementing a user interface, but they occasionally make unpredictable errors, so it is necessary to critically assess the software code they generate. ChatGPT proved to be easier to use because it less frequently produces unpredictable errors, but linting analysis showed that Bard generates code that adheres better to the PEP8 standard.","","979-8-3503-0313-1","10.1109/TELFOR59449.2023.10372613","","https://ieeexplore.ieee.org/stamp/stamp.jsp?arnumber=10372613","Code generation;GPT-3.5;Bard;Graphical User Interface;Python Tkinter;Flake8.","Codes;Virtual assistants;Chatbots;Software;Skeleton;Telecommunications;Task analysis","","","","6","IEEE","1 Jan 2024","","","IEEE","IEEE Conferences"
"Large Model Fine-tuning for Suicide Risk Detection Using Iterative Dual-LLM Few-Shot Learning with Adaptive Prompt Refinement for Dataset Expansion","J. Bi; W. Zhu; J. He; X. Zhang; C. Xian","The Hong Kong Polytechnic University, HKSAR, China; The Hong Kong Polytechnic University, HKSAR, China; The Hong Kong Polytechnic University, HKSAR, China; The Hong Kong Polytechnic University, HKSAR, China; The Hong Kong Polytechnic University, HKSAR, China",2024 IEEE International Conference on Big Data (BigData),"16 Jan 2025","2024","","","8520","8526","An approach to detecting suicide risk in social media posts is presented, addressing the challenges of limited and imbalanced datasets. The proposed workflow combines large language models (LLMs), few-shot learning, and expert-supervised prompt optimization. To address class imbalance, a novel Iterative Dual-LLM Few-Shot Learning with Adaptive Prompt Refinement (IDFL-APR) method for dataset expansion is introduced. This method employs two LLMs: one for classifying posts using few-shot learning, and another for dynamically optimizing prompts, with expert oversight to prevent overfitting. The optimized LLM then identifies high-confidence samples from unclassified data, focusing on underrepresented categories. Back-translation techniques are further applied to enhance textual diversity and achieve dataset balance across all categories. Subsequently, the bloomz-3b model is fine-tuned using optimized hyperparameters, implementing an active learning strategy to iteratively augment the training set. The proposed approach significantly enhances suicide risk detection accuracy. The best-performing model achieved a weighted F1-score of 0.7154 on the test set provided by the Suicide Ideation Detection on Social Media Challenge, a track of the IEEE Big Data 2024 BigData Cup. These results demonstrate a robust solution to the inherent challenges in suicide detection tasks.","2573-2978","979-8-3503-6248-0","10.1109/BigData62323.2024.10825974","","https://ieeexplore.ieee.org/stamp/stamp.jsp?arnumber=10825974","large language models;imbalanced dataset;prompt engineering;fine-tuning;active learning;social media analysis;suicide detection","Adaptation models;Accuracy;Social networking (online);Prevention and mitigation;Large language models;Active learning;Big Data;Data models;Iterative methods;Few shot learning","","","","29","IEEE","16 Jan 2025","","","IEEE","IEEE Conferences"
"Advanced Smart Contract Vulnerability Detection Using Large Language Models","F. Erfan; M. Yahyatabar; M. Bellaiche; T. Halabi","Department of Computer and Software Engineering, Polytechnique Montréal, Montréal, QC, Canada; Department of Computer and Software Engineering, Polytechnique Montréal, Montréal, QC, Canada; Department of Computer and Software Engineering, Polytechnique Montréal, Montréal, QC, Canada; Department of Computer Science, Université Laval, Québec, QC, Canada",2024 8th Cyber Security in Networking Conference (CSNet),"28 Jan 2025","2024","","","289","296","With the rapid expansion of using smart contracts, protecting the security of these contracts has become crucial. Existing analysis tools for detecting vulnerabilities in smart contracts are unreliable as they often fall short in accuracy, primarily due to their low recall rates-a significant challenge in this field. In this work, we utilize the open-source SolidiFi benchmark dataset to detect vulnerabilities related to Integer overflow/underflow (IoU), reentrancy (RE), and timestamp dependency (TD). These contracts, verified and available on Etherscan, proved unsuitable for direct application of LLMs due to comments, functions, and variables that might reveal the nature of the vulnerabilities. To address this, we performed several preprocessing steps to prepare the dataset for further research. We utilize a large language model to identify vulnerable code, provide reasoning for the vulnerabilities, explain how an attacker might exploit them, and propose fixed code. We design our prompts using chain-of-thought and expert patterns. Finally, we evaluate the results using various metrics and expert reviewers to assess the correctness of the reasoning, potential security risks, and code fixes. Our experiments demonstrate that our approach outperforms existing tools and methods. Notably, our recall rates are significantly high-93.5%, 95.4%, and 93.8%-addressing the challenge of low recall in detecting IoU, RE, and TD vulnerabilities, respectively.","2768-0029","979-8-3315-3410-3","10.1109/CSNet64211.2024.10851734","","https://ieeexplore.ieee.org/stamp/stamp.jsp?arnumber=10851734","smart contract vulnerability;large language model;GPT;security detection;Ethereum;solidity code analysis","Measurement;Analytical models;Codes;Accuracy;Large language models;Smart contracts;Benchmark testing;Cognition;Security;Computer crime","","1","","42","IEEE","28 Jan 2025","","","IEEE","IEEE Conferences"
"Keep it Local: Comparing Domain-Specific LLMs in Native and Machine Translated Text using Parallel Corpora on Political Conflict","J. Osorio; S. Alsarra; A. Converse; A. Alshammari; D. Heintze; L. Khan; N. Alatrush; P. T. Brandt; V. D’Orazio; N. Zawad; M. Billah","School of Government and Public Policy, University of Arizona, Tucson, United States; Department of Software Engineering, King Saud University, Riyadh, Saudi Arabia; Department of Linguistics, University of Arizona, Tucson, United States; Department of Computer Science, University of Texas – Dallas, Dallas, United States; School of Economic, Political and Policy Sciences, University of Texas – Dallas, Dallas, United States; Department of Computer Science, University of Texas – Dallas, Dallas, United States; Department of Computer Science, University of Texas – Dallas, Dallas, United States; School of Economic, Political and Policy Sciences, University of Texas – Dallas, Dallas, United States; Department of Political Science, West Virginia University, Morgantown, United States; Department of Computer Science, University of Texas – Dallas, Dallas, United States; Department of Computer Science, University of Texas – Dallas, Dallas, United States",2024 2nd International Conference on Foundation and Large Language Models (FLLM),"28 Jan 2025","2024","","","542","552","The dynamics of political conflict and cooperation require powerful computerized tools capable of effectively tracking security threats and cooperation around the world. This study compares the performance of domain-specific Large Language Models (LLMs) against generically-trained LLMs in binary and multi-class classification using native text in English, Spanish, and Arabic, and their corresponding machine translations. This endeavor yields four key contributions. 1) We present and make available a novel database of annotations using a multi-lingual parallel corpus from the United Nations. 2) Using various metrics, we assess the quality of different machine translation tools. 3) Our results indicate that the ConfliBERT family of LLMs, a set of domain-specific models tailored for political conflict, outperform generically-trained LLMs in English, Spanish, and Arabic in both binary and multi-class tasks. 4) We also disentangle the heterogeneous effects of machine translation on LLM performance in different languages. Overall, results reveal the comparative advantage of native-language domain-specific LLMs specialized on political conflict to understand the dynamics of violence and cooperation worldwide using native text. Our multi-lingual ConfliBERT LLMs provide critical cyber-infrastructure enabling scholars and government agencies use their local languages and information to foster safer, more stable political environments.","","979-8-3503-5479-9","10.1109/FLLM63129.2024.10852489","Army Research Office; ","https://ieeexplore.ieee.org/stamp/stamp.jsp?arnumber=10852489","Multilingual LLMs;machine translation;political conflict;United Nations","Measurement;Translation;Databases;Annotations;Computational modeling;Large language models;Government;Multilingual;Machine translation;Security","","","","72","IEEE","28 Jan 2025","","","IEEE","IEEE Conferences"
"Generative Artificial Intelligence: Principles, Potentials and Challenges","S. K. Routray; M. K. Jha; K. P. Sharmila; A. Javali; M. Pappa; M. Singh","Department of Computer Science and Engineering, CMR University, Bangalore, India; Department of Electronics and Communication Engineering, CMR Institute of Technology, Bangalore, India; Department of Electronics and Communication Engineering, CMR Institute of Technology, Bangalore, India; Department of Electronics and Communication Engineering, CMR Institute of Technology, Bangalore, India; Department of Electronics and Communication Engineering, CMR Institute of Technology, Bangalore, India; Department of Electronics and Communication Engineering, CMR Institute of Technology, Bangalore, India",2024 2nd International Conference on Self Sustainable Artificial Intelligence Systems (ICSSAS),"28 Nov 2024","2024","","","211","216","In recent years, we have witnessed the raise of several generative artificial intelligence (AI) products and services which have strong disruptive capabilities. Majority of these AI-based products and services are also very popular since their public availability. These generative AI products and services have a lot of potentials to do the common office works, writing codes, doing accounting tasks, predicting common patterns, generating creative contents, marketing products and services, increasing efficiencies in the systems, translating to different languages, designing products, and many such things. These effects of generative AI are phenomenal and it is going to start a large scale automation in the product design and service sectors. In addition to the benefits, several challenges are associated with generative AI. Starting from the bias to security risks to fake content creation, there are many challenges with these products and services. In this paper, we go through the basic principles of generative AI and then study its present and future prospects. We analyze its perilous effects and the common challenges with a few examples. Overall, generative AI can be beneficial tool if it is used positively under appropriate regulatory systems.","","979-8-3503-6841-3","10.1109/ICSSAS64001.2024.10760992","","https://ieeexplore.ieee.org/stamp/stamp.jsp?arnumber=10760992","Artificial intelligence;generative AI;prospects of generative AI;challenges of generative AI;applications of generative AI","Industries;Ethics;Codes;Generative AI;Navigation;Regulation;Product design;Security;Fake news;Standards","","1","","20","IEEE","28 Nov 2024","","","IEEE","IEEE Conferences"
