"Exploring LLMs for Verifying Technical System Specifications Against Requirements","L. M. Reinpold; M. Schieseck; L. P. Wagner; F. Gehlhoff; A. Fay","Institute of Automation Technology, Helmut Schmidt University, Hamburg, Germany; Institute of Automation Technology, Helmut Schmidt University, Hamburg, Germany; Institute of Automation Technology, Helmut Schmidt University, Hamburg, Germany; Institute of Automation Technology, Helmut Schmidt University, Hamburg, Germany; Chair of Automation, Ruhr University, Bochum, Germany",2024 IEEE 3rd Industrial Electronics Society Annual On-Line Conference (ONCON),"25 Mar 2025","2024","","","1","6","Requirements engineering is a knowledge intensive process and crucial for the success of engineering projects. The field of knowledge-based requirements engineering (KBRE) aims to support engineers by providing knowledge to assist in the elicitation, validation, and management of system requirements. The advent of large language models (LLMs) opens new opportunities in the field of KBRE. This work experimentally investigates the potential of LLMs in requirements verification. Therein, LLMs are provided with a set of requirements and a textual system specification and are prompted to assess which requirements are fulfilled by the system specification. Different experimental variables such as system specification complexity, the number of requirements, and prompting strategies were analyzed. Formal rule-based systems serve as a benchmark to compare LLM performance to. Requirements and system specifications are derived from the smart-grid domain. Results show that advanced LLMs, like GPT-4o and Claude 3.5 Sonnet, achieved f1-scores between 79 % and 94 % in identifying non-fulfilled requirements, indicating potential for LLMs to be leveraged for requirements verification.","","979-8-3315-4031-9","10.1109/ONCON62778.2024.10931625","","https://ieeexplore.ieee.org/stamp/stamp.jsp?arnumber=10931625","Large Language Model;Requirements Verification;Requirements Engineering","Knowledge engineering;Industrial electronics;Electric potential;Large language models;Knowledge based systems;Benchmark testing;Smart grids;Complexity theory;Requirements engineering","","1","","15","IEEE","25 Mar 2025","","","IEEE","IEEE Conferences"
"An LLM's Medical Testing Recommendations in a Nigerian Clinic: Potential and Limits of Prompt Engineering for Clinical Decision Support","G. McPeak; A. Sautmann; O. George; A. Hallal; E. A. Simal; A. L. Schwartz; J. Abaluck; N. Ravi; R. Pless","George Washington University, Computer Science; World Bank Development Research Group; Department of Research and Innovation, EHA Clinics; Department of Research and Innovation, EHA Clinics; World Bank Development Research Group; Department of Medical Ethics and Health Policy, Division of General Internal Medicine, University of Pennsylvania, Perelman, School of Medicine; Yale University, School of Management; Department of Research and Innovation, EHA Clinics; George Washington University, Computer Science",2024 IEEE 12th International Conference on Healthcare Informatics (ICHI),"22 Aug 2024","2024","","","586","591","We explore prompt designs for a lightweight integration of a large language model (LLM) into clinical decision support in primary care in Nigeria. The LLM integration is designed to give immediate, actionable “second opinions” to frontline healthworkers on their patient interaction notes. The assessment of a physician serves as a benchmark for the quality of the LLM feedback. A particular challenge was to counter the LLM's tendency to over-recommend laboratory testing, which is more in line with medical practice in high-income countries. We evaluate the ability of a range of prompt engineering approaches to better align the LLM's medical test recommendations with locally appropriate standards of clinical care.","2575-2634","979-8-3503-8373-7","10.1109/ICHI61247.2024.00094","NSF(grant numbers:DGE-2125677,IIS-2229885); ","https://ieeexplore.ieee.org/stamp/stamp.jsp?arnumber=10628629","LLM;clinical decision support;prompt engineering;LMIC;Healthcare in Developing Countries;Artificial Intelligence in Medicine;Generative AI;GPT-4","Training;Costs;Large language models;Benchmark testing;Medical tests;Prompt engineering;Informatics","","1","","14","IEEE","22 Aug 2024","","","IEEE","IEEE Conferences"
"Validation of Generative Visual Solutions Using Prompt Engineering and Caption Based Visual Reasoning Models","M. Arora; C. Garg; D. Mangla","Samsung Electronics, Noida, India; Samsung Electronics, Noida, India; Samsung Electronics, Noida, India",2025 International Conference on Machine Learning and Autonomous Systems (ICMLAS),"25 Apr 2025","2025","","","537","543","We introduce the novel approach of validation of artificially generated images which helps to validate the images based on the prompt given for the generated image. Existing methods involve generation of images based on the prompts, diffusion of images and modification of images, but fail to determine the correctness of the generated image with respect to the generated content and prompt given at user end. The prompt used for generating the image using generative artificial intelligence solutions can be comprehensive and can hold more than single perspective. To address this issue while validating computer visual solutions, we propose a method for the validation of generative visual solutions using prompt engineering and caption based visual reasoning models. The proposed solution determines the different perspectives and comprehensiveness of the prompts based on entities and attributes and then, multiple test cases are formed considering different perspectives, in more detailed and comprehensive format. Hence, proposed solution validates the generated image based on the text prompt engineered for comprehensive understanding based on the complexity of the prompt suitable for visual reasoning models.","","979-8-3315-0574-5","10.1109/ICMLAS64557.2025.10968513","","https://ieeexplore.ieee.org/stamp/stamp.jsp?arnumber=10968513","Visual reasoning;Prompt Engineering;LLM;Generative AI;Validation","Visualization;Scalability;Computational modeling;Machine learning;Reliability engineering;Distortion;Cognition;Reflection;Prompt engineering;Testing","","","","26","IEEE","25 Apr 2025","","","IEEE","IEEE Conferences"
"A Survey on Security and Privacy of Multimodal LLMs - Connected Healthcare Perspective","M. A. Rahman","Cyber Security and Forensic Computing Department, University of Prince Mugrin, Madinah, KSA",2023 IEEE Globecom Workshops (GC Wkshps),"21 Mar 2024","2023","","","1807","1812","Recently, large language and vision language models have shown tremendous success and industry acceptance for healthcare applications. While the firstgeneration models mostly showed advancement in language models, the second generation now offers multi-modal inputs such as audio, image/video, sensory data, and depth, which makes these more suitable toward healthcare applications. However, security and privacy of these multimodal large AI models is largely ignored due to lack of regulatory and compliance applied on these AI models. The healthcare industry requires robust security and privacy of AI models, privacypreserving, and regulation-compliant large language models as it is applied on end users. In this paper, we survey different multimodal large language models and their security and privacy concerns that need to be addressed before these language models can be democratized and accepted by the medical industry. The survey covers different security and privacy threats and vulnerabilities that have been raised by researchers and government bodies and defensive actions such as federated learning, differential privacy, and monitoring LLM processes that have been suggested as remedial actions.","","979-8-3503-7021-8","10.1109/GCWkshps58843.2023.10465035","","https://ieeexplore.ieee.org/stamp/stamp.jsp?arnumber=10465035","Deep Learning;AI;Internet of Medical Things","Surveys;Industries;Privacy;Federated learning;Government;Medical services;Data models","","12","","14","IEEE","21 Mar 2024","","","IEEE","IEEE Conferences"
"Towards Zero-Shot Differential Morphing Attack Detection with Multimodal Large Language Models","R. Shekhawat; H. Li; R. Ramachandra; S. Venkatesh","Norwegian University of Science and Technology (NTNU), Gjøvik, Norway; Norwegian University of Science and Technology (NTNU), Gjøvik, Norway; Norwegian University of Science and Technology (NTNU), Gjøvik, Norway; MOBAI AS, Gjøvik, Norway",2025 IEEE 19th International Conference on Automatic Face and Gesture Recognition (FG),"6 Aug 2025","2025","","","1","10","Leveraging the power of multimodal large language models (LLMs) offers a promising approach to enhancing the accuracy and interpretability of morphing attack detection (MAD), especially in real-world biometric applications. This work introduces the use of LLMs for differential morphing attack detection (D-MAD). To the best of our knowledge, this is the first study to employ multimodal LLMs to D-MAD using real biometric data. To effectively utilize these models, we design Chain-of-Thought (CoT)-based prompts to reduce failure-to-answer rates and enhance the reasoning behind decisions. Our contributions include: (1) the first application of multimodal LLMs for D-MAD using real data subjects, (2) CoT-based prompt engineering to improve response reliability and explainability, (3) comprehensive qualitative and quantitative benchmarking of LLM performance using data from 54 individuals captured in passport enrollment scenarios, and (4) comparative analysis of two multimodal LLMs: ChatGPT-4o and Gemini providing insights into their morphing attack detection accuracy and decision transparency. Experimental results show that ChatGPT-4o outperforms Gemini in detection accuracy, especially against GAN-based morphs, though both models struggle under challenging conditions. While Gemini offers more consistent explanations, ChatGPT-4o is more resilient but prone to a higher failure-to-answer rate.","2770-8330","979-8-3315-5341-8","10.1109/FG61629.2025.11099318","","https://ieeexplore.ieee.org/stamp/stamp.jsp?arnumber=11099318","","Accuracy;Large language models;Face recognition;Biological system modeling;Gesture recognition;Benchmark testing;Reliability engineering;Cognition;Prompt engineering","","","","34","IEEE","6 Aug 2025","","","IEEE","IEEE Conferences"
"Harnessing LLMs for IoT Malware Detection: A Comparative Analysis of BERT and GPT-2","M. Omar; H. M. Zangana; J. N. Al-Karaki; D. Mohammed","College of Computing, Illinois Institute of Technology, Chicago, USA; IT Department, Duhok Technical College, Duhok Polytechnic University, Duhok, Iraq; College of Interdisciplinary Studies, Zayed University, Abu Dhabi, UAE; College of CARDS, Saint Leo University, FL, USA",2024 8th International Symposium on Multidisciplinary Studies and Innovative Technologies (ISMSIT),"28 Nov 2024","2024","","","1","6","In recent years, the proliferation of Internet of Things (IoT) devices has introduced significant vulnerabilities in cybersecurity, particularly with the rise of sophisticated malware targeting these systems. Traditional detection methods, often based on static signatures, struggle to keep pace with evolving threats, such as zero-day attacks. This paper explores the application of Large Language Models (LLMs), specifically BERT and GPT-2, in detecting IoT malware by analyzing network traffic and identifying anomalies. Using the contextual understanding and adaptability of LLM, our approach significantly enhances detection accuracy compared to conventional methods. We evaluated the models using the ToN-IoT dataset, demonstrating their capability to detect complex malware patterns with higher precision. The results indicate that BERT outperforms GPT-2 across multiple metrics, highlighting its effectiveness in generalizing to various attack types. Despite promising advancements, challenges such as computational resource demands and model interpretability persist. Future research should focus on optimizing LLMs for real-time detection in resource-constrained environments and improving transparency to enhance trust among cybersecurity professionals. Our study underscores the potential of LLMs as powerful tools in the ongoing battle against IoT malware, offering a robust framework for enhancing cybersecurity defenses.","2770-7962","979-8-3503-5442-3","10.1109/ISMSIT63511.2024.10757249","","https://ieeexplore.ieee.org/stamp/stamp.jsp?arnumber=10757249","LLMs;Malware Detection;Cybersecurity;Risk Mitigation;AI Security","Measurement;Adaptation models;Accuracy;Computational modeling;Large language models;Telecommunication traffic;Malware;Real-time systems;Internet of Things;Computer security","","16","","47","IEEE","28 Nov 2024","","","IEEE","IEEE Conferences"
"BARTPredict: Empowering IoT Security with LLM-Driven Cyber Threat Prediction","A. Diaf; A. A. Korba; N. Elislem Karabadji; Y. Ghamri-Doudane","Laboratoire Reseaux et Systemes (LRS), Faculty of Technology, Badji Mokhtar-Annaba University, Algeria; Laboratoire Reseaux et Systemes (LRS), Faculty of Technology, Badji Mokhtar-Annaba University, Algeria; National Higher School of Technology and Engineering, Annaba, Algeria; L3I, University of La Rochelle, France",GLOBECOM 2024 - 2024 IEEE Global Communications Conference,"11 Mar 2025","2024","","","1239","1244","The integration of Internet of Things (IoT) technology in various domains has led to operational advancements, but it has also introduced new vulnerabilities to cybersecurity threats, as evidenced by recent widespread cyberattacks on IoT devices. Intrusion detection systems are often reactive, triggered by specific patterns or anomalies observed within the network. To address this challenge, this work proposes a proactive approach to anticipate and preemptively mitigate malicious activities, aiming to prevent potential damage before it occurs. This paper proposes an innovative intrusion prediction framework empowered by Pre-trained Large Language Models (LLMs). The framework incorporates two LLMs: a fine-tuned Bidirectional and Auto-Regressive Transformers (BART) model for predicting network traffic and a fine-tuned Bidirectional Encoder Representations from Transformers (BERT) model for evaluating the predicted traffic. By harnessing the bidirectional capabilities of BART the framework then identifies malicious packets among these predictions. Evaluated using the CICIoT2023 IoT attack dataset, our framework showcases a notable enhancement in predictive performance, attaining an impressive 98% overall accuracy, providing a powerful response to the cybersecurity challenges that confront IoT networks.","2576-6813","979-8-3503-5125-5","10.1109/GLOBECOM52923.2024.10901770","","https://ieeexplore.ieee.org/stamp/stamp.jsp?arnumber=10901770","Security;Intrusion Prediction;BART;BERT;Large Language Models;Transformers;Internet of Things (IoT)","Accuracy;Prevention and mitigation;Bidirectional control;Telecommunication traffic;Predictive models;Transformers;Encoding;Robustness;Internet of Things;Surges","","2","","21","IEEE","11 Mar 2025","","","IEEE","IEEE Conferences"
"The Application of LLMs in the Analysis and Modeling of Software Requirements","Z. Wang; C. Feng; L. Liu; G. Jiao; P. Ye","School of Computer Science and Artificial Intelligence, WuGuotao Jiaohan Textile University, China; School of Computer Science and Artificial Intelligence, WuGuotao Jiaohan Textile University, China; School of Computer Science and Artificial Intelligence, WuGuotao Jiaohan Textile University, China; School of Computer Science and Artificial Intelligence, WuGuotao Jiaohan Textile University, China; School of Computer Science and Artificial Intelligence, WuGuotao Jiaohan Textile University, China","2024 IEEE 24th International Conference on Software Quality, Reliability, and Security Companion (QRS-C)","29 Oct 2024","2024","","","1143","1153","In modern software engineering, requirements analysis and modeling are key steps in requirements engineering, influencing the subsequent system design and implementation. Traditional requirements analysis and modeling methods usually involve multiple stakeholders such as requirements providers and analysts working together collaboratively and iteratively, requiring a significant amount of manpower. It is of great significance to reduce the burden on requirements providers and analysts and improve the efficiency of analysis and modeling. In existing work, some merely utilize knowledge repositories to provide more knowledge in support of analysis or modeling, while others employ natural language processing (NLP) techniques to automate the analysis or modeling process. However, neither has relieved the burden on requirements providers and analysts. The emergence of large language models(LLMs) has brought new possibilities to requirements analysis and modeling. LLMs can combine knowledge base processing and understanding of large amounts of natural language data, providing a new automated requirement analysis method. This paper proposes an automated requirements analysis and modeling method for Support Vector Machine(SVM) classifier and LLMs - SVM-LLMs. The method is deployed based on the intelligent requirement service platform - “Wisdom Requirement Communication”, which combines SVM and LLMs to effectively improve the accuracy of requirements analysis and significantly reduce the time in the software development process.","2693-9371","979-8-3503-6565-8","10.1109/QRS-C63300.2024.00151","","https://ieeexplore.ieee.org/stamp/stamp.jsp?arnumber=10726944","Software Engineering;LLMs;Requirement Classification;Requirement Analysis;Requirement Modeling;Machine Learning","Support vector machines;Analytical models;Software quality;Natural language processing;Vectors;Software reliability;Stakeholders;System analysis and design;Software engineering;Software development management","","","","15","IEEE","29 Oct 2024","","","IEEE","IEEE Conferences"
"HDLEval Benchmarking LLMs for multiple HDLs","F. R. Kashanaki; M. Zakharov; J. Renau","Dept. of Computer Science and Engineering, University of California, Santa Cruz; Dept. of Computer Science and Engineering, University of California, Santa Cruz; Dept. of Computer Science and Engineering, University of California, Santa Cruz",2024 IEEE LLM Aided Design Workshop (LAD),"1 Oct 2024","2024","","","1","5","Large Language Models (LLMs) are transforming code generation and documentation processes across programming languages, including hardware description languages (HDLs). However, existing benchmarks primarily focus on individual HDLs, limiting comprehensive evaluations. To address this, we introduce HDLEval, a versatile benchmarking system that evaluates LLM performance across multiple HDLs, enabling meaningful comparisons. By sharing standardized test benches, HDLEval ensures consistent performance assessments between HDLs, offering insights into language-agnostic LLM capabilities.This system employs formal verification to verify generated code and leverages prompt engineering techniques to overcome syntactic differences between HDLs. HDLEval supports scalable evaluation, making it adaptable for current and future HDLs. Our experiments demonstrate how HDLEval can identify strengths and weaknesses in LLM-generated logic, providing a framework for improving HDL programming with LLMs.","","979-8-3503-7608-1","10.1109/LAD62341.2024.10691770","","https://ieeexplore.ieee.org/stamp/stamp.jsp?arnumber=10691770","LLM;Verilog","Codes;Limiting;Large language models;Benchmark testing;Syntactics;Programming;Hardware;Prompt engineering;Logic;Hardware design languages","","1","","12","IEEE","1 Oct 2024","","","IEEE","IEEE Conferences"
"A Domain-Adaptive Large Language Model With Refinement Framework For IoT Cybersecurity","X. Che; Y. Zheng; M. Zhu; Q. Li; X. Dong","School of Computer Science and Engineering, Nanjing University of Science and Technology, Nanjing, China; School of Computer Science and Engineering, Nanjing University of Science and Technology, Nanjing, China; Nari Group Corporation, Nanjing, China; School of Computer Science and Engineering, Nanjing University of Science and Technology, Nanjing, China; School of Cyber Science and Engineering, Nanjing University of Science and Technology, Nanjing, China","2024 IEEE International Conferences on Internet of Things (iThings) and IEEE Green Computing & Communications (GreenCom) and IEEE Cyber, Physical & Social Computing (CPSCom) and IEEE Smart Data (SmartData) and IEEE Congress on Cybermatics","31 Oct 2024","2024","","","224","229","To address the increasingly complex security challenges in Internet-of-Things (IoT) environments, Large Language Models (LLMs) have demonstrated effectiveness in enhancing device and data security, as well as improving the security and reliability overall IoT system. However, general LLMs struggle to effectively handle IoT security data. Therefore, developing IoT security domain-specific LLMs based on IoT-specific corpus and terminologies has become a key focus for enhancing cybersecurity defense capabilities. These areas of focus can be broadly categorized into three main directions: training from scratch, retrieval-augmented prompting, and instruction fine-tuning. Training from scratch is discouraged in cybersecurity due to its high computational and data requirements, making effective model training and convergence difficult given the scarcity of cybersecurity data. Retrieval-augmented prompting may suffer from incomplete or conflicting information, impacting the accuracy and reliability of the model. Conversely, instruction fine-tuning allows for the usage of domain-specific task instructions to adjust the model, achieving effective domain adaptation on limited datasets. However, inadequate or inaccurate instructions may degrade the generalization ability and performance. For these shortcomings, we propose a novel and robust fine-tuning framework to refine the original corpus and output a refined corpus for high-quality domain adaptation. Furthermore, we introduce two auxiliary strategies in the training phase to enhance efficiency and accuracy. Finally, our framework is evaluated across multiple task scenarios and demonstrates the best performance on most of them, which proves the effectiveness and efficiency of the model presented in this work.","2836-3701","979-8-3503-5163-7","10.1109/iThings-GreenCom-CPSCom-SmartData-Cybermatics62450.2024.00056","","https://ieeexplore.ieee.org/stamp/stamp.jsp?arnumber=10731743","Internet-of-Things (IoT);Large Language Models (LLMs);domain adaptation;instruction fine-tuning;cybersecurity","Training;Adaptation models;Accuracy;Costs;Computational modeling;Large language models;Data models;Security;Reliability;Computer security","","","","24","IEEE","31 Oct 2024","","","IEEE","IEEE Conferences"
"Software Vulnerability Detection using Large Language Models","M. D. Purba; A. Ghosh; B. J. Radford; B. Chu","Department of Software and Information Systems, University of North Carolina at Charlotte, NC, USA; Department of Software and Information Systems, University of North Carolina at Charlotte, NC, USA; Department of Political Science and Public Administration, University of North Carolina at Charlotte, NC, USA; Department of Software and Information Systems, University of North Carolina at Charlotte, NC, USA",2023 IEEE 34th International Symposium on Software Reliability Engineering Workshops (ISSREW),"2 Nov 2023","2023","","","112","119","Software development is among the first demonstrations of using Large Language Models (LLMs) to enhance human productivity. Such a co-pilot paradigm envisions LLM working side-by-side with human developers to assist in programming tasks. Ensuring the security of software products is a critical factor for the success of such a paradigm. There have been various anecdotal reports on the success of using LLMs to detect vulnerabilities in programs. This paper reports a set of experiments applying four well-known LLMs to two widely referenced public datasets to evaluate the performance of LLMs in detecting software vulnerabilities. Our results show a significant performance gap between these LLMs and those from popular static analysis tools, primarily due to their high false positive rates. However, LLMs show great promise in identifying subtle patterns commonly associated with software vulnerabilities. This observation suggests a possible path forward by combining LLMs and other program analysis techniques to achieve better software vulnerability detection.","","979-8-3503-1956-9","10.1109/ISSREW60843.2023.00058","","https://ieeexplore.ieee.org/stamp/stamp.jsp?arnumber=10301302","Cybersecurity;Large language model;AI;software vulnerability","Productivity;Codes;Static analysis;Writing;SQL injection;Programming;Software","","47","","30","IEEE","2 Nov 2023","","","IEEE","IEEE Conferences"
