"S-Health: LLM-driven and Lightweight Blockchain-based Secure Framework for Healthcare 5.0","A. Kumari; M. H. Shah; P. V. Sheth","Department of Computer Science and Engineering, Institute of Technology, Nirma University, Gujarat, India; Department of Computer Science and Engineering, Institute of Technology, Nirma University, Gujarat, India; Department of Computer Science and Engineering, Institute of Technology, Nirma University, Gujarat, India",2024 IEEE Globecom Workshops (GC Wkshps),"12 Aug 2025","2024","","","1","6","In Healthcare 5.0, the integration of Large Language Models (LLMs) and blockchain in healthcare is a transformative solution for safe and unaltered medical data analysis. In this paper, a framework is proposed, i.e., S-Health to perform the prediction analysis and medical report analysis based on the Internet of Things (IoT) healthcare data using the LLMs, which is integrated with lightweight blockchain technology for data security and integrity. Further, S-Health comprises an Interplanetary File System (IPFS), which is a decentralized file storage system that allows all stakeholders of S-Health to share analytical reports securely. Next, performance evaluation criteria like the Mean Absolute Error (MAE), Mean Squared Error (MSE), Accuracy, and the confusion matrix are adopted to measure the effectiveness of the developed framework. Thus, the results prove the efficiency of the suggested integration and show that it is more accurate and secure in the context of medical data analysis and storage than other available approaches. S-Health addresses key challenges in healthcare data management, presenting a robust solution for the modern healthcare industry.","2166-0077","979-8-3315-0567-7","10.1109/GCWkshp64532.2024.11100794","","https://ieeexplore.ieee.org/stamp/stamp.jsp?arnumber=11100794","Healthcare 5.0;LLM;Blockchain;IoT;Predictive Analytics","Data analysis;Accuracy;Data security;Scalability;Medical services;Blockchains;Internet of Things;InterPlanetary File System;Stakeholders;Predictive analytics","","","","15","IEEE","12 Aug 2025","","","IEEE","IEEE Conferences"
"CRALA: A Chinese-centric Risk Simulation and Assessment Framework for LLM Agents","W. Ye; Z. Zhang; W. Li; Y. Qin; P. Zhang","Chongqing No.8 Secondary School, Chongqing, China; Chongqing No.8 Secondary School, Chongqing, China; Chongqing No.8 Secondary School, Chongqing, China; Chongqing No.8 Secondary School, Chongqing, China; Tsinghua University, Beijing, China",2024 4th International Symposium on Artificial Intelligence and Intelligent Manufacturing (AIIM),"26 Mar 2025","2024","","","561","566","In recent years, large language models (LLMs) become more and more powerful. They can do many interesting tasks, like connecting to different external tools—sometimes we call them “plugins”—to help handle real things in the world. But at the same time, giving LLM agents more real-world power also creates a lot of risks we must be careful about. Checking these risks is not easy at all. It can cost lots of time and energy because we have to make special plugins and do complicated tests just to see if the model might do something unsafe. Most of the “serious” security checks, like the ones done on GPT-4, focus mostly on English. In Chinese, we know very little about the dangers with existing research. Many research pays attention to English, but not so much to Chinese cases, even though it’s super important. To fix this problem, we made a new framework called CRALA (Chinese-centric Risk Assessment for LLM Agents). It can simulate many situations in Chinese and then carefully check if there are any safety issues hiding inside these LLM agent tasks. CRALA includes two main parts: a Chinese Interaction Simulator, which creates and records pretend conversations, and an Evaluator, which looks at all these interactions and decides if interaction might be unsafe. We tested CRALA with human reviewers on 55 different Chinese scenarios. The results show that about $\mathbf{8 1. 5 \%}$ collected test cases are realistic. When the CRALA flags a case as dangerous, about 63.5% really were problems. We even tested 100 risky cases in Chinese apps with popular LLMs like GPT-4. GPT-4 only handled around 35% of them safely. This shows that we still have a long way to go before we can trust these agents completely, at least in Chinese contexts. In conclusion, CRALA makes checking these risks much less painful and gives us a better understanding of how safe Chinese LLM agents really are.","","979-8-3315-4172-9","10.1109/AIIM64537.2024.10934441","","https://ieeexplore.ieee.org/stamp/stamp.jsp?arnumber=10934441","component;Risk Simulation and Assessment;Chinese LLM Agents","Heavily-tailed distribution;Costs;Annotations;Large language models;Oral communication;Manuals;Safety;Manufacturing;Security;Risk management","","","","18","IEEE","26 Mar 2025","","","IEEE","IEEE Conferences"
"Initial Attempt at Automated Vulnerability Fixing of Obfuscated Smart Contracts Using a Large Language Model","C. Kado; T. Tsuchiya","Osaka University, Osaka, Japan; Osaka University, Osaka, Japan",2024 IEEE International Conference on Consumer Electronics-Asia (ICCE-Asia),"10 Dec 2024","2024","","","1","3","Countermeasures against vulnerabilities are essential for the security of smart contracts. Some recent studies have focused on automated vulnerability repair using large language models (LLMs). However, the ability of LLMs to fix unknown contracts is still unclear. To address this problem, we applied Code Llama LLM to a real-world smart contract with a vulnerability and its obfuscated version, assuming that the obfuscated version could be considered an unknown contract. We obtained three fixes generated by the LLM for each contract. Of these three, one fix was successful for each contract. While some fixes removed the vulnerability, they also altered the functionality of the contract. No clear difference was observed between the original and obfuscated contracts in terms of the LLM's repairing capability.","","979-8-3315-3083-9","10.1109/ICCE-Asia63397.2024.10773661","","https://ieeexplore.ieee.org/stamp/stamp.jsp?arnumber=10773661","Large language model;automated fix;Ethereum smart contract;vulnerability;obfuscation","Solid modeling;Codes;Large language models;Smart contracts;Maintenance engineering;Solids;Security","","","","14","IEEE","10 Dec 2024","","","IEEE","IEEE Conferences"
"Phishing Website Detection Method Based on Multimodal Large Language Model","C. Fang; X. Yin; P. Han","College of Electronic Information and Automation, Civil Aviation University of China, Tianjin, China; College of Electronic Information and Automation, Civil Aviation University of China, Tianjin, China; College of Electronic Information and Automation, Civil Aviation University of China, Tianjin, China","2025 8th International Conference on Advanced Electronic Materials, Computers and Software Engineering (AEMCSE)","24 Jun 2025","2025","","","264","268","In recent years, phishing attack methods have demonstrated characteristics of strong anti-detection abilities, resulting in significant economic losses. Traditional phishing website detection methods suffer from limited features and insufficient information, no longer meeting the practical requirements for effective security protection. To address complex and variable network phishing attacks, we propose a phishing website detection method based on multimodal large language models (LLMs). The different modalities of website features are transformed into text features by LLMs. The problem of detecting phishing websites is transformed into a text classification problem. The method we propose improves phishing website detection performance through the multimodal fusion of website information. Experimental evaluation on a public dataset demonstrates the method’s effectiveness, achieving an F1 score of 96.1%.","","979-8-3315-1091-6","10.1109/AEMCSE65292.2025.11042373","","https://ieeexplore.ieee.org/stamp/stamp.jsp?arnumber=11042373","Phishing Website;Multimodal;Large Language Model;Information Fusion;Text Classification","Economics;Social networking (online);Phishing;Large language models;Text categorization;Transforms;Feature extraction;Electronic mail;Protection;Software engineering","","","","14","IEEE","24 Jun 2025","","","IEEE","IEEE Conferences"
"Context-Aware AI for Real-Time Content and Quiz Recommendations in Student Learning Environments","A. Memeti; I. Neziri; N. Ajruli; K. Huseini; A. Nuhi; A. Iljazi","University of Tetova, Tetova, North Macedonia; University of Tetova, Tetova, North Macedonia; University of Tetova, Tetova, North Macedonia; University of Tetova, Tetova, North Macedonia; University of Tetova, Tetova, North Macedonia; University of Tetova, Tetova, North Macedonia",2025 3rd Cognitive Models and Artificial Intelligence Conference (AICCONF),"10 Jul 2025","2025","","","1","4","The paper presents a context-aware AI system designed to dynamically recommend course material and generate quizzes in real-time, based on the individual student interaction and performance. The proposed model integrates generative AI capability with a previously developed Learning Management System (LMS), using Blazor components for seamless user interface presentation and real-time system updates. Through the processing of contextual data such as enrolled courses, student activity, history, and participation patterns, the system acquires insight to generate intelligent content blocks and short quizzes tailored to the immediate needs of the learner. The artificial intelligence engine, which is built on large language models, is infused through guided questions that solicit recommended topics and related quiz items. Upon login by students, the dashboard includes an interactive ""Subject explanation"" panel, allowing real-time provision of AI-generated resources and quizzes, visually integrated using Blazor’s conditional rendering feature. This article describes the system design, implementation sequence, and deployment at the University of Tetova, illustrating how cognitive-aware AI can engage learners more and facilitate adaptive learning routes through autonomous, scalable learning augmentation.","","979-8-3315-0969-9","10.1109/AICCONF64766.2025.11063980","","https://ieeexplore.ieee.org/stamp/stamp.jsp?arnumber=11063980","Artificial Intelligence;Context-Aware Learning;Generative Models;Blazor components;Adaptive Assessment;Real-Time Recommendation;Personalized Education","Learning management systems;Adaptive learning;Adaptation models;Adaptive systems;System dynamics;Large language models;User interfaces;Real-time systems;Artificial intelligence;Context modeling","","","","12","IEEE","10 Jul 2025","","","IEEE","IEEE Conferences"
"Optimizing Malware Detection with Random Forest, XGBoost, LightGBM, and LLM-Reporting","A. Charoenthanakitkul; P. Viboonsang; S. Kosolsombat","Data Science and Innovation Program, College of Interdisciplinary Studies, Thammasat University, Pathum Thani, Thailand; Data Science and Innovation Program, College of Interdisciplinary Studies, Thammasat University, Pathum Thani, Thailand; Data Science and Innovation Program, College of Interdisciplinary Studies, Thammasat University, Pathum Thani, Thailand",2025 IEEE International Conference on Cybernetics and Innovations (ICCI),"12 May 2025","2025","","","1","5","This study presents a comprehensive framework for malware detection that integrates traditional machine learning algorithms with advanced large language models (LLMs) to enhance both classification accuracy and automated report generation. The proposed approach leverages three widely used machine learning models-Random Forest, XGBoost, and LightGBM-to classify different types of malwares based on extracted features from the EMBER dataset, a well-known benchmark dataset for malware analysis. Each of these models was trained and evaluated to determine their effectiveness in identifying malicious software with high accuracy. Among the tested algorithms, LightGBM exhibited the best performance, achieving an impressive classification accuracy of 83%. XGBoost followed closely with 81%, while Random Forest achieved an accuracy of 79%. To further enhance the usability of the system for cybersecurity analysts, the study incorporates a large language model, specifically LLaMA, which is accessed via an API. This model is employed to generate detailed, human-readable reports that provide insights into detected malware threats. By automating the reporting process, the framework aims to reduce the manual effort required for malware analysis, allowing security professionals to focus on high-priority threats. Future research will focus on improving classification performance through advanced feature engineering techniques and exploring deep learning-based neural network architectures to further enhance the accuracy and efficiency of malware detection and analysis.","","979-8-3315-3326-7","10.1109/ICCI64209.2025.10987272","","https://ieeexplore.ieee.org/stamp/stamp.jsp?arnumber=10987272","Malware Detection;Random Forest;XGBoost;LightGBM;LLM;Cybersecurity","Training;Analytical models;Accuracy;Machine learning algorithms;Computational modeling;Large language models;Feature extraction;Malware;Computer security;Random forests","","","","19","IEEE","12 May 2025","","","IEEE","IEEE Conferences"
"Distributed Generative Model: A Data Synthesizing Framework for Multi-Source Heterogeneous Data","Z. Xiong; W. Li; Y. Li; Z. Cai","Department of Computer Science, University of Nevada Las Vegas, Las Vegas, NV, USA; Department of Computer Science, Georgia State University, Atlanta, GA, USA; Department of Computer Science, Georgia State University, Atlanta, GA, USA; Department of Computer Science, Georgia State University, Atlanta, GA, USA",IEEE Transactions on Artificial Intelligence,"","2025","PP","99","1","13","Recent advancement in generative AI influenced a broad area with successful applications across multiple domains, including computer vision, natural language processing, and the Internet of Things (IoT). However, many existing implementations rely on centralized architectures, which introduce security and privacy concerns while also increasing communication overhead. Limited research has explored the development of distributed generative models, particularly in scenarios where training data originates from various heterogeneous sources. To fill the gap, this paper introduces a distributed generative model framework aimed at enhancing data generation in hierarchical IoT systems. The proposed framework supports distributed data generation across three distinct scenarios: feature-related data, label-related data, and feature-label non-related data. Furthermore, both synchronous and asynchronous update mechanisms are incorporated to accommodate diverse application requirements within IoT environments. Comprehensive experiments using simulated, image, and tabular datasets are conducted to assess the performance of the proposed framework in comparison with state-of-the-art methods. The results indicate that the framework effectively produces high-quality synthetic data while preserving the integrity of downstream tasks. Beyond large language models (LLMs), these findings suggest that generative AI have the potential to transform data generation in distributed IoT systems and be extended to a broader range of applications.","2691-4581","","10.1109/TAI.2025.3575548","","https://ieeexplore.ieee.org/stamp/stamp.jsp?arnumber=11022721","Distributed Learning;Generative Adversarial Networks;Multi-source Heterogeneous Data;Federated Learning","Distributed databases;Data models;Training;Internet of Things;Generators;Data collection;Servers;Artificial intelligence;Computational modeling;Soft sensors","","","","","IEEE","3 Jun 2025","","","IEEE","IEEE Early Access Articles"
"Verifying Computation Tree Logic of Knowledge via the Similar Reachability Graphs of Knowledge-oriented Petri Nets","L. He; G. Liu","Department of Computer Science, Tongji University, Shanghai, P. R. China; Department of Computer Science, Tongji University, Shanghai, P. R. China",2020 39th Chinese Control Conference (CCC),"9 Sep 2020","2020","","","5026","5031","Computation Tree Logic of Knowledge (CTLK) can specify many requirements of privacy or security of multi-agent systems (MAS). In our previous paper, we defined Knowledge-oriented Petri Nets (KPN) to model MAS. A KPN is a special Petri net in which some places are used to represent knowledge. Consequently, KPN can formally represent not only the interaction/collaboration process of multiple agents but also their epistemic evolutions. These epistemic evolutions are closely related to privacy and security of MAS. Then we defined the similar reachability graphs of KPN and constructed the equivalence classes of knowledge for each agent. We considered an epistemic operator K and designed its model checking algorithm based on similar reachability graph and equivalence class. In this paper, we design the model checking algorithm for another epistemic operator C. Additionally, we develop a related tool. Examples of privacy protocols illustrate the usefulness of our model and method.","1934-1768","978-9-8815-6390-3","10.23919/CCC50068.2020.9188719","","https://ieeexplore.ieee.org/stamp/stamp.jsp?arnumber=9188719","Epistemic Logic;Equivalence Class;Model Checking;Petri Nets","Petri nets;Protocols;Model checking;Privacy;Receivers;Security;Tools","","5","","22","","9 Sep 2020","","","IEEE","IEEE Conferences"
"The Ultimate Battle Against Zero-Day Exploits: Toward Fully Autonomous Cyber-Physical Defense","T. Halabi; M. Zulkernine","Université Laval, Québec, QC, Canada; Queen's University, Kingston, ON, Canada",2023 IEEE International Conference on Software Services Engineering (SSE),"4 Sep 2023","2023","","","256","261","The last decade has shown that networked cyber-physical systems (NCPS) are the future of critical infrastructure such as transportation systems and energy production. However, they have introduced an uncharted territory of security vulnerabilities and a wider attack surface, mainly due to network openness and the deeply integrated physical and cyber spaces. On the other hand, relying on manual analysis of intrusion detection alarms might be effective in stopping run-of-the-mill automated probes but remain useless against the growing number of targeted, persistent, and often AI-enabled attacks on large-scale NCPS. Hence, there is a pressing need for new research directions to provide advanced protection. This paper introduces a novel security paradigm for emerging NCPS, namely Autonomous Cyber-Physical Defense (ACPD). We lay out the theoretical foundations and describe the methods for building autonomous and stealthy cyber-physical defense agents that are able to dynamically hunt, detect, and respond to intelligent and sophisticated adversaries in real time without human intervention. By leveraging the power of game theory and multi-agent reinforcement learning, these self-learning agents will be able to deploy complex cyber-physical deception scenarios on the fly, generate optimal and adaptive security policies without prior knowledge of potential threats, and defend themselves against adversarial learning. Nonetheless, serious challenges including trustworthiness, scalability, and transfer learning are yet to be addressed for these autonomous agents to become the next-generation tools of cyber-physical defense.","","979-8-3503-4075-4","10.1109/SSE60056.2023.00041","","https://ieeexplore.ieee.org/stamp/stamp.jsp?arnumber=10234329","Cyber-physical security;reinforcement learning;autonomous and adaptive defense;advanced persistent threats","Scalability;Transfer learning;Transportation;Reinforcement learning;Production;Pressing;Software","","3","","26","IEEE","4 Sep 2023","","","IEEE","IEEE Conferences"
"A Vision for Operationalising Diversity and Inclusion in AI","M. Bano; D. Zowghi; V. Gervasi","CSIRO’s Data61, Clayton, VIC, Australia; CSIRO’s Data61, Eveleigh, NSW, Australia; Department of Computer Science, Pisa University, Italy",2024 IEEE/ACM International Workshop on Responsible AI Engineering (RAIE),"11 Sep 2024","2024","","","36","43","The growing presence of Artificial Intelligence (AI] in various sectors necessitates systems that accurately reflect societal diversity. This study seeks to envision the operationalization of the ethical imperatives of diversity and inclusion (D&I] within AI ecosystems, addressing the current disconnect between ethical guidelines and their practical implementation. A significant challenge in AI development is the effective operationalization of D&I principles, which is critical to prevent the reinforcement of existing biases and ensure equity across AI applications. This paper proposes a vision of a framework for developing a tool utilizing persona-based simulation by Generative AI (GenAI]. The approach aims to facilitate the representation of the needs of diverse users in the requirements analysis process for AI software. The proposed framework is expected to lead to a comprehensive persona repository with diverse attributes that inform the development process with detailed user narratives. This research contributes to the development of an inclusive AI paradigm that ensures future technological advances are designed with a commitment to the diverse fabric of humanity.CCS CONCEPTS• Social and professional topics ~ User characteristics • Software and its engineering ~ Software creation and management ~ Designing software ~ Requirements analysis • Computing methodologies ~ Artificial intelligence ~ Natural language processing ~ Natural language generation","","979-8-4007-0572-4","","","https://ieeexplore.ieee.org/stamp/stamp.jsp?arnumber=10669894","Artificial Intelligence;Diversity and Inclusion;Requirements Engineering;Persona","Ethics;Generative AI;Ecosystems;Natural language generation;Software;Cultural differences;Artificial intelligence","","1","","34","CCBY","11 Sep 2024","","","IEEE","IEEE Conferences"
"Multi-Agent Resilient Control Based on False Data Injection Attacks","W. Yu; Z. Guo; P. Suo; N. Li; Z. Song; L. Deng","Yingkou Power Supply Company State Grid Liaoning Electric Power Co., Ltd., Yingkou, China; Yingkou Power Supply Company State Grid Liaoning Electric Power Co., Ltd., Yingkou, China; Yingkou Power Supply Company State Grid Liaoning Electric Power Co., Ltd., Yingkou, China; Yingkou Power Supply Company State Grid Liaoning Electric Power Co., Ltd., Yingkou, China; Yingkou Power Supply Company State Grid Liaoning Electric Power Co., Ltd., Yingkou, China; Yingkou Power Supply Company State Grid Liaoning Electric Power Co., Ltd., Yingkou, China",2024 Second International Conference on Cyber-Energy Systems and Intelligent Energy (ICCSIE),"7 Oct 2024","2024","","","1","5","The paper introduces a resilient control method for nonlinear multi-agent systems (MAS). The attack type considered in this paper is FDI (False Data Injection) attacks targeting the controller. The consequence of the attack is the occurrence of controller malfunction. In industrial control systems, FDI attacks pose a significant security threat. Instead of relying on global information about the communication network, this method allows agents to exchange information locally with their neighboring agents. Each agent has its own control mechanism, which helps avoid the need for centralized communication. Furthermore, this approach addresses the issue of elastic control in the presence of FDI attacks. It ensures that the system can continue to operate smoothly even when encountering unknown abnormal parameters. By carefully selecting Lyapunov functions, the paper demonstrates that the system achieves stable consensus between leaders and followers in a multi-agent setting.","","979-8-3503-7331-8","10.1109/ICCSIE61360.2024.10698075","","https://ieeexplore.ieee.org/stamp/stamp.jsp?arnumber=10698075","Cooperated control;nonlinear system","Industrial control;Control systems;Security;Communication networks;Information exchange;Multi-agent systems;Matlab;Lyapunov methods","","","","19","IEEE","7 Oct 2024","","","IEEE","IEEE Conferences"
