"Large Language Models Powered Context-aware Motion Prediction in Autonomous Driving","X. Zheng; L. Wu; Z. Yan; Y. Tang; H. Zhao; C. Zhong; B. Chen; J. Gong","Institute for AI Industry Research, Tsinghua University, Beijing, China; Institute for AI Industry Research, Tsinghua University, Beijing, China; Institute for AI Industry Research, Tsinghua University, Beijing, China; Institute for AI Industry Research, Tsinghua University, Beijing, China; Institute for AI Industry Research, Tsinghua University, Beijing, China; Institute for AI Industry Research, Tsinghua University, Beijing, China; Institute for AI Industry Research, Tsinghua University, Beijing, China; Institute for AI Industry Research, Tsinghua University, Beijing, China",2024 IEEE/RSJ International Conference on Intelligent Robots and Systems (IROS),"25 Dec 2024","2024","","","980","985","Motion prediction is among the most fundamental tasks in autonomous driving. Traditional methods of motion forecasting primarily encode vector information of maps and historical trajectory data of traffic participants, lacking a comprehensive understanding of overall traffic semantics, which in turn affects the performance of prediction tasks. In this paper, we utilized Large Language Models (LLMs) to enhance the global traffic context understanding for motion prediction tasks. We first conducted systematic prompt engineering, visualizing complex traffic environments and historical trajectory information of traffic participants into image prompts— Transportation Context Map (TC-Map), accompanied by corresponding text prompts. Through this approach, we obtained rich traffic context information from the LLM. By integrating this information into the motion prediction model, we demonstrate that such context can enhance the accuracy of motion predictions. Furthermore, considering the cost associated with LLMs, we propose a cost-effective deployment strategy: enhancing the accuracy of motion prediction tasks at scale with 0.7% LLM-augmented datasets. Our research offers valuable insights into enhancing the understanding of traffic scenes of LLMs and the motion prediction performance of autonomous driving. The source code is available at https://github.com/AIR-DISCOVER/LLM-Augmented-MTR and https://aistudio.baidu.com/projectdetail/7809548.","2153-0866","979-8-3503-7770-5","10.1109/IROS58592.2024.10802397","","https://ieeexplore.ieee.org/stamp/stamp.jsp?arnumber=10802397","","Accuracy;Systematics;Large language models;Transportation;Predictive models;Vectors;Trajectory;Prompt engineering;Autonomous vehicles;Context modeling","","4","","25","IEEE","25 Dec 2024","","","IEEE","IEEE Conferences"
"LLM-based Interactive Code Generation: Empirical Evaluation","D. Shaikhelislamov; M. Drobyshevskiy; A. Belevantsev","Moscow Institute of Physics and Technology (State University), Moscow, Russia; Moscow Institute of Physics and Technology (State University), Moscow, Russia; Ivannikov Institute for System Programming of the Russian Academy of Sciences, Moscow, Russia",2024 Ivannikov Ispras Open Conference (ISPRAS),"28 Feb 2025","2024","","","1","5","Recently, large language models (LLMs), those pretrained on code, have demonstrated strong capabilities in generating programs from informal natural language intent. However, LLM -generated code is prone to bugs. Developers interacting with LLMs seek trusted code and, ideally, clear indications of potential bugs and vulnerabilities. Verified code can mitigate potential business risks associated with adopting generated code. We use model-agnostic framework CodePatchLLM, an extension for LLM that utilizes Svace feedback to enhance code generation quality. We evaluate CodePatchLLM on four popular LLMs across three datasets. Our experiments show an average absolute reduction of 19.1 % in static analyzer warnings for Java across all datasets and models, while preserving pass@ 1 code generation accuracy.","2767-9535","979-8-3315-2602-3","10.1109/ISPRAS64596.2024.10899123","","https://ieeexplore.ieee.org/stamp/stamp.jsp?arnumber=10899123","Large Language Model;Code verification;Trusted code","Analytical models;Codes;Accuracy;Large language models;Computer bugs;Natural languages;Programming;Safety;Security;Reliability","","","","36","IEEE","28 Feb 2025","","","IEEE","IEEE Conferences"
"Automated question generation from job descriptions using large language models: an evaluation of role-fit and fairness","N. Ahmed; Z. Iqbal; R. Khan; F. N. Al-Aswadi; G. S. AlDharhani; H. Y. Chan","Smart Zone Leaders, Kharian, Dist. Gujrat, Pakistan; Department of Computer Science, Air University, Kharian, Pakistan; Smart Zone Leaders, Kharian, Dist. Gujrat, Pakistan; Institute of Computer Science & Digital Innovation (ICSDI), UCSI University, Kuala Lumpur 56000, Malaysia; Institute of Computer Science & Digital Innovation (ICSDI), UCSI University, Kuala Lumpur 56000, Malaysia; School of Computer Sciences, Universiti Sains Malaysia, Pulau Pinang, Malaysia","International Conference on Energy, Power, Environment, Control and Computing (ICEPECC 2025)","18 Apr 2025","2025","2025","","628","635","This paper introduces an automated framework for generating high-quality, role-specific interview questions directly from complex job descriptions using an ensemble of Large Language Models (LLMs). We leverage seven advanced LLMs (gemma2-9b-it,gemma-7b-it,llama-3.3-70b-versatile,llama-3.1-8b-instant,llama3-70b-8192,mixtral-8x7b-32768, andOpenAI-3.5) to produce a diverse pool of questions. Our approach integrates prompt engineering and debiasing strategies to ensure that the generated questions are contextually relevant, role-aligned, and free from harmful biases. We compare the LLMs’ outputs against a strong baseline (ChatGPT o1 Pro) and human domain experts’ assessments, employing a multi-faceted evaluation framework including relevance, clarity, specificity, and fairness metrics. Our results, validated on a curated set of job descriptions across multiple industries, demonstrate that a multi-model generation strategy, combined with bias mitigation and expert-informed prompt design, yields superior interview question sets. This research offers insights into enhancing recruitment practices, improving efficiency, and fostering equitable candidate assessment.","","978-1-83724-315-0","10.1049/icp.2025.1174","","https://ieeexplore.ieee.org/stamp/stamp.jsp?arnumber=10969684","","","","","","","","18 Apr 2025","","","IET","IET Conferences"
"HoneyLLM: Enabling Shell Honeypots with Large Language Models","C. Guan; G. Cao; S. Zhu","Department of Computer Science and Engineering, The Pennsylvania State University; Department of Computer Science and Engineering, The Pennsylvania State University; Department of Computer Science and Engineering, The Pennsylvania State University",2024 IEEE Conference on Communications and Network Security (CNS),"31 Oct 2024","2024","","","1","9","Large Language Models (LLMs) have shown significant potential across various domains, including cybersecurity. This paper introduces HoneyLLM, a novel approach to creating high-fidelity shell honeypots using LLMs. We first investigate the potential of different commercial LLMs to emulate shell environments, identifying their characteristics and key challenges in accuracy and consistency. To address these issues, we propose leveraging various prompt engineering techniques, including incontext learning to tackle accuracy-related issues and the chain-of-thought method to maintain response consistency across complex, multi-step attack sessions. Additionally, we design a hybrid architecture for HoneyLLM to handle real-world limitations and improve cost-effectiveness. Through comprehensive offline evaluations, we demonstrate that HoneyLLM can effectively emulate shell environments and handle complex attack scenarios. Our online deployment results show that HoneyLLM, particularly when powered by advanced models like GPT-4, significantly outperforms traditional honeypots in maintaining longer, more effective attack sessions.","2994-5895","979-8-3503-7596-1","10.1109/CNS62487.2024.10735663","Army Research Laboratory; ","https://ieeexplore.ieee.org/stamp/stamp.jsp?arnumber=10735663","","Accuracy;Filters;Large language models;Network security;Prompt engineering;History;Computer security","","","","34","IEEE","31 Oct 2024","","","IEEE","IEEE Conferences"
"Generative AI for Cyber Threat-Hunting in 6G-enabled IoT Networks","M. A. Ferrag; M. Debbah; M. Al-Hawawreh","Technology Innovation Institute, 9639 Masdar City, Abu Dhabi, UAE; Technology Innovation Institute, 9639 Masdar City, Abu Dhabi, UAE; School of Information Technology, Deakin University, Australia","2023 IEEE/ACM 23rd International Symposium on Cluster, Cloud and Internet Computing Workshops (CCGridW)","19 Jul 2023","2023","","","16","25","The next generation of cellular technology, 6G, is being developed to enable a wide range of new applications and services for the Internet of Things (IoT). One of 6G’s main advantages for IoT applications is its ability to support much higher data rates and bandwidth as well as to support ultralow latency. However, with this increased connectivity will come to an increased risk of cyber threats, as attackers will be able to exploit the large network of connected devices. Generative Artificial Intelligence (AI) can be used to detect and prevent cyber attacks by continuously learning and adapting to new threats and vulnerabilities. In this paper, we discuss the use of generative AI for cyber threat-hunting (CTH) in 6G-enabled IoT networks. Then, we propose a new generative adversarial network (GAN) and Transformer-based model for CTH in 6Genabled IoT Networks. The experimental analysis results with a new cyber security dataset demonstrate that the Transformer-based security model for CTH can detect IoT attacks with a high overall accuracy of 95%. We examine the challenges and opportunities and conclude by highlighting the potential of generative AI in enhancing the security of 6G-enabled IoT networks and call for further research to be conducted in this area.","","979-8-3503-0208-0","10.1109/CCGridW59191.2023.00018","","https://ieeexplore.ieee.org/stamp/stamp.jsp?arnumber=10181170","Generative AI;Security;GPT;GAN;IoT;6G","6G mobile communication;Analytical models;Scalability;Training data;Transformers;Generative adversarial networks;Tokenization","","39","","17","IEEE","19 Jul 2023","","","IEEE","IEEE Conferences"
"A Generative AI Approach for Ensuring Data Integrity Security Resilience in Fintech Systems","P. Chatterjee; D. Das; D. B. Rawat","Department of EE and CS, Howard University, Washington, DC, USA; Department of CS and DS, Meharry Medical College, TN, USA; Department of EE and CS, Howard University, Washington, DC, USA","2024 IEEE 24th International Symposium on Cluster, Cloud and Internet Computing Workshops (CCGridW)","11 Oct 2024","2024","","","168","173","The Fintech industry represents the convergence of finance and technology through innovative digital solutions from mobile banking to cryptocurrency. However, it faces big challenges with keeping data safe and systems strong. Traditional methods struggle to keep pace with sophisticated threats and complexities inherent in modern Fintech ecosystems. This paper proposes an approach to address these challenges using Generative AI and blockchain integration to make Fintech systems more resilient. Advanced machine learning algorithms detect and prevent data tampering in the proposed systems. Generative AI is used for threat detection, anomaly recognition, and real-time monitoring in system security. Then, we integrate blockchain technology to enhance the overall resilience of systems. Blockchain technology enhances the reliability of financial services in secure transactions, validating blocks, and distributing control across decentralized networks. These combined methodologies address the critical challenges of data integrity, security, and system resilience in dynamic Fintech systems. The performance analysis demonstrates the efficacy of our proposed framework in enhancing data integrity, security measures, and system resilience within Fintech systems.","","979-8-3503-7751-4","10.1109/CCGridW63211.2024.00027","Impact Fund; Howard University; ","https://ieeexplore.ieee.org/stamp/stamp.jsp?arnumber=10707467","Fintech;Data Integrity;Security;Resilience;Generative Artificial Intelligence;Machine Learning;Cybersecurity","Fault tolerance;Generative AI;Data integrity;Smart contracts;Threat assessment;Real-time systems;Blockchains;Security;Faces;Resilience","","2","","22","IEEE","11 Oct 2024","","","IEEE","IEEE Conferences"
"Can ChatGPT Repair Non-Order-Dependent Flaky Tests?","Y. Chen; R. Jabbarvand",University of Illinois Urbana-Champaign; University of Illinois Urbana-Champaign,2024 IEEE/ACM International Flaky Tests Workshop (FTW),"10 Sep 2024","2024","","","22","29","Regression testing helps developers check whether the latest code changes break software functionality. Flaky tests, which can non-deterministically pass or fail on the same code version, may mislead developers’ concerns, resulting in missing some bugs or spending time pinpointing bugs that do not exist. Existing flakiness detection and mitigation techniques have primarily focused on general order-dependent (OD) and implementation-dependent (ID) flaky tests. There is also a dearth of research on repairing test flakiness, out of which, mostly have focused on repairing OD flaky tests, and a few have explored repairing a subcategory of non-order-dependent (NOD) flaky tests that are caused by asynchronous waits. As a result, there is a demand for devising techniques to reproduce, detect, and repair NOD flaky tests. Large language models (LLMs) have shown great effectiveness in several programming tasks. To explore the potential of LLMs in addressing NOD flakiness, this paper investigates the possibility of using ChatGPT to repair different categories of NOD flaky tests. Our comprehensive study on 118 from the IDoFT dataset shows that ChatGPT, despite as a leading LLM with notable success in multiple code generation tasks, is ineffective in repairing NOD test flakiness, even by following the best practices for prompt crafting. We investigated the reasons behind the failure of using ChatGPT in repairing NOD tests, which provided us valuable insights about the next step to advance the field of NOD test flakiness repair.CCS CONCEPTS• Software and its engineering → Software testing and debugging.","","979-8-4007-0558-8","","","https://ieeexplore.ieee.org/stamp/stamp.jsp?arnumber=10669636","Software Testing;Test Flakiness;Large Language Models","Software testing;Codes;Prevention and mitigation;Large language models;Computer bugs;Debugging;Maintenance engineering","","1","","59","","10 Sep 2024","","","IEEE","IEEE Conferences"
"Secure and Scalable LLM-Based Recommendation Systems: An MLOps and Security by Design","A. Saputra; E. Suryani; N. A. Rakhmawati","Interdisciplinary School of Management Technology Institut Teknologi Sepuluh November, Surabaya, Indonesia; Dept. of Information Systems Institut Teknologi, Sepuluh November, Surabaya, Indonesia; Dept. of Information Systems Institut Teknologi, Sepuluh November, Surabaya, Indonesia",2024 IEEE International Symposium on Consumer Technology (ISCT),"17 Dec 2024","2024","","","623","629","Integrating Large Language Models (LLMs) into e-commerce recommendation systems promises to transform consumer interactions with products, enhancing discovery and engagement through personalized recommendations. This approach has become vital for improving user experience and boosting sales. However, the adoption of LLMs introduces significant security and scalability challenges. To address these issues, this paper proposes an innovative framework that combines machine learning operations (MLOps) with security-by-design principles, with the aim of creating LLM -based recommendation systems that are secure and scalable for e-commerce platforms. This study explores the entire life cycle of an LLM-based recommendation system, from data preprocessing and model training to deployment and continuous monitoring, while embedding security and scalability. By implementing Machine Learning Operations (MLOps) with security-by-design principles, e-commerce businesses can leverage the advanced capabilities of LLMs to provide personalized shopping experiences, increase user engagement, and drive sales without compromising user trust and system performance.","2159-1423","979-8-3503-6519-1","10.1109/ISCT62336.2024.10791207","","https://ieeexplore.ieee.org/stamp/stamp.jsp?arnumber=10791207","LLMs;MLOps;security-by-design principles;LLM-based recommendation systems;Machine Learning Operations;Consumer","Training;Scalability;Large language models;System performance;Transforms;User experience;Safety;Security;Electronic commerce;Recommender systems","","","","38","IEEE","17 Dec 2024","","","IEEE","IEEE Conferences"
"Enabling Architecture Traceability by LLM-based Architecture Component Name Extraction","D. Fuchß; H. Liu; T. Hey; J. Keim; A. Koziolek","KASTEL - Institute of Information Security and Dependability, Karlsruhe Institute of Technology (KIT), Germany; KASTEL - Institute of Information Security and Dependability, Karlsruhe Institute of Technology (KIT), Germany; KASTEL - Institute of Information Security and Dependability, Karlsruhe Institute of Technology (KIT), Germany; KASTEL - Institute of Information Security and Dependability, Karlsruhe Institute of Technology (KIT), Germany; KASTEL - Institute of Information Security and Dependability, Karlsruhe Institute of Technology (KIT), Germany",2025 IEEE 22nd International Conference on Software Architecture (ICSA),"30 Apr 2025","2025","","","1","12","Traceability Link Recovery (TLR) is an enabler for various software engineering tasks. One important task is the recovery of trace links between Software Architecture Documentation (SAD) and source code. Here, the main challenge is the semantic gap between the two artifact types. Recent research has shown that this semantic gap can be bridged by using Software Architecture Models (SAMs) as intermediates. However, the creation of SAMs is a manual and time-consuming task. This paper investigates the use of Large Language Models (LLMs) to extract component names as simple SAMs for TLR based on SAD and source code. By doing so, we aim to bridge the semantic gap between SAD and source code without the need for manual SAM creation. We compare our approach to the state-of-the-art TLR approaches TransArC and ArDoCode. TransArC is the currently best-performing approach for TLR between SAD and source code, but it requires SAMs as an additional artifact. Our evaluation shows that our approach performs comparable to TransArC (weighted average F1 with GPT-4o: 0.86 vs. TransArC’s 0.87), while only needing the SAD and source code. Moreover, our approach significantly outperforms the best baseline that does not need SAMs (weighted average F1 with GPT-4o: 0.86 vs. ArDoCode’s 0.62). In summary, our approach shows that LLMs can be used to make TLR between SAD and source code more applicable by extracting component names and omitting the need for manually created SAMs.","2835-7043","979-8-3315-2090-8","10.1109/ICSA65012.2025.00011","","https://ieeexplore.ieee.org/stamp/stamp.jsp?arnumber=10978943","Traceability Link Recovery;Large Language Models;Software Architecture;Model Extraction","Bridges;Software architecture;Source coding;Large language models;Semantics;Manuals;Computer architecture;Documentation","","1","","50","IEEE","30 Apr 2025","","","IEEE","IEEE Conferences"
"Research on the LLM-Driven Vulnerability Detection System Using LProtector","Z. Sheng; F. Wu; X. Zuo; C. Li; Y. Qiao; H. Lei","Computer and Information Science, University of Pennsylvania, Philadelphia, USA; Integrated Circuit Science & Engineering, University of Electronic Science & Technology of China, Chengdu, China; Computer Science & Engineering, Texas A&M University, College Station, USA; Graduate School of Arts and Sciences, Georgetown University, Washington, D.C., USA; Computer Information Technology, Northern Arizona University, Flagstaff, USA; LG Energy Solution(Nanjing)Co., Ltd, Nanjing, China",2024 IEEE 4th International Conference on Data Science and Computer Application (ICDSCA),"6 Feb 2025","2024","","","192","196","The security issues of large-scale software systems and frameworks have become increasingly severe with the development of technology. As complexity of software grows, vulnerabilities are becoming more challenging to detect. Although traditional machine learning methods have been applied in cybersecurity for a long time, there has been no significant breakthrough until now. With the recent rise of large language models (LLMs), a turning point seems to have arrived. The powerful code comprehension and generation capabilities of LLMs make fully automated vulnerability detection systems a possibility. This paper presents LProtector, an automated vulnerability detection system for C/C++ codebases based on GPT-4o and Retrieval-Augmented Generation (RAG). LProtector performs binary classification to identify vulnerabilities in target codebases. To evaluate its effectiveness, we conducted experiments on the Big- Vul dataset. Results show that LProtector outperforms two state-of-the-art baselines in terms of F1 score, demonstrating the potential of integrating LLMs with vulnerability detection.","","979-8-3503-6823-9","10.1109/ICDSCA63855.2024.10859408","","https://ieeexplore.ieee.org/stamp/stamp.jsp?arnumber=10859408","Large Language Models;Deep Learning;Defect Detection;Operating System;Cybersecurity;Software Engineering","Codes;Accuracy;Retrieval augmented generation;Machine learning;Predictive models;Maintenance engineering;Software systems;Turning;Cognition;Mobile applications","","2","","18","IEEE","6 Feb 2025","","","IEEE","IEEE Conferences"
"Toward Integrating ChatGPT Into Satellite Image Annotation Workflows: A Comparison of Label Quality and Costs of Human and Automated Annotators","J. Beck; L. M. Kemeter; K. Dürrbeck; M. H. I. Abdalla; F. Kreuter","Munich Center for Machine Learning (MCML), Ludwig-Maximilians-Universität München Institut für Informatik, München, Germany; Center for Applied Research on Supply Chain Services, Fraunhofer Institute for Integrated Circuits IIS, Nuremberg, Germany; Center for Applied Research on Supply Chain Services, Fraunhofer Institute for Integrated Circuits IIS, Nuremberg, Germany; Center for Applied Research on Supply Chain Services, Fraunhofer Institute for Integrated Circuits IIS, Nuremberg, Germany; Munich Center for Machine Learning (MCML), Ludwig-Maximilians-Universität München Institut für Informatik, München, Germany",IEEE Journal of Selected Topics in Applied Earth Observations and Remote Sensing,"3 Feb 2025","2025","18","","4366","4381","High-quality annotations are a critical success factor for machine learning (ML) applications. To achieve this, we have traditionally relied on human annotators, navigating the challenges of limited budgets and the varying task-specific expertise, costs, and availability. Since the emergence of large language models (LLMs), their popularity for generating automated annotations has grown, extending possibilities and complexity of designing an efficient annotation strategy. Increasingly, computer vision capabilities have been integrated into general-purpose LLMs like ChatGPT. This raises the question of how effectively LLMs can be used in satellite image annotation tasks and how they compare to traditional annotator types. This study presents a comprehensive investigation and comparison of various human and automated annotators for image classification. We evaluate the feasibility and economic competitiveness of using the ChatGPT4-V model for a complex land usage annotation task and compare it with alternative human annotators. A set of satellite images is annotated by a domain expert and 15 additional human and automated annotators, differing in expertise and costs. Our analyzes examine the annotation quality loss between the expert and other annotators. This comparison is conducted through, first, descriptive analyzes, second, fitting linear probability models, and third, comparing F1-scores. Ultimately, we simulate annotation strategies where samples are split according to an automatically assigned certainty score. Routing low-certainty images to human annotators can cut total annotation costs by over 50% with minimal impact on label quality. We discuss implications regarding the economic competitiveness of annotation strategies, prompt engineering, and the task-specificity of expertise.","2151-1535","","10.1109/JSTARS.2025.3528192","Munich Center for Machine Learning; Bavarian Ministry of Economic Affairs; Regional Development and Energy through the Center for Analytics — Data — Applications; BAYERN DIGITAL II(grant numbers:20-3410-2-9-8); ","https://ieeexplore.ieee.org/stamp/stamp.jsp?arnumber=10841407","Automated annotations;ChatGPT;label quality;large language models (LLMs);satellite image annotation","Annotations;Satellite images;Biological system modeling;Costs;Chatbots;Training;Image annotation;Visualization;Remote sensing;Data models","","2","","71","CCBY","14 Jan 2025","","","IEEE","IEEE Journals"
