"Intrusion Detection in the Internet of Vehicles Using Transformer Models","M. Alauthman; A. Mashaleh; N. Aslam; A. Aldweesh; A. Almomani","Department of Information Security, University of Petra, Jordan; Al-Balqa Applied University, Al-Salt, Jordan; Department of Computer and Information Sciences, Northumbria University, U.K.; College of computing and IT, Shaqra University, Shaqra, Saudi Arabia; Department of Computer Information Science, Higher Colleges of Technology, UAE",2025 1st International Conference on Computational Intelligence Approaches and Applications (ICCIAA),"2 Jun 2025","2025","","","1","6","The proliferation of Internet of Vehicles (IoV) systems has introduced critical cybersecurity vulnerabilities in connected vehicle infrastructures. This paper presents a novel application of Transformer architecture for intrusion detection in vehicular Controller Area Network (CAN) buses, specifically addressing Denial-of-Service and Spoofing attacks. We introduce a Transformer-based model optimized for CAN frame sequence analysis, evaluated on the CICIoV2024 dataset comprising real-world attack scenarios from a 2019 Ford vehicle. Our experimental results demonstrate superior detection capabilities compared to classical machine learning approaches and recurrent neural architectures, achieving 98.4% accuracy and 98.5% F1-score. The proposed architecture's self-attention mechanism effectively captures temporal dependencies in CAN frame sequences while maintaining computational efficiency (2.3ms inference time) suitable for automotive-grade ECUs. This research advances the state-of-the-art in IoV security through enhanced detection accuracy and practical deployment considerations for resource-constrained vehicular environments.","","979-8-3315-2365-7","10.1109/ICCIAA65327.2025.11013054","","https://ieeexplore.ieee.org/stamp/stamp.jsp?arnumber=11013054","Internet of Vehicles;Intrusion Detection Systems;Transformer;CAN Bus Security;Machine Learning;CICIo V2024 Dataset","Analytical models;Adaptation models;Computational modeling;Intrusion detection;Computer architecture;Machine learning;Transformers;Controller area networks;Internet of Vehicles;Automotive engineering","","","","21","IEEE","2 Jun 2025","","","IEEE","IEEE Conferences"
"3DGen: AI-Assisted Generation of Provably Correct Binary Format Parsers","S. Fakhoury; M. Kuppe; S. K. Lahiri; T. Ramananandro; N. Swamy","Microsoft Research, Redmond, USA; Microsoft Research, Redmond, USA; Microsoft Research, Redmond, USA; Microsoft Research, Redmond, USA; Microsoft Research, Redmond, USA",2025 IEEE/ACM 47th International Conference on Software Engineering (ICSE),"23 Jun 2025","2025","","","2535","2547","Improper parsing of attacker-controlled input is a leading source of software security vulnerabilities, especially when programmers transcribe informal format descriptions in RFCs into efficient parsing logic in low-level, memory unsafe languages. Several researchers have proposed formal specification languages for data formats from which efficient code can be extracted. However, distilling informal requirements into formal specifications is challenging and, despite their benefits, new, formal languages are hard for people to learn and use. In this work, we present 3DGen, a framework that makes use of AI agents to transform mixed informal input, including natural language documents (i.e., RFCs) and example inputs into format specifications in a language called 3D. To support humans in understanding and trusting the generated specifications, 3DGen uses symbolic methods to also synthesize test inputs that can be validated against an external oracle. Symbolic test generation also helps in distinguishing multiple plausible solutions. Through a process of repeated refinement, 3DGen produces a 3D specification that conforms to a test suite, and which yields safe, efficient, provably correct, parsing code in C. We have evaluated 3DGen on 20 Internet standard formats, demonstrating the potential for AI-agents to produce formally verified $C$ code at a non-trivial scale. A key enabler is the use of a domain-specific language to limit AI outputs to a class for which automated. symbolic analysis is tractable.","1558-1225","979-8-3315-0569-1","10.1109/ICSE55347.2025.00173","","https://ieeexplore.ieee.org/stamp/stamp.jsp?arnumber=11029881","Code Generation;Agentic AI Systems;Trust-worthy AI programming","Codes;Three-dimensional displays;Synthesizers;Natural languages;Transforms;Programming;Formal specifications;Test pattern generators;Artificial intelligence;Standards","","1","","38","IEEE","23 Jun 2025","","","IEEE","IEEE Conferences"
"Advanced Learning Technologies for Intelligent Transportation Systems: Prospects and Challenges","R. A. Khalil; Z. Safelnasr; N. Yemane; M. Kedir; A. Shafiqurrahman; N. SAEED","Department of Electrical and Communication Engineering, United Arab Emirates University (UAEU), Al-Ain, UAE; Department of Electrical and Communication Engineering, United Arab Emirates University (UAEU), Al-Ain, UAE; Department of Electrical and Communication Engineering, United Arab Emirates University (UAEU), Al-Ain, UAE; Department of Electrical and Communication Engineering, United Arab Emirates University (UAEU), Al-Ain, UAE; Department of Electrical and Communication Engineering, United Arab Emirates University (UAEU), Al-Ain, UAE; Department of Electrical and Communication Engineering, United Arab Emirates University (UAEU), Al-Ain, UAE",IEEE Open Journal of Vehicular Technology,"25 Mar 2024","2024","5","","397","427","Intelligent Transportation Systems (ITS) operate within a highly intricate and dynamic environment characterized by complex spatial and temporal dynamics at various scales, further compounded by fluctuating conditions influenced by external factors such as social events, holidays, and weather. Navigating the intricacies of modeling the intricate interaction among these elements, creating universal representations, and employing them to address transportation issues. Yet, these intricacies comprise just one facet of the multifaceted trials confronting contemporary ITS. This paper offers an all-encompassing survey exploring Deep learning (DL) utilization in ITS, primarily focusing on practitioners' methodologies to address these multifaceted challenges. The emphasis lies on the architectural and problem-specific factors that guide the formulation of innovative solutions. In addition to shedding light on the state-of-the-art DL algorithms, we also explore potential applications of DL and large language models (LLMs) in ITS, including traffic flow prediction, vehicle detection and classification, road condition monitoring, traffic sign recognition, and autonomous vehicles. Besides, we identify several future challenges and research directions that can push the boundaries of ITS, including the critical aspects, including transfer learning, hybrid models, privacy and security, and ultra-reliable low-latency communication. Our aim for this survey is to bridge the gap between the burgeoning DL and transportation communities. By doing so, we aim to facilitate a deeper comprehension of the challenges and possibilities within this field. We hope that this effort will inspire further exploration of fresh perspectives and issues, which, in turn, will play a pivotal role in shaping the future of transportation systems.","2644-1330","","10.1109/OJVT.2024.3369691","Summer Undergraduate Research Experience; United Arab Emirates University(grant numbers:G00004359); ","https://ieeexplore.ieee.org/stamp/stamp.jsp?arnumber=10444919","Intelligent transportation systems;autonomous vehicles;deep learning;large language models;explainable AI;traffic flow prediction","Transportation;Surveys;Intelligent transportation systems;Autonomous vehicles;Vehicle dynamics;Large language models;Traffic control;Deep learning","","42","","263","CCBYNCND","26 Feb 2024","","","IEEE","IEEE Journals"
"Guarding Your Conversations: Privacy Gatekeepers for Secure Interactions with Cloud- Based AI Models","G. Uzor; H. Al-Qudah; Y. Ineza; A. Serwadda","Department of Computer Science, Texas Tech University, Lubbock, Texas; Department of Computer Science, Texas Tech University, Lubbock, Texas; Department of Computer Science, Texas Tech University, Lubbock, Texas; Department of Computer Science, Texas Tech University, Lubbock, Texas",2025 19th International Conference on Semantic Computing (ICSC),"19 Jun 2025","2025","","","235","242","The interactive nature of Large Language Models (LLMs), which closely track user data and context, has prompted users to share personal and private information in unprecedented ways. Even when users opt out of allowing their data to be used for training, these privacy settings offer limited protection when LLM providers operate in jurisdictions with weak privacy laws, invasive government surveillance, or poor data security practices. In such cases, the risk of sensitive information, including Personally Identifiable Information (PII), being mishandled or exposed remains high. To address this, we propose the concept of an “LLM gatekeeper”, a lightweight, locally run model that filters out sensitive information from user queries before they are sent to the potentially untrustworthy, though highly capable, cloud-based LLM. Through experiments with human subjects, we demonstrate that this dual-model approach introduces minimal overhead while significantly enhancing user privacy, without compromising the quality of LLM responses.","2472-9671","979-8-3315-2426-5","10.1109/ICSC64641.2025.00040","","https://ieeexplore.ieee.org/stamp/stamp.jsp?arnumber=11036311","Large Language Models;Generative Artificial Intelligence;Personal Identifiable Information;Natural Language Processing","Training;Data privacy;Privacy;Large language models;Surveillance;Semantics;Oral communication;Logic gates;Protection;Identification of persons","","","","18","IEEE","19 Jun 2025","","","IEEE","IEEE Conferences"
"Evaluating Software Development Agents: Patch Patterns, Code Quality, and Issue Complexity in Real-World GitHub Scenarios","Z. Chen; L. Jiang","Centre for Research on Intelligent Software Engineering, School of Computing and Information Systems, Singapore Management University; Centre for Research on Intelligent Software Engineering, School of Computing and Information Systems, Singapore Management University","2025 IEEE International Conference on Software Analysis, Evolution and Reengineering (SANER)","21 May 2025","2025","","","657","668","In recent years, AI-based software engineering has progressed from pre-trained models to advanced agentic workflows, with Software Development Agents representing the next major leap. These agents, capable of reasoning, planning, and interacting with external environments, offer promising solutions to complex software engineering tasks. However, while much research has evaluated code generated by large language models (LLMs), comprehensive studies on agent-generated patches, particularly in real-world settings, are lacking. This study addresses that gap by evaluating 4,892 patches from 10 top-ranked agents on 500 real-world GitHub issues from SWE-Bench Verified, focusing on their impact on code quality. Our analysis shows no single agent dominated, with 170 issues unresolved, indicating room for improvement. Even for patches that passed unit tests and resolved issues, agents made different file and function modifications compared to the gold patches from repository developers, revealing limitations in the benchmark's test case coverage. Most agents maintained code reliability and security, avoiding new bugs or vulnerabilities; while some agents increased code complexity, many reduced code duplication and minimized code smells. Finally, agents performed better on simpler codebases, suggesting that breaking complex tasks into smaller sub-tasks could improve effectiveness. This study provides the first comprehensive evaluation of agent-generated patches on real-world GitHub issues, offering insights to advance AI-driven software development.","2640-7574","979-8-3315-3510-0","10.1109/SANER64311.2025.00068","Ministry of Education, Singapore(grant numbers:MOET32020-0004); ","https://ieeexplore.ieee.org/stamp/stamp.jsp?arnumber=10992485","Software Development Agents;Patch Generation;Large Language Models;Code Quality;GitHub Issues","Gold;Codes;Large language models;Computer bugs;Focusing;Complexity theory;Security;Reliability;Software development management;Software engineering","","","","50","IEEE","21 May 2025","","","IEEE","IEEE Conferences"
"CDAP-PFMs: A Cross-Domain Authentication Protocol for Edge Inference-Based PFMs","X. Meng; Y. Xiao; W. Liang; W. Xu; Z. Xu; X. Li; N. Xiong","College of Computer Science and Engineering, Hunan University of Science and Technology Sanya Research Institute, and the Hunan Key Laboratory for Service Computing and Novel Software Technology, Hunan University of Science and Technology, Xiangtan, China; College of Computer Science and Engineering, Hunan University of Science and Technology Sanya Research Institute, and the Hunan Key Laboratory for Service Computing and Novel Software Technology, Hunan University of Science and Technology, Xiangtan, China; College of Computer Science and Engineering, Hunan University of Science and Technology Sanya Research Institute, and the Hunan Key Laboratory for Service Computing and Novel Software Technology, Hunan University of Science and Technology, Xiangtan, China; College of Computer Science and Technology, Nanjing University of Aeronautics and Astronautics, Nanjing, Jiangsu, China; Computer and Communication Engineer Institute, Changsha University of Science and Technology, Changsha, China; School of Computer Science and Engineering, Institute for Cyber Security, University of Electronic Science and Technology of China, Chengdu, China; College of Computer Science and Engineering, Hunan University of Science and Technology Sanya Research Institute, and the Hunan Key Laboratory for Service Computing and Novel Software Technology, Hunan University of Science and Technology, Xiangtan, China",IEEE Internet of Things Journal,"8 Aug 2025","2025","12","16","33468","33481","The pretrained foundation models (PFMs) based on edge inference reduce communication latency from the cloud server to the user mobile devices (MDs), and support different edge nodes to provide adaptive artificial intelligence (AI) services to the users. The complex network environment has attracted widespread attention to the communication security of cross-domain AI services. Authentication protocol is an important way to ensure the communication security among entities. However, existing cross-domain authentication protocols have not taken into account the communication delay caused by complex cryptographic operations on the MDs. To address these issues, a cross-domain inference authentication (CDIA) protocol for PFMs is proposed in this article. The complex cryptographic operations are executed collaboratively by the servers from different domains to realizes decentralized authentication. Besides, the correctness and security of CDIA protocol is proved by formal analysis. The security of CDIA protocol is verified by using the automated validation of Internet security protocols and applications (AVISPAs) tool. The security of negotiated group key is proved by Real-or-Random (RoR) model. Finally, the performance of CDIA protocol is evaluated to show its efficiency. Compared with related protocols, the computing cost and communication overhead of CDIA protocol are at least 52.38% and 11.9%, respectively.","2327-4662","","10.1109/JIOT.2025.3578252","Joint Key Project of National Natural Science Foundation of China(grant numbers:U2468205); National Natural Science Foundation of China(grant numbers:62402064,62472168,61976087); Science and Technology Project of the Department of Communications of Hunan Provincial(grant numbers:202101); Key Research and Development Program of Hunan Province(grant numbers:2022GK2015); Natural Science Foundation of Hunan Province(grant numbers:2021JJ30141,2024JJ6066); Research Foundation of Education Bureau of Hunan Province of China(grant numbers:23B0288); ","https://ieeexplore.ieee.org/stamp/stamp.jsp?arnumber=11029052","Authentication protocol;edge inference;Internet of Things (IoT);pretrained foundation models (PFMs);security analysis","Authentication;Protocols;Security;Servers;Mobile handsets;Industrial Internet of Things;Frequency modulation;Computer architecture;Edge computing;Cloud computing","","","","39","IEEE","9 Jun 2025","","","IEEE","IEEE Journals"
"Toward LLM-driven Adaptive Policy Orchestration for Host-based Intrusion Detection Systems in IoT Environments","B. Karunanayake; I. Khalil; X. Yi; K. -Y. Lam","School of Computing Technologies, RMIT University, Melbourne, VIC, Australia; School of Computing Technologies, RMIT University, Melbourne, VIC, Australia; School of Computing Technologies, RMIT University, Melbourne, VIC, Australia; College of Computing and Data Science, Nanyang Technological University, 50 Nanyang Ave, Singapore",IEEE Network,"","2025","PP","99","1","1","Large language models (LLMs) have emerged as powerful tools for text generation, demonstrating remarkable capabilities in reasoning, function calling, and generating structured outputs. When equipped with access to functions and memory, they can be transformed into interactive and intelligent LLM agents. However, the applicability of such LLM agents in real-time Internet of things (IoT) applications remains constrained by resource limitations. One critical area is IoT security, particularly in intrusion detection systems (IDS), where LLM agents hold the potential to enhance the effectiveness of existing solutions significantly. Current IDS approaches in IoT, predominantly reliant on signature-based or anomaly-based techniques, struggle to adapt to the dynamic and evolving nature of modern threats. Recent studies reveal a prevalence of false positives in existing IDS, complicating the alert reasoning and decision-making process. To address these limitations, this research proposes a novel adaptive IDS policy orchestration framework that leverages LLM agents in conjunction with advanced prompting strategies. Our framework generates adaptive IDS policies, enhancing precision with intelligent alert reasoning. It enables efficient policy deployment without needing LLM inference during policy execution. We validate the effectiveness of the proposed framework through experiments conducted on five real-world IDS datasets. The results demonstrate that the framework achieves over 97% precision on three IoT network datasets and over 80% on two more challenging datasets. Notably, our framework reduces the detection latency by 50% compared to traditional machine learning (ML) models with the requirement of fewer than 10k total completion tokens, offering a highly cost-effective, efficient, and scalable solution. These findings establish a new benchmark for IoT-IDS frameworks utilising LLM agents, underscoring the potential for further advancements in this domain.","1558-156X","","10.1109/MNET.2025.3579532","Australian Research Council(grant numbers:DP220100215); ","https://ieeexplore.ieee.org/stamp/stamp.jsp?arnumber=11036113","Internet of Things;Intrusion Detection Systems;Large Language Models;LLM Agents;Policy Generation","Internet of Things;Cognition;Intrusion detection;Telecommunication traffic;Image edge detection;Training;Threat modeling;Reliability;Data mining;Codes","","","","","IEEE","13 Jun 2025","","","IEEE","IEEE Early Access Articles"
"Research on TTP Data Augmentation Methods Based on the ATT&CK Framework","J. Zhang; X. Xue; J. Zhang; T. Qu; L. Li; R. Xi; H. Zhu","Institute of Information Engineering, Chinese Academy of Sciences, Beijing, China; Institute of Information Engineering, Chinese Academy of Sciences, Beijing, China; Institute of Information Engineering, Chinese Academy of Sciences, Beijing, China; Institute of Information Engineering, Chinese Academy of Sciences, Beijing, China; Institute of Information Engineering, Chinese Academy of Sciences, Beijing, China; Institute of Information Engineering, Chinese Academy of Sciences, Beijing, China; Institute of Information Engineering, Chinese Academy of Sciences, Beijing, China",2025 28th International Conference on Computer Supported Cooperative Work in Design (CSCWD),"23 Jun 2025","2025","","","1722","1727","As cyber threats escalate, rapid identification and response to attacks are increasingly vital. Cyber Threat Intelli-gence (CTI) is crucial for understanding the threat landscape, and standardized attack frameworks are essential for effective anal-ysis. The MITRE ATT &CK framework has gained widespread adoption for its systematic description of Tactics, Techniques, and Procedures (TTP), aiding security teams in tracking at-tack patterns. However, manual classification of TTP is time-consuming and costly, hindering response efficiency. Although artificial intelligence has advanced automated TTP classification, accuracy still needs improvement due to the scarcity of labeled data, resulting in small and imbalanced datasets. This study introduces a novel TTP data augmentation method to enhance classification accuracy through synthetic data gen-eration. We construct a dataset of 19,716 sentences from the ATT&CK knowledge base and real-world threat reports, Ini-tially, we leverage large language models (LLMs) combined with prompt techniques to generate high-quality synthetic data, followed by semantic filtering and dynamic sampling strategies to further enhance data quality and improve class balance. Experimental results show an average $\mathbf{F}_{1}$ score increase of 16.95 % across various classification models, significantly enhancing TTP classification performance.","2768-1904","979-8-3315-1305-4","10.1109/CSCWD64889.2025.11033315","","https://ieeexplore.ieee.org/stamp/stamp.jsp?arnumber=11033315","Cyber Threat Intelligence;MITRE ATT&CK;TTP;Large Language Models;Data Synthesis","Accuracy;Systematics;Filtering;Large language models;Data integrity;Semantics;Knowledge based systems;Data augmentation;Cyber threat intelligence;Synthetic data","","","","25","IEEE","23 Jun 2025","","","IEEE","IEEE Conferences"
"LLM-Based Quiz Generation for Assessments in Learning Management System","S. Shirkar; D. Langhi; S. Agrawal","Department of Information Technology, Vidyalankar Institute of Technology, Mumbai, India; Department of Information Technology, Vidyalankar Institute of Technology, Mumbai, India; Department of Information Technology, Vidyalankar Institute of Technology",2025 Second International Conference on Cognitive Robotics and Intelligent Systems (ICC - ROBINS),"29 Jul 2025","2025","","","464","470","An advanced AI system which employs Large Language Models (LLMs) to create automatic assessment questions through automation features, has been introduced in this study. The system combines MetaAI's llama- 3 model Groq API together with LangChain and structured prompting methods to produce quizzes which remain accurate to original contexts and logical sequences. The system delivers better efficiency alongside reduced manual work through the creation of quality questions across different formats which contain multiple-choice items, true-false formats and open-ended questions. The system maintains data security through environment variables in its API handling process to protect against unauthorized access. Smart testing through AI-based quiz creation methods produces customized assessments which use dynamic test content according to the established study.","","979-8-3315-0172-3","10.1109/ICC-ROBINS64345.2025.11086273","","https://ieeexplore.ieee.org/stamp/stamp.jsp?arnumber=11086273","Large language models;llama-3;Structured prompting;AI-driven quiz generation","Vocabulary;Large language models;Manuals;Production;Real-time systems;Natural language processing;Reliability;Prompt engineering;Context modeling;Testing","","","","21","IEEE","29 Jul 2025","","","IEEE","IEEE Conferences"
