"The First ChatGPT4PCG Competition","F. Abdullah; P. Taveekitworachai; M. F. Dewantoro; R. Thawonmas; J. Togelius; J. Renz","Graduate School of Information Science and Engineering, Ritsumeikan University, Ibaraki, Japan; Graduate School of Information Science and Engineering, Ritsumeikan University, Ibaraki, Japan; Graduate School of Information Science and Engineering, Ritsumeikan University, Ibaraki, Japan; College of Information Science and Engineering, Ritsumeikan University, Ibaraki, Japan; NYU Tandon School of Engineering, New York University, New York, NY, USA; School of Computing, Australian National University, Canberra, ACT, Australia",IEEE Transactions on Games,"17 Dec 2024","2024","16","4","971","980","This article summarizes the first ChatGPT4PCG competition held at the 2023 IEEE Conference on Games. The goal of the competition is to explore emergent abilities of publicly available large language models (LLMs) in performing complex tasks related to procedural content generation, specifically physics-based level generation for Angry Birds-like games. Participants are tasked with submitting their prompts for ChatGPT to generate Angry Birds-like game structures that resemble English uppercase characters. A structure is a collection of stacked game objects comprising a part of an entire Angry Birds-like level. A prompt is an input for LLMs, including ChatGPT. Two evaluation metrics, i.e., stability and similarity, are used to evaluate the submitted prompts. Stability measures the sturdiness of a structure to withstand in-game gravity, while similarity measures a structure's resemblance to the target character. With such evaluation, participants are challenged to produce not only character-like but also stable structures by utilizing prompt engineering techniques. Finally, the competition's results are discussed to provide valuable insights for future studies and competitions.","2475-1510","","10.1109/TG.2024.3376429","","https://ieeexplore.ieee.org/stamp/stamp.jsp?arnumber=10470422","Angry birds;ChatGPT;large language models (LLMs);procedural content generation (PCG)","Games;Birds;Task analysis;Chatbots;Measurement;Codes;Artificial intelligence","","3","","60","IEEE","12 Mar 2024","","","IEEE","IEEE Journals"
"Unforgettable Password Generation Using LoRA Fine-Tuned Large Language Model","M. Sameer; K. Sudharsan; A. Benazir Begum","Dept.of Computer Science & Engineering, Hindustan Institute of Technology and Science, Chennai, India; Dept.of Computer Science & Engineering, Hindustan Institute of Technology and Science, Chennai, India; Dept.of Computer Science & Engineering, Hindustan Institute of Technology and Science, Chennai, India",2024 International Conference on Advances in Data Engineering and Intelligent Computing Systems (ADICS),"23 May 2024","2024","","","1","5","In response to the challenges posed by complex and hard-to-remember passwords in traditional authentication systems, this research introduces an innovative approach leveraging Low Rank Adaption (LoRA) fine-tuned Large Language Models (LLMs) to generate natural language-like strong passwords. Focused on striking a balance between usability and security, proposed system methodology employs smaller-sized pre-trained LLMs, adapted using LoRA fine-tuning, to produce passwords that are both strong and memorable. By addressing the limitations of current password generation practices, proposed system framework aims to encourage user adoption of secure practices, contributing to a positive societal impact through improved cybersecurity hygiene. The proposed solution involves deploying a fine-tuned LLM and serving them through an frontend web UI which emphasizes resource efficiency scalability of deployment of such model, and ease of using the generated passwords in real life authentication purposes fostering good cybersecurity practices among non-technical users.","","979-8-3503-6482-8","10.1109/ADICS58448.2024.10533548","","https://ieeexplore.ieee.org/stamp/stamp.jsp?arnumber=10533548","password generation;large language models;LoRA fine-tuning;pcfg;omen","Computational modeling;Scalability;Authentication;Passwords;Data engineering;Data models;Usability","","1","","20","IEEE","23 May 2024","","","IEEE","IEEE Conferences"
"Chain-of-Thought Enhanced Content Detection in Large Language Models","C. Zou; Z. Feng; H. Guan; C. Xing","School of Computer Science and Technology, Heilongjiang Institute of Technology, Harbin, China; School of Computer Science and Technology, Heilongjiang Institute of Technology, Harbin, China; School of Computer Science and Technology, Heilongjiang Institute of Technology, Harbin, China; School of Computer Science and Technology, Heilongjiang Institute of Technology, Harbin, China","2024 3rd International Conference on Cloud Computing, Big Data Application and Software Engineering (CBASE)","14 Jan 2025","2024","","","610","617","This paper proposes and explores a content detection method for large language models based on the Chain of Thought (CoT) logic chain. By incrementally extracting logic chains from text or code and converting them into feature vectors, this method enables logical plagiarism detection and content verification for complex tasks. Particularly for classical algorithmic problems, such as dynamic programming, this approach effectively mitigates plagiarism attempts through variable renaming. The paper first delves into the theoretical foundation of CoT logic chains and analyzes their application mechanisms within large language models. It then provides a detailed account of the steps for feature extraction and similarity detection algorithms, including how to efficiently convert logic chains into feature vectors for comparison. To validate the effectiveness of this method, several classical algorithmic instances were selected for experimentation. Results indicate that the CoT logic chain-based content detection method offers significant advantages in detecting originality in academic papers and code. This approach not only substantially improves the detection rate of academic misconduct but also assists editors and reviewers in more accurately identifying AI-generated content, thereby holding broad applications in academic publishing, code review, and educational fields. Additionally, the paper discusses the potential application of this method in other domains, such as patent plagiarism detection and legal document similarity analysis.","","979-8-3315-0658-2","10.1109/CBASE64041.2024.10824407","","https://ieeexplore.ieee.org/stamp/stamp.jsp?arnumber=10824407","Content Detection;Similarity Detection;Algorithmic Plagiarism Detection;Chain of Thought (CoT);Artificial Intelligence-Generated Content (AIGC)","Codes;Text analysis;Reviews;Publishing;Plagiarism;Large language models;Feature extraction;Vectors;Logic;Software engineering","","","","6","IEEE","14 Jan 2025","","","IEEE","IEEE Conferences"
"Research on Toxic Speech Detection Based on Large Language Models","W. Li; Y. Gao; Y. Zhang; L. Yang; R. Gao","Digital Industry College, Inner Mongolia University of Science & Technology, Baotou, China; Digital Industry College, Inner Mongolia University of Science & Technology, Baotou, China; Digital Industry College, Inner Mongolia University of Science & Technology, Baotou, China; Digital Industry College, Inner Mongolia University of Science & Technology, Baotou, China; Technical Network Team Baotou Public Security Bureau, Baotou, China","2024 IEEE 23rd International Conference on Trust, Security and Privacy in Computing and Communications (TrustCom)","4 Apr 2025","2024","","","2191","2196","Toxic Speech (TS) is widely spread in social media and is increasingly harmful to the online networking environment. At the same time, words and their variants containing implicit toxic semantics are influenced by the humanistic and social environment of the language and are extremely rich in form and shape, and the lack of background knowledge related to the ""discourse body"" of existing research has led to the confusion of Implicit Toxic Speech (ITS) with Non-Toxic Speech (NTS). Therefore, this paper proposes the Prompt-enhanced Attention Head Fusion (PAHF) toxic text classification model based on the generative language model. We optimize the hidden layer vectors by intervening in the hidden layer information through prompt, then filter the vectors by combining linear probes to locate those vectors in the hidden layer information that are strongly correlated with the encoding of the background knowledge, and finally construct an attention fusion mechanism to fuse the filtered features, which provides a higher detection accuracy compared with the existing algorithms.","2324-9013","979-8-3315-0620-9","10.1109/TrustCom63139.2024.00302","National Natural Science Foundation of China; ","https://ieeexplore.ieee.org/stamp/stamp.jsp?arnumber=10945182","Implicit Toxic Speech;Linear Probe;Prompt Engineering;Attention Mechanism","Maximum likelihood detection;Social networking (online);Text categorization;Semantics;Speech recognition;Nonlinear filters;Filtering algorithms;Information filters;Vectors;Probes","","","","30","IEEE","4 Apr 2025","","","IEEE","IEEE Conferences"
"Utilizing Large Language Models for Advanced Optimization and Intelligent Management in Space-Air-Ground Integrated Networks","J. Tang; F. Tang; S. Long; M. Zhao; N. Kato","Central South University, China; Central South University, China; Central South University, China; Central South University, China; Tohoku University, Japan",IEEE Network,"","2024","PP","99","1","1","Space-Air-Ground Integrated Networks (SAGIN) present stringent and complex requirements for network design and management due to their heterogeneity, self-organizing nature, dynamic characteristics and so on. Despite extensive research on deep learning in the context of SAGIN, challenges such as inflexibility, lack of generalization, limited robustness, and insufficient scalability persist. Large language models (LLMs), with their powerful natural language processing, understanding, and generation capabilities, show significant potential in meeting the complex demands of SAGIN. We thoroughly analyze the application of LLMs in optimizing channel models, improving communication algorithms, and enhancing network management and security performance to address the unique characteristics and requirements of SAGIN. Additionally, it identifies the challenges faced during the deployment of LLMs, including computational resource constraints, data transmission limitations, model updates, real-time processing, and system integration. Corresponding solutions are proposed to ensure the efficient operation and reliability of SAGIN. Through this research, we aim to provide innovative solutions for the intelligent management of SAGIN, promoting the continuous development and application of SAGIN.","1558-156X","","10.1109/MNET.2024.3519664","Natural Science Foundation of Hunan Province(grant numbers:no.2023jj40774); Changsha Municipal Natural Science Foundation (Grant no.kq2208284)(grant numbers:no.kq2208284); National Natural Science Foundation of China(grant numbers:no.62302527); ","https://ieeexplore.ieee.org/stamp/stamp.jsp?arnumber=10806847","","Data models;Adaptation models;Natural language processing;Deep learning;Space-air-ground integrated networks;Reliability;Analytical models;Security;Real-time systems;Prediction algorithms","","1","","","IEEE","18 Dec 2024","","","IEEE","IEEE Early Access Articles"
"Semantic-Enhanced Indirect Call Analysis with Large Language Models","B. Cheng; C. Zhang; K. Wang; L. Shi; Y. Liu; H. Wang; Y. Guo; D. Li; X. Chen","Peking University, China; Nanyang Technological University, Singapore; Huazhong University of Science and Technology, China; Nanyang Technological University, Singapore; Nanyang Technological University, Singapore; Huazhong University of Science and Technology, China; Peking University, China; Peking University, China; Peking University, China",2024 39th IEEE/ACM International Conference on Automated Software Engineering (ASE),"29 Nov 2024","2024","","","430","442","In contemporary software development, the widespread use of indirect calls to achieve dynamic features poses challenges in constructing precise control flow graphs (CFGs), which further impacts the performance of downstream static analysis tasks. To tackle this issue, various types of indirect call analyzers have been proposed. However, they do not fully leverage the semantic information of the program, limiting their effectiveness in real-world scenarios.To address these issues, this paper proposes Semantic-Enhanced Analysis (SEA), a new approach to enhance the effectiveness of indirect call analysis. Our fundamental insight is that for common programming practices, indirect calls often exhibit semantic similarity with their invoked targets. This semantic alignment serves as a supportive mechanism for static analysis techniques in filtering out false targets. Notably, contemporary large language models (LLMs) are trained on extensive code corpora, encompassing tasks such as code summarization, making them well-suited for semantic analysis. Specifically, SEA leverages LLMs to generate natural language summaries of both indirect calls and target functions from multiple perspectives. Through further analysis of these summaries, SEA can determine their suitability as caller-callee pairs. Experimental results demonstrate that SEA can significantly enhance existing static analysis methods by producing more precise target sets for indirect calls.CCS CONCEPTS•Software and its engineering → Software maintenance tools.","2643-1572","979-8-4007-1248-7","","National Science and Technology Major Project; National Research Foundation; ","https://ieeexplore.ieee.org/stamp/stamp.jsp?arnumber=10764802","Indirect-call analysis;Semantic analysis;LLM","Software maintenance;Codes;Limiting;Large language models;Semantics;Natural languages;Static analysis;Programming;Software engineering;Software development management","","","","67","","29 Nov 2024","","","IEEE","IEEE Conferences"
"Investigating Numerical Translation with Large Language Models","W. Tang; J. Yu; Y. Li; Y. Zhao; W. Zhang; W. Feng; M. Zhang; H. Yang","Huawei Translation Services Center, China; Huawei Translation Services Center, China; Huawei Translation Services Center, China; Huawei Translation Services Center, China; Huawei Translation Services Center, China; Huawei Translation Services Center, China; Huawei Translation Services Center, China; Huawei Translation Services Center, China","ICASSP 2025 - 2025 IEEE International Conference on Acoustics, Speech and Signal Processing (ICASSP)","7 Mar 2025","2025","","","1","5","The inaccurate translation of numbers can lead to significant security issues, ranging from financial setbacks to medical inaccuracies. While large language models (LLMs) have made significant advancements in machine translation, their capacity for translating numbers has not been thoroughly explored. This study focuses on evaluating the reliability of LLM-based machine translation systems when handling numerical data. In order to systematically test the numerical translation capabilities of currently open source LLMs, we have constructed a numerical translation dataset between Chinese and English based on real business data, encompassing ten types of numerical translation. Experiments on the dataset indicate that errors in numerical translation are a common issue, with most open-source LLMs faltering when faced with our test scenarios. Especially when it comes to numerical types involving large units like ""million"", ""billion"", and ""亿"" , even the latest llama3.1 8b model can have error rates as high as 20%. Finally, we introduce three potential strategies to mitigate the numerical mistranslations for large units.","2379-190X","979-8-3503-6874-1","10.1109/ICASSP49660.2025.10887726","","https://ieeexplore.ieee.org/stamp/stamp.jsp?arnumber=10887726","LLM;Numerical Translation","Translation;Error analysis;Large language models;Signal processing;Distance measurement;Numerical models;Machine translation;Security;Reliability;Speech processing","","","","23","IEEE","7 Mar 2025","","","IEEE","IEEE Conferences"
"PEARL: An Adaptive and Explainable Hardware Trojan Detection Using Open Source and Enterprise Large Language Models","R. Kumar Kundu; K. Khalil; E. Garcia; E. Grassia; P. Calyam; K. A. Hoque","Department of Electrical Engineering and Computer Science, University of Missouri, Columbia, MO, USA; Department of Electrical Engineering and Computer Science, University of Missouri, Columbia, MO, USA; Columbia College, Columbia, MO, USA; Department of Computer Science, Loyola University, Chicago, IL, USA; Department of Electrical Engineering and Computer Science, University of Missouri, Columbia, MO, USA; Department of Electrical Engineering and Computer Science, University of Missouri, Columbia, MO, USA",IEEE Access,"1 Aug 2025","2025","13","","133755","133772","The Integrated Circuit (IC) supply chain risk allows attackers to implant hardware Trojans (HT) in various stages of chip production. To counter this, different machine learning (ML) and deep learning (DL)-based methods have been developed to detect HTs. However, these methods require massive amounts of high-quality labeled data for effective training, extended training times for accurate HT detection, limited generalization to novel or unseen HTs, and insufficient capability to explain the detected HTs. Recent studies have started exploring the potential of Large language models (LLMs) for hardware security tasks. However, there are no current studies that explore, study, and compare the applicability of open-source vs. enterprise LLMs for efficient HT detection and explanation of the detected HT. To close the gap, we propose an innovative HT detection and explanation method by leveraging the knowledge of a pre-trained LLM, namely enterprise application programming interface (API)-enabled a Generative Pre-trained Transformer (GPT)-3.5 Turbo, Google Gemini 1.5 Pro and open-source LLMs: Meta AI Llama-3.1 and DeepSeek AI DeepSeek-V2 models, which have already been trained on massive and diverse datasets and is capable of providing the reasoning of the detected HT. Specifically, we apply In-Context Learning (ICL)-based mechanisms: zero-shot, one-shot, and few-shot learning strategies (e.g., register transfer level (RTL) files (Verilog) of the circuit) to adopt this model for HT detection and explanation tasks. We validate our proposed approach on diverse circuit design benchmarks from Trust-Hub and ISCAS (85 and 89). Our experimental results show that the proposed few-shot learning-based enterprise-API-enabled GPT-3.5 Turbo and open-source DeepSeek-V2 LLM models detect unknown HTs with an accuracy of 97% and 91% and drastically reduce the training time compared to state-of-the-art techniques. Furthermore, after detecting the HT, they provide human-centric reasoning/explanation, reinforcing transparency and trust in the IC supply chain through its understanding.","2169-3536","","10.1109/ACCESS.2025.3592030","","https://ieeexplore.ieee.org/stamp/stamp.jsp?arnumber=11091291","Hardware trojan;deep learning;large language model;in-context learning;explainable AI","Trojan horses;Training;Computational modeling;Integrated circuit modeling;Accuracy;Data models;Cognition;Benchmark testing;Register transfer level;Predictive models","","","","65","CCBY","23 Jul 2025","","","IEEE","IEEE Journals"
"Exploring the Privacy Protection Capabilities of Chinese Large Language Models","Y. Yang; X. Huang; J. Sang","Beijing Jiaotong University, Beijing, China; Beijing Jiaotong University, Beijing, China; Beijing Jiaotong University, Beijing, China",IEEE MultiMedia,"","2025","PP","99","1","9","Large language models (LLMs) are renowned for their advanced capabilities, significantly enhancing artificial intelligence. However, these advancements have also raised increasing concerns about privacy and security. To address these issues, we developed a three-tiered framework designed to evaluate privacy in language systems through progressively complex tests. Our primary goal is to measure the sensitivity of LLMs to private information, studying their ability to identify, manage, and protect sensitive data across different scenarios. This systematic evaluation helps determine how well these models comply with privacy guidelines and the effectiveness of their safeguards against breaches. Our findings suggest that current Chinese LLMs show widespread privacy protection issues, indicating that this challenge remains common and may pose corresponding privacy risks in applications based on these models.","1941-0166","","10.1109/MMUL.2025.3542508","","https://ieeexplore.ieee.org/stamp/stamp.jsp?arnumber=10893707","","Privacy;Large language models;Data privacy;Protection;Context modeling;Testing;Security;Electronic mail;Data models;Training","","","","","IEEE","19 Feb 2025","","","IEEE","IEEE Early Access Articles"
"Irony Detection, Reasoning and Understanding in Zero-shot Learning","P. Yi; Y. Xia; Y. Long",NA; NA; NA,IEEE Transactions on Artificial Intelligence,"","2025","PP","99","1","14","Irony is a powerful figurative language (FL) on social media that can potentially mislead various NLP tasks, such as recommendation systems, misinformation checks, and sentiment analysis. Understanding the implicit meaning of this kind of subtle language is an essential step to mitigate the negative impact of irony in NLP tasks. However, existing efforts are limited to domain-specific datasets and struggle to generalize across diverse real-world scenarios. Moreover, reasoning for model decisions that accurately capture semantic and affective meaning remains underexplored. To address these limitations, this paper proposes a conceptual framework called IDADP, which leverages Large language models(LLMs)’ in-context learning capabilities to detect irony and generate human-like explanations across diverse datasets and platforms without prior training on ironic samples. Extensive experiments on six widely used irony detection datasets, utilising two large language models (GPT and Gemini), demonstrate that IDADP consistently outperforms six competitive zero-shot baselines and approaches the performance of three fine-tuned supervised learning baselines. Additionally, we examine GPT’s ability to understand the true intent behind ironic text within the IDADP framework, highlighting its strong potential to recognize and interpret statements where the intended meaning differs from or contrasts with the literal meaning. Furthermore, we conduct qualitative analyses to identify remaining challenges. This work, in turn, opens an avenue for transparent decision-making in irony detection.","2691-4581","","10.1109/TAI.2025.3579452","","https://ieeexplore.ieee.org/stamp/stamp.jsp?arnumber=11036129","Large Language Models;Prompt engineering;Zero-shot learning","Cognition;Prompt engineering;Training;Zero shot learning;Social networking (online);Feature extraction;Sentiment analysis;Semantics;Scalability;Manuals","","","","","IEEE","13 Jun 2025","","","IEEE","IEEE Early Access Articles"
