"A New AI Literacy For The Algorithmic Age: Prompt Engineering Or Eductional Promptization?","H. Haugsbaken; M. Hagelia","Dept. of Education, ICT and Learning, Østfold University College, Halden, Norway; Dept. of Education, ICT and Learning, Østfold University College, Halden, Norway",2024 4th International Conference on Applied Artificial Intelligence (ICAPAI),"31 May 2024","2024","","","1","8","The introduction and rapid adoption of particular Artificial Intelligence (AI) technologies such as Large Language Models, where among other, Chat Generative Pre-trained Transformer (ChatGPT) is a prominent one, have caused a significant increase in research interest for prompt engineering. Prompt engineering can be loosely described as a new emerging field where one attempts to develop particular methods, strategies, and frameworks with the main aim of organizing and structuring inputs in such a way that sophisticated AI systems can perform different tasks. These methods, techniques, and frameworks can be concepts like in-context learning, Chain-of-Thought (CoT), Retrieval Augmented Generation, ReAct prompting, and Directional Stimulus Prompting. These approaches are mainly developed so users can communicate more effectively and accurately with AI language models and enable obtaining better outputs or responses tailored to queries or goals they set. As an extension and new contribution to the mentioned research field, this conceptual paper aims to introduce, propose, and theorize the notion of ‘educational promptization’. This will be done by connecting prompting to a particular social scientific practice perspective, sociomateriality. The rationale for arguing, however, is related to a need to develop an alternative research perspective to those that already dominate the mentioned research field, a research stream this conceptual paper also aims to engage with. Educational promptization is suggested as there is a demand to develop a more student-centric media literacy, especially as students and teachers engage with AI language interpreters on a daily basis. This means that the proposed educational promptization can arguably be considered to be part of a future AI literacy. An essential component of it is that one has to encompass the relational and symmetrical engagement with AI models. This is perhaps required because students will most likely be challenged to master the knowledge and skills in designing prompts, while simultaneously being capable of critically and meaningfully assessing the output of the prompts they created. In other words, mastering the complex input-and-output engagements with an AI system will be essential in students’ future learning processes.","","979-8-3503-4976-4","10.1109/ICAPAI61893.2024.10541229","","https://ieeexplore.ieee.org/stamp/stamp.jsp?arnumber=10541229","prompt;prompt engineering;education;student;digital competence;sociomateriality","Uncertainty;Education;Media;Transformers;Chatbots;Artificial intelligence;Task analysis","","7","","40","IEEE","31 May 2024","","","IEEE","IEEE Conferences"
"Large Language Model for Smart Inverter Cyber-Attack Detection via Textual Analysis of Volt/VAR Commands","A. Selim; J. Zhao; B. Yang","Department of Electrical and Computer Engineering, University of Connecticut, Storrs, CT, USA; Department of Electrical and Computer Engineering, University of Connecticut, Storrs, CT, USA; Research and Development Division, Hitachi America Ltd., Santa Clara, CA, USA",IEEE Transactions on Smart Grid,"25 Oct 2024","2024","15","6","6179","6182","This letter demonstrates a proof-of-concept validation of the Large Language Model (LLM) for smart inverter cyberattack detection through textual control commands. The proposed method can detect the manipulation of Volt/VAR curves and the comparison results with state-of-the-art machine learning techniques highlight its efficacy in identifying cyber attacks. Test results obtained from a real distribution feeder in Colorado, USA, validate the high accuracy for attack classification as well as demonstrate the potential of LLMs in adding a robust security layer for cyber-attacks.","1949-3061","","10.1109/TSG.2024.3453648","U.S. Department of Energy’s Office of Cybersecurity, Energy Security, and Emergency Response; Hitachi America; ","https://ieeexplore.ieee.org/stamp/stamp.jsp?arnumber=10663471","Large language models;cyber-attack detection;Volt/VAR control;text security;distribution network","Cyberattack;Adaptation models;Inverters;Electric potential;Voltage control;Training;Standards","","6","","10","IEEE","2 Sep 2024","","","IEEE","IEEE Journals"
"Vulnerability Handling of AI-Generated Code - Existing Solutions and Open Challenges","S. Kaniewski; D. Holstein; F. Schmidt; T. Heer","Esslingen University of Applied Sciences, Germany; Esslingen University of Applied Sciences, Germany; Esslingen University of Applied Sciences, Germany; Esslingen University of Applied Sciences, Germany","2024 Conference on AI, Science, Engineering, and Technology (AIxSET)","3 Dec 2024","2024","","","145","148","The increasing use of generative Artificial Intelligence (AI) in modern software engineering, particularly Large Language Models (LLMs) for code generation, has transformed professional software development by boosting productivity and automating development processes. This adoption, however, has highlighted a significant issue: the introduction of security vulnerabilities into the code. These vulnerabilities result, e.g., from flaws in the training data that propagate into the generated code, creating challenges in tackling them in established ways. Traditional vulnerability handling processes often involve extensive manual review. Applying such traditional processes to AI-generated code is challenging. AI-generated code may include several similar vulnerabilities, possibly in slightly different forms as developers might not build on already implemented code, using functions or libraries, but prompt similar tasks. In this work, we explore the current state of LLM-based approaches for vulnerability handling, focusing on approaches for vulnerability detection, localization, and repair. We provide an overview of recent progress in this area and highlight open challenges that must be addressed to establish a reliable and scalable vulnerability handling process for AI-generated code.","","979-8-3503-9099-5","10.1109/AIxSET62544.2024.00026","Deutsche Forschungsgemeinschaft(grant numbers:528745080 - FIP 68); ","https://ieeexplore.ieee.org/stamp/stamp.jsp?arnumber=10771069","Vulnerability Handling;Software Engineering;Large Language Models;Retrieval-Augmented Generation","Productivity;Codes;Reviews;Prevention and mitigation;Training data;Manuals;Software reliability;Security;Software engineering;Software development management","","1","","42","IEEE","3 Dec 2024","","","IEEE","IEEE Conferences"
"Privacy and Copyright Protection in Generative AI: A Lifecycle Perspective","D. Zhang; B. Xia; Y. Liu; X. Xu; T. Hoang; Z. Xing; M. Staples; Q. Lu; L. Zhu","CSIRO's Data61, Australia; CSIRO's Data61, Australia; CSIRO's Data61, Australia; CSIRO's Data61, Australia; CSIRO's Data61, Australia; CSIRO's Data61, Australia; CSIRO's Data61, Australia; CSIRO's Data61, Australia; CSIRO's Data61, Australia",2024 IEEE/ACM 3rd International Conference on AI Engineering – Software Engineering for AI (CAIN),"18 Jun 2024","2024","","","92","97","The advent of Generative AI has marked a significant milestone in artificial intelligence, demonstrating remarkable capabilities in generating realistic images, texts, and data patterns. However, these advancements come with heightened concerns over data privacy and copyright infringement, primarily due to the reliance on vast datasets for model training. Traditional approaches like differential privacy, machine unlearning, and data poisoning only offer fragmented solutions to these complex issues. Our paper delves into the multifaceted challenges of privacy and copyright protection within the data lifecycle. We advocate for integrated approaches that combines technical innovation with ethical foresight, holistically addressing these concerns by investigating and devising solutions that are informed by the lifecycle perspective. This work aims to catalyze a broader discussion and inspire concerted efforts towards data privacy and copyright integrity in Generative AI.CCS CONCEPTS• Software and its engineering Software architectures; • Information systems World Wide Web; • Security and privacy Privacy protections; • Social and professional topics Copyrights; • Computing methodologies Machine learning.","","979-8-4007-0591-5","","","https://ieeexplore.ieee.org/stamp/stamp.jsp?arnumber=10556135","Privacy;Copyrights;Generative AI;Data Lifecycle;Software Architecture;Software Engineering for AI","Training;Data privacy;Technological innovation;Generative AI;Software architecture;Copyright protection;Software","","4","","29","","18 Jun 2024","","","IEEE","IEEE Conferences"
"CodEv: An Automated Grading Framework Leveraging Large Language Models for Consistent and Constructive Feedback","E. -Q. Tseng; P. -C. Huang; C. Hsu; P. -Y. Wu; C. -T. Ku; Y. Kang","Department of Information Management, National Sun Yat-Sen University, Kaohsiung, Taiwan; Department of Information Management, National Sun Yat-Sen University, Kaohsiung, Taiwan; Department of Information Management, National Sun Yat-Sen University, Kaohsiung, Taiwan; Department of Information Management, National Sun Yat-Sen University, Kaohsiung, Taiwan; Department of Information Management, National Sun Yat-Sen University, Kaohsiung, Taiwan; Department of Information Management, National Sun Yat-Sen University, Kaohsiung, Taiwan",2024 IEEE International Conference on Big Data (BigData),"16 Jan 2025","2024","","","5442","5449","Grading programming assignments is crucial for guiding students to improve their programming skills and coding styles. This study presents an automated grading framework, CodEv, which leverages Large Language Models (LLMs) to provide consistent and constructive feedback. We incorporate Chain of Thought (CoT) prompting techniques to enhance the reasoning capabilities of LLMs and ensure that the grading is aligned with human evaluation. Our framework also integrates LLM ensembles to improve the accuracy and consistency of scores, along with agreement tests to deliver reliable feedback and code review comments. The results demonstrate that the framework can yield grading results comparable to human evaluators, by using smaller LLMs. Evaluation and consistency tests of the LLMs further validate our approach, confirming the reliability of the generated scores and feedback.","2573-2978","979-8-3503-6248-0","10.1109/BigData62323.2024.10825949","","https://ieeexplore.ieee.org/stamp/stamp.jsp?arnumber=10825949","Large Language Model;LLM Evaluation;Automated Grading","Codes;Reviews;Large language models;Big Data;Encoding;Data models;Cognition;Reliability;Programming profession;Testing","","1","","23","IEEE","16 Jan 2025","","","IEEE","IEEE Conferences"
"CyGPT: Knowledge Graph-Based Enhancement Techniques for Large Language Models in Cybersecurity","L. Ou; X. Ni; W. Wu; Z. Tian","Cyberspace Institute of Advanced Technology, Guangzhou University, Guangzhou, China; Cyberspace Institute of Advanced Technology, Guangzhou University, Guangzhou, China; Cyberspace Institute of Advanced Technology, Guangzhou University, Guangzhou, China; Cyberspace Institute of Advanced Technology, Guangzhou University, Guangzhou, China",2024 IEEE 9th International Conference on Data Science in Cyberspace (DSC),"4 Feb 2025","2024","","","216","223","Large Language Models (LLMs) excel in numerous Natural Language Processing (NLP) tasks but encounter significant challenges in practical applications, including hallucinations, outdated information, and a lack of domain-specific external knowledge. This study proposes a collaborative, training-free reasoning approach, leveraging close cooperation between Knowledge Graphs (KG) and LLMs for cybersecurity applications. Our approach employs the ‘Joint Reasoning Chain,’ which dynamically integrates information from network security-specific knowledge graphs, serving as an external knowledge base to enhance the domain-specific external knowledge of LLMs. This cooperative method not only improves reliable knowledge-based reasoning but also enhances the traceability of decision-making processes. Furthermore, we introduce a novel GPT-based technique to evaluate answer quality and have performed systematic experiments on a purpose-built test set. The results confirm that our method significantly boosts GPT’s performance in network security knowledge, demonstrating the potential of knowledge graphs to augment LLMs’ reasoning abilities and their applicability in specialized fields.","","979-8-3503-9136-7","10.1109/DSC63484.2024.00036","","https://ieeexplore.ieee.org/stamp/stamp.jsp?arnumber=10858965","Large Language Model;Knowledge Graph;Retrieval-Augmented Generation;Cybersecurity","Knowledge engineering;Systematics;Large language models;Knowledge based systems;Knowledge graphs;Network security;Cognition;Natural language processing;Data models;Computer security","","","","33","IEEE","4 Feb 2025","","","IEEE","IEEE Conferences"
"PyLoomer - The Automated Weaving of Python Text","A. Sahani; R. B. Trivedi; T. Singh; S. R. Goyal","Dept. of Mechnical Engineering, Manipal University Jaipur, Jaipur, Rajasthan, India; Dept. of Computer and Communication Engineering, Manipal University Jaipur, Jaipur, Rajasthan, India; Dept. of Computer and Communication Engineering, Manipal University Jaipur, Jaipur, Rajasthan, India; Dept. of Computer and Communication Engineering, Manipal University Jaipur, Jaipur, Rajasthan, India","2024 2nd International Conference on Device Intelligence, Computing and Communication Technologies (DICCT)","22 May 2024","2024","","","276","281","The introduction of attention mechanisms has evolved NLP methodologies, giving rise to Large Language Models (LLMs) that excel in various sequence-to-sequence tasks like translation, question-answering, summarization, intent, and entity classification. This research focuses on text to code translation, converting human language into executable code. Code generating bots enhances the quality and efficiency of developers and facilitates to tackle the repetitive or simple tasks. A novel and clever fusion of Python Code and the creative ability of Large Language Models to generate text is proposed in this paper named PyLoomer. PyLoomer is an innovative text-to-python code chatbot that bridges the gap between narrative expression and technical execution which uses attention mechanism. PyLoomer seeks to improve the performance of existing models for python code generation by using in-context learning and instruction fine-tuning. Rigorous evaluation metrices, including Rougel, Rouge2, RougeL, RougeLsum and model loss, demonstrated significant improvements in results. Results indicate that CodGen, among the three models, achieves the highest Rouge scores, demonstrating superior performance, the Rouge score improvements for Codegen, StarCoder and CodeParrot are 0.0224, 0.0097 and 0.0223 respectively.","","979-8-3503-7284-7","10.1109/DICCT61038.2024.10532945","","https://ieeexplore.ieee.org/stamp/stamp.jsp?arnumber=10532945","Large Language Models;In-context learning;Attention mechanism;Instruction Finetuning;Python;PyLoomer","Performance evaluation;Codes;Computational modeling;Chatbots;Weaving;Communications technology;Task analysis","","","","21","IEEE","22 May 2024","","","IEEE","IEEE Conferences"
"Vulnerabilities Analysis and Defense Based on MAS Method in Fast Dynamic Wireless Networks","I. Burlachenko; I. Zhuravska; Y. Davydenko; V. Savinov","Petro Mohyla Black Sea, National University 10, Mykolaiv, Ukraine; Petro Mohyla Black Sea, National University 10, Mykolaiv, Ukraine; Petro Mohyla Black Sea, National University 10, Mykolaiv, Ukraine; Petro Mohyla Black Sea, National University 10, Mykolaiv, Ukraine",2018 IEEE 4th International Symposium on Wireless Systems within the International Conferences on Intelligent Data Acquisition and Advanced Computing Systems (IDAACS-SWS),"8 Nov 2018","2018","","","98","102","Corporate and large-scale organizations utilize computer network technologies and dismiss the importance of networks security. The main wireless networks vulnerabilities exploitered by attackers, and methods of protection from attacks are investigated. The methodology of security analysis in fast dynamic wireless networks (FDWNs) is proposed. Model of a multi-agent system (MAS) providing the ability to create data protection strategy based on agents with an effective detailed examination of networks vulnerabilities was provided.","","978-1-5386-7587-8","10.1109/IDAACS-SWS.2018.8525692","","https://ieeexplore.ieee.org/stamp/stamp.jsp?arnumber=8525692","fast dynamic wireless network;network security;ARP spoofing;MitM;SSL strip;multi-agent system;SOHO router;DD-WRT;Intercepter-NG","Wireless networks;Communication networks;Data protection;Strips;Cryptography;Authorization","","7","","19","IEEE","8 Nov 2018","","","IEEE","IEEE Conferences"
"Exploring the Impact of the Output Format on the Evaluation of Large Language Models for Code Translation","M. Macedo; Y. Tian; F. R. Cogo; B. Adams","Queen's University, Kingston, ON, Canada; Queen's University, Kingston, ON, Canada; Centre for Software Excellence, Huawei Canada, Kingston, ON, Canada; Queen's University, Kingston, ON, Canada",2024 IEEE/ACM First International Conference on AI Foundation Models and Software Engineering (Forge) Conference Acronym:,"30 Jul 2024","2024","","","57","68","Code translation between programming languages is a long-existing and critical task in software engineering, facilitating the modernization of legacy systems, ensuring cross-platform compatibility, and enhancing software performance. With the recent advances in large language models (LLMs) and their applications to code translation, there is an increasing need for comprehensive evaluation of these models. In this study, we empirically analyze the generated outputs of eleven popular instruct-tuned LLMs with parameters ranging from 1B up to 46.7B on 3,820 translation pairs across five languages, including C, C++, Go, Java, and Python. Our analysis found that between 26.4% and 73.7% of code translations produced by our evaluated LLMs necessitate post-processing, as these translations often include a mix of code, quotes, and text rather than being purely source code. Overlooking the output format of these models can inadvertently lead to underestimation of their actual performance. This is particularly evident when evaluating them with execution-based metrics such as Computational Accuracy (CA). Our results demonstrate that a strategic combination of prompt engineering and regular expression can effectively extract the source code from the model generation output. In particular, our method can help eleven selected models achieve an average Code Extraction Success Rate (CSR) of 92.73%. Our findings shed light on and motivate future research to conduct more reliable benchmarks of LLMs for code translation.","","979-8-4007-0536-6","10.1145/3650105.3652301","","https://ieeexplore.ieee.org/stamp/stamp.jsp?arnumber=10599575","code translation;output format;large language model;LLM;soft-ware engineering;benchmarking;evaluation;empirical study;case study","Codes;Accuracy;Terminology;Computational modeling;Large language models;Source coding;Benchmark testing","","3","","49","","30 Jul 2024","","","IEEE","IEEE Conferences"
"NLSQL: Generating and Executing SQL Queries via Natural Language Using Large Language Models","A. Attawar; S. Vora; P. Narechania; V. Sawant; H. Vora","Dwarkadas J. Sanghvi College of Engineering, Mumbai, India; Dwarkadas J. Sanghvi College of Engineering, Mumbai, India; Dwarkadas J. Sanghvi College of Engineering, Mumbai, India; Dwarkadas J. Sanghvi College of Engineering, Mumbai, India; Director of Data Science and Operations, CareMetx LLC, United States",2023 International Conference on Advanced Computing Technologies and Applications (ICACTA),"23 Jan 2024","2023","","","1","6","The goal of data management has long been to make data more approachable for non-technical users. Natural language interfaces (NLIs), which let users interact with data by asking questions in natural language, have become more popular in recent years. Natural language is often vague, and user queries often don’t give enough information. This makes it hard to use NLIs for database querying. In order to solve this problem, this study suggests using large language models (LLMs) to turn free-form natural language queries into SQL statements that can then be run on databases. The proposed system, NLSQL, makes use of LLMs like GPT-3 and shows how efficiently prompt engineering can be done in order to extract from LLMs the desired code for SQL queries. NLSQL shows that using pre-trained LLMs along with the suggested priming prompts is an accurate and reliable way to create and run SQL queries in natural language, even if the queries aren’t very well written or are missing important information. Unlike traditional methods, which involve making grammar rules by hand, this method improves query inference and makes the development of NLIs faster and cheaper. The study shows that the suggested method is safe, protects privacy, and can be used with many different databases. If NLSQL is used to make databases easier for people who aren’t tech-savvy to use, they may not need as much training in SQL and related technologies, which would save a company both time and money.","","979-8-3503-4834-7","10.1109/ICACTA58201.2023.10392861","","https://ieeexplore.ieee.org/stamp/stamp.jsp?arnumber=10392861","natural language processing;NLSQL;natural language interfaces;language models","Training;Structured Query Language;Codes;Natural languages;Relational databases;Solids;Data models","","2","","24","IEEE","23 Jan 2024","","","IEEE","IEEE Conferences"
"Efficient Driving Behavior Narration and Reasoning on Edge Device Using Large Language Models","Y. Huang; Y. Cheng; K. Wang","Department of Computer Science, Brunel University of London, UK; School of Computer Science, University of Birmingham, UK; Department of Computer Science, Brunel University of London, UK",IEEE Transactions on Vehicular Technology,"","2025","PP","99","1","5","Large language models (LLMs) with robust reasoning capabilities have significantly advanced the development of autonomous driving technologies, particularly in the narration and reasoning of driving behaviors, which hold substantial importance for accident analysis and traffic management. However, traditional deployment of these models relies on cloud servers, resulting in high latency and training costs, making it challenging to meet the stringent real-time requirements of autonomous driving scenarios. Recent studies suggest that edge computing, by deploying models closer to the data source, offers a promising solution to these issues. While existing general-purpose LLMs excel in video understanding and task reasoning, their generalization capabilities in rapidly changing traffic scenarios remain questionable. This paper provides a valuable reference for deploying LLMs at the edge in autonomous driving contexts. By leveraging real-world 5G networks for rapid deployment, we validate the performance and response speeds of various models in autonomous driving scenarios. Furthermore, we introduce an innovative prompt engineering strategy that enhances model performance by 25% without changing model parameters through minimal prompt tuning. Experimental results demonstrate that LLMs deployed on edge devices achieve satisfactory response times. Tests on the OpenDV-YouTube dataset further confirm that our prompt strategy significantly improves the performance of driving behavior narration and reasoning.","1939-9359","","10.1109/TVT.2025.3591733","","https://ieeexplore.ieee.org/stamp/stamp.jsp?arnumber=11091354","Autonomous driving;Large language model;Edge computing","Cognition;Driver behavior;Autonomous vehicles;5G mobile communication;Performance evaluation;Portable computers;Knowledge based systems;Time factors;Servers;Pedestrians","","1","","","IEEE","23 Jul 2025","","","IEEE","IEEE Early Access Articles"
