"ClauseBench: Enhancing Software License Analysis with Clause-Level Benchmarking","Q. Ke; X. Hou; Y. Zhao; H. Wang","Huazhong University of Science and Technology, Wuhan, China; Huazhong University of Science and Technology, Wuhan, China; Huazhong University of Science and Technology, Wuhan, China; Huazhong University of Science and Technology, Wuhan, China",2025 IEEE/ACM 47th International Conference on Software Engineering: Companion Proceedings (ICSE-Companion),"13 Jun 2025","2025","","","255","266","Open-source software (OSS) has revolutionized modern software development by fostering collaboration across diverse teams. However, as OSS projects grow in size and complexity, managing license compliance has become increasingly challenging. A critical issue lies in accurately recognizing and interpreting the varied clauses within OSS licenses, particularly when multiple licenses coexist, each with distinct permissions, obligations, and restrictions. Traditional license analysis tools, often rule-based, struggle to identify nuanced conflicts between license clauses, leading to potential compliance risks. In response to these challenges, this paper presents a fine-grained, high- quality dataset of 634 SPDX-certified licenses, annotated with 3,396 individual clauses across 14 categories. Each clause has been meticulously reviewed and validated using model-assisted checks to ensure accuracy, providing a solid foundation for detailed clause-level analysis. To improve clause recognition and conflict detection, we introduce Clausebench,a benchmarking framework that leverages large language models (LLMs) to detect and interpret license clauses with high precision. Clausebenchimproves detection accuracy by 50% compared to traditional document-level methods and significantly reduces hallucination rates by focusing on individual clauses, where precise distinctions in legal language are crucial. We also implemented a contextual prompt engineering strategy to optimize model performance, achieving 90% accuracy in clause identification. Our work sets a new standard for automated license conflict detection in OSS, demonstrating the potential of LLMs to manage the complexities of legal text interpretation. This work advances the license analysis field and opens the door to future research on integrating LLMs with OSS compliance tools.","2574-1934","979-8-3315-3683-1","10.1109/ICSE-Companion66252.2025.00080","","https://ieeexplore.ieee.org/stamp/stamp.jsp?arnumber=11024443","","Solid modeling;Accuracy;Law;Licenses;Benchmark testing;Solids;Complexity theory;Software reliability;Prompt engineering;Standards","","","","44","IEEE","13 Jun 2025","","","IEEE","IEEE Conferences"
"Distributed Threat Intelligence at the Edge Devices: A Large Language Model-Driven Approach","S. M. Hasan; A. M. Alotaibi; S. Talukder; A. R. Shahid","School of Computing, Southern Illinois University, Carbondale, IL, USA; School of Computing, Southern Illinois University, Carbondale, IL, USA; School of Computing, Southern Illinois University, Carbondale, IL, USA; School of Computing, Southern Illinois University, Carbondale, IL, USA","2024 IEEE 48th Annual Computers, Software, and Applications Conference (COMPSAC)","26 Aug 2024","2024","","","1496","1497","With the proliferation of edge devices, there is a significant increase in attack surface on these devices. The decen-tralized deployment of threat intelligence on edge devices, coupled with adaptive machine learning techniques such as the in-context learning feature of Large Language Models (LLMs), represents a promising paradigm for enhancing cybersecurity on resource-constrained edge devices. This approach involves the deployment of lightweight machine learning models directly onto edge devices to analyze local data streams, such as network traffic and system logs, in real-time. Additionally, distributing computational tasks to an edge server reduces latency and improves responsiveness while also enhancing privacy by processing sensitive data locally. LLM servers can enable these edge servers to autonomously adapt to evolving threats and attack patterns, continuously updating their models to improve detection accuracy and reduce false positives. Furthermore, collaborative learning mechanisms facilitate peer-to-peer secure and trustworthy knowledge sharing among edge devices, enhancing the collective intelligence of the network and enabling dynamic threat mitigation measures such as device quarantine in response to detected anomalies. The scalability and flexibility of this approach make it well-suited for diverse and evolving network environments, as edge devices only send suspicious information such as network traffic and system log changes, offering a resilient and efficient solution to combat emerging cyber threats at the network edge. Thus, our proposed framework can improve edge computing security by providing better security in cyber threat detection and mitigation by isolating the edge devices from the network.","2836-3795","979-8-3503-7696-8","10.1109/COMPSAC61105.2024.00206","","https://ieeexplore.ieee.org/stamp/stamp.jsp?arnumber=10633440","Edge Computing;Threat Intelligence;Machine Learning (ML);Large Language Model (LLM)","Adaptation models;Image edge detection;Computational modeling;Prevention and mitigation;Telecommunication traffic;Threat assessment;Software","","6","","4","IEEE","26 Aug 2024","","","IEEE","IEEE Conferences"
"State-Observer-Based Event-Trigger Bipartite Consensus Secure Control for NMASs With Deception Attacks","S. Sui; D. Shen; S. Tong; C. L. P. Chen","College of Science, Liaoning University of Technology, Jinzhou, China; College of Science, Liaoning University of Technology, Jinzhou, China; College of Science, Liaoning University of Technology, Jinzhou, China; School of Computer Science and Engineering, South China University of Technology, Guangzhou, China",IEEE Transactions on Network Science and Engineering,"20 Nov 2024","2024","11","6","5732","5743","Deception attacks are a big danger to the security and durability of multi-agent systems (MASs). This article introduces a new technique to tackle the problem of deception attacks in nonlinear multi-agent systems (NMASs). The system can be attacked through sensors and actuators, which may lead to incomplete system data transmission and render the system state inaccessible for control design. To overcome this challenge, a fuzzy state observer is constructed to estimate the system state after the attacks, and the fuzzy logic system (FLS) is used to handle unfamiliar nonlinearities. The Nussbaum function is proposed to deal with unknown control directions and reduces system complexity. In addition, considering that there are both cooperative and competitive relationships between agents, event-triggered bipartite consensus fuzzy security adaptive control is given to mitigate the effects of deception attacks and alleviate communication resources. A based-state-observer event-triggered bipartite consensus NMASs adaptive fuzzy security control is given to achieve asymptotic output consistency after the attacks. Using Lyapunov theory, it has been demonstrated that all signals within the closed-loop system remain bounded. Finally, the test simulations show that the suggested approach can maintain the security and stability of the system during deception attacks with minimal data and resources.","2327-4697","","10.1109/TNSE.2024.3436085","National Natural Science Foundation of China(grant numbers:62333004,62176111,62173172); Excellent Young Scientists Fund Program; Xingliao Talent Plan(grant numbers:XLYC 2203188); ","https://ieeexplore.ieee.org/stamp/stamp.jsp?arnumber=10618996","Bipartite consensus tracking;deception attacks;event-triggered control;NMASs;secure adaptive control","Security;Observers;Fuzzy logic;Sensors;Sensor systems;Neural networks;Consensus protocol;Event detection;Adaptive control;Multi-agent systems","","4","","34","IEEE","31 Jul 2024","","","IEEE","IEEE Journals"
"An Ubiquitous Multi-agent Mobile Platform for Distributed Crowd Sensing and Social Mining","S. Bosse; E. Pournaras","Department of Mathematics & Computer Science, University of Bremen, Bremen, Germany; Chair of Sociology, in particular Modeling and Simulation ETH Zürich, Zürich, Switzerland",2017 IEEE 5th International Conference on Future Internet of Things and Cloud (FiCloud),"20 Nov 2017","2017","","","280","287","Smart mobile devices are fundamental date sources for crowd activity tracing. Large-scale mobile networks and the Internet-of-Things (IoT) expand and become part of pervasive and ubiquitous computing offering distributed and trans-parent services. With the IoT, Crowd Sensing is extended by Things Sensing, creating heterogeneous smart environments. A unified and common data processing and communication methodology is required so that the IoT, mobile networks, and Cloud-based environments seamlessly integrate, which can be fulfilled by self-organizing mobile agents, discussed in this work. Currently, portability, resource constraints, security, and scalability of Agent Processing Platforms (APP) are essential issues for the deployment of Multi-agent Systems (MAS) in highly heterogeneous networks. Beside the operational aspects of MAS, an organizational structure is required for the deployment of MAS in crowd sensing and social mining applications. The Planetary Nervous system (Nervousnet) consists of virtual sensors building the core functionality for such applications running on smart phones with a Cloud-like architecture. The virtual sensors enable a holistic composition and modelling approach. Self-organizing and adaptive mobile agents are well known as the core cells of holistic and modular systems. In this work, both concepts are combined. JavaScript agents are introduced as virtual sensors in the Nervousnet environment, evaluated with a simulation of a distributed sensor fusion use-case in a mobile network based on real-world data from Nervousnet, showing the suitability of the hybrid approach, benefiting from local and event-based sensor processing performed by the MAS.","","978-1-5386-2074-8","10.1109/FiCloud.2017.44","","https://ieeexplore.ieee.org/stamp/stamp.jsp?arnumber=8114494","Crowd Sensing;Pervasive Computing;Ubiquitous Computing;Agents;Self-organizing systems","Sensors;Mobile communication;Cloud computing;Mobile agents;Smart phones;Mobile computing","","3","","16","IEEE","20 Nov 2017","","","IEEE","IEEE Conferences"
"Undertaking an ERP: Evaluating the Security of Apex 5 Developed Software","E. Crespo; C. Astudillo; M. Orellana","Universidad del Azuay, Cuenca, Azuay, EC; Universidad del Azuay, Cuenca, Azuay, EC; Universidad del Azuay, Cuenca, Azuay, EC",2017 International Conference on Information Systems and Computer Science (INCISCOS),"2 Apr 2018","2017","","","174","180","La seguridad de la información es una preocupación creciente en empresas y organizaciones, siendo más alta aun cuando se vincula a plataformas financieras donde existe información sensible. El presente trabajo resume las técnicas utilizadas en el pentesting realizado tanto al servidor que aloja al producto informático, como al software ERP desarrollado en la herramienta APEX 5 por la Universidad del Azuay. Se han contemplado seis etapas que sugiere una prueba de penetración: i) la conceptualización, que es la etapa que permite definir el alcance de las pruebas a realizar; ii) la preparación del laboratorio en la que se definen algunas de las herramientas que servirán para el inicio de las pruebas de seguridad; iii) la obtención de información que hace referencia a las etapas de reconocimiento y escaneo en la que se identifican posibles objetivos para luego explorar con mayor profundidad algunas características intrínsecas que puedan ser aprovechadas; iv) el análisis de las vulnerabilidades encontradas en la etapa anterior; v) la explotación de esas vulnerabilidades mediante la selección de herramientas; y vi) la post explotación, etapa en la que se contempla la destrucción de evidencias del ataque y la conservación de la conexión y los accesos logrados para extraer información. Todas estas pruebas fueron efectuadas dentro de las instalaciones de la Universidad del Azuay, considerando el ambiente de desarrollo en el que actualmente se encuentra el proyecto ERP.","","978-1-5386-2644-3","10.1109/INCISCOS.2017.24","","https://ieeexplore.ieee.org/stamp/stamp.jsp?arnumber=8328103","Pentesting;Seguridad Informática;APEX;ERP;Hacking","Software;Computer crime;IP networks;Cross-site scripting;Tools;Silicon","","1","","","IEEE","2 Apr 2018","","","IEEE","IEEE Conferences"
"End-to-End Autonomous Driving: Challenges and Frontiers","L. Chen; P. Wu; K. Chitta; B. Jaeger; A. Geiger; H. Li","OpenDriveLab, Shanghai AI Lab, Shanghai, China; OpenDriveLab, Shanghai AI Lab, Shanghai, China; University of Tübingen, Tübingen, Germany; University of Tübingen, Tübingen, Germany; University of Tübingen, Tübingen, Germany; OpenDriveLab, Shanghai AI Lab, Shanghai, China",IEEE Transactions on Pattern Analysis and Machine Intelligence,"6 Nov 2024","2024","46","12","10164","10183","The autonomous driving community has witnessed a rapid growth in approaches that embrace an end-to-end algorithm framework, utilizing raw sensor input to generate vehicle motion plans, instead of concentrating on individual tasks such as detection and motion prediction. End-to-end systems, in comparison to modular pipelines, benefit from joint feature optimization for perception and planning. This field has flourished due to the availability of large-scale datasets, closed-loop evaluation, and the increasing need for autonomous driving algorithms to perform effectively in challenging scenarios. In this survey, we provide a comprehensive analysis of more than 270 papers, covering the motivation, roadmap, methodology, challenges, and future trends in end-to-end autonomous driving. We delve into several critical challenges, including multi-modality, interpretability, causal confusion, robustness, and world models, amongst others. Additionally, we discuss current advancements in foundation models and visual pre-training, as well as how to incorporate these techniques within the end-to-end driving framework.","1939-3539","","10.1109/TPAMI.2024.3435937","National Key R&D Program of China(grant numbers:2022ZD0160104); National Natural Science Foundation of China(grant numbers:62206172); Shanghai Committee of Science and Technology(grant numbers:23YF1462000); ERC(grant numbers:LEGO-3D (850533)); Bundesministerium für Wirtschaft und Energie(grant numbers:19A19013O); DFG EXC(grant numbers:2064/1,390727645); German Federal Ministry of Education and Research; Tübingen AI Center(grant numbers:01IS18039A); ","https://ieeexplore.ieee.org/stamp/stamp.jsp?arnumber=10614862","Autonomous driving;end-to-end system design;policy learning;simulation","Task analysis;Planning;Autonomous vehicles;Trajectory;Surveys;Imitation learning;Benchmark testing","","120","","279","CCBYNCND","30 Jul 2024","","","IEEE","IEEE Journals"
"Exploring LLM-Based Automated Repairing of Ansible Script in Edge-Cloud Infrastructures","S. Kwon; S. Lee; T. Kim; D. Ryu; J. Baik","Korea Advanced Institute of Science and Technology, Daejeon, Republic of Korea; Korea Advanced Institute of Science and Technology, Daejeon, Republic of Korea; Korea Advanced Institute of Science and Technology, Daejeon, Republic of Korea; Jeonbuk National University, Jeonju, Republic of Korea; Korea Advanced Institute of Science and Technology, Daejeon, Republic of Korea",Journal of Web Engineering,"29 Dec 2023","2023","22","6","889","912","Edge-Cloud system requires massive infrastructures located in closer to the user to minimize latencies in handling Big data. Ansible is one of the most popular Infrastructure as Code (IaC) tools crucial for deploying these infrastructures of the Edge-cloud system. However, Ansible also consists of code, and its code quality is critical in ensuring the delivery of high-quality services within the Edge-Cloud system. On the other hand, the Large Langue Model (LLM) has performed remarkably on various Software Engineering (SE) tasks in recent years. One such task is Automated Program Repairing (APR), where LLMs assist developers in proposing code fixes for identified bugs. Nevertheless, prior studies in LLM-based APR have predominantly concentrated on widely used programming languages (PL), such as Java and C, and there has yet to be an attempt to apply it to Ansible. Hence, we explore the applicability of LLM-based APR on Ansible. We assess LLMs' performance (ChatGPT and Bard) on 58 Ansible script revision cases from Open Source Software (OSS). Our findings reveal promising prospects, with LLMs generating helpful responses in 70% of the sampled cases. Nonetheless, further research is necessary to harness this approach's potential fully.","1544-5976","","10.13052/jwe1540-9589.2263","Information Technology Research Center (ITRC)(grant numbers:IITP-2023-2020-0-01795); National Research Foundation of Korea (NRF)(grant numbers:NRF-2022R1I1A3069233); ","https://ieeexplore.ieee.org/stamp/stamp.jsp?arnumber=10376418","Edge-cloud;Ansible;Bard;large langue model;automated program repairing","Java;Computer languages;Codes;Computer bugs;Big Data;Chatbots;Task analysis","","3","","32","","29 Dec 2023","","","River Publishers","River Publishers Journals"
"Developing a Framework for Autonomous Control Software for a Human Colony on Mars","B. Stoick; Z. Luo; D. Tibrewal; K. Setterstrom; A. Jones; J. Straub","Department of Mechanical Engineering, North Dakota State University, Fargo, ND, USA; Department of Communication, North Dakota State University, Fargo, ND, USA; Department of Computer Science, North Dakota State University, Fargo, ND, USA; Department of Computer Science, North Dakota State University, Fargo, ND, USA; Department of Computer Science, North Dakota State University, Fargo, ND, USA; Department of Computer Science, North Dakota State University, Fargo, ND, USA",2019 IEEE International Conference on Electro Information Technology (EIT),"12 Sep 2019","2019","","","515","520","We propose a system of systems architecture to command and control a complex colony on Mars. The architecture is structured largely around the goals of construction, discovery, operations and risk management. Each of these goals is supported by autonomous systems with the ability to perform a diverse set of tasks. As a whole, the system presented is a hybrid distributed-centralized architecture with homogeneous autonomous agents within tasks of smaller scope but heterogeneous agents across the system as a whole. The system leverages the strengths of each element of the hybrid architecture to create a more robust, capable autonomous unit.","2154-0373","978-1-7281-0927-5","10.1109/EIT.2019.8833860","","https://ieeexplore.ieee.org/stamp/stamp.jsp?arnumber=8833860","Martian colony;space exploration;additive manufacturing;system design;system of systems;software command and control","Task analysis;Mars;Robots;Command and control systems;Risk management;Maintenance engineering","","2","","37","IEEE","12 Sep 2019","","","IEEE","IEEE Conferences"
"Model Checking CTLK Based on Knowledge-Oriented Petri Nets","L. He; G. Liu","Department of Computer Science, Tongii University, Shanghai, China; Department of Computer Science, Tongii University, Shanghai, China",2019 IEEE 21st International Conference on High Performance Computing and Communications; IEEE 17th International Conference on Smart City; IEEE 5th International Conference on Data Science and Systems (HPCC/SmartCity/DSS),"3 Oct 2019","2019","","","1139","1146","We define Knowledge-oriented Petri Nets (KPN) to model and analyze multi-agent systems (MAS) especially from the perspective of privacy and security. A KPN is a special Petri net in which some places are used to represent knowledges. Consequently, KPN can formally represent not only the interaction/collaboration process of multiple agents but also their epistemic evolutions. These epistemic evolutions are closely related with the privacy and security of MAS. For those requirements of privacy or security, we use Computation Tree Logic of Knowledge (CTLK) to specify them. We define the similar reachability graphs of KPN and then construct the equivalence classes of knowledges for each agent. Based on them, we design the model checking algorithms to verify CTLK formulas efficiently. Examples of privacy protocols illustrate the usefulness of our model and method.","","978-1-7281-2058-4","10.1109/HPCC/SmartCity/DSS.2019.00161","","https://ieeexplore.ieee.org/stamp/stamp.jsp?arnumber=8855484","epistemic logic;equivalence class;model checking;Petri nets","Petri nets;Protocols;Model checking;Privacy;Security;Receivers;Conferences","","7","","25","IEEE","3 Oct 2019","","","IEEE","IEEE Conferences"
"Large language model-based optical network log analysis using LLaMA2 with instruction tuning","Y. Pang; M. Zhang; Y. Liu; X. Li; Y. Wang; Y. Huan; Z. Liu; J. Li; D. Wang","State Key Laboratory of Information Photonics and Optical Communications, Beijing University of Posts and Telecommunications, Beijing 100876, China; State Key Laboratory of Information Photonics and Optical Communications, Beijing University of Posts and Telecommunications, Beijing 100876, China; State Key Laboratory of Information Photonics and Optical Communications, Beijing University of Posts and Telecommunications, Beijing 100876, China; State Key Laboratory of Information Photonics and Optical Communications, Beijing University of Posts and Telecommunications, Beijing 100876, China; State Key Laboratory of Information Photonics and Optical Communications, Beijing University of Posts and Telecommunications, Beijing 100876, China; State Key Laboratory of Information Photonics and Optical Communications, Beijing University of Posts and Telecommunications, Beijing 100876, China; China Mobile Communications Corporation, Beijing 100033, China; State Key Laboratory of Information Photonics and Optical Communications, Beijing University of Posts and Telecommunications, Beijing 100876, China; State Key Laboratory of Information Photonics and Optical Communications, Beijing University of Posts and Telecommunications, Beijing 100876, China",Journal of Optical Communications and Networking,"24 Oct 2024","2024","16","11","1116","1132","The optical network encompasses numerous devices and links, generating a significant volume of logs. Analyzing these logs is significant for network optimization, failure diagnosis, and health monitoring. However, the large-scale and diverse formats of optical network logs present several challenges, including the high cost and difficulty of manual processing, insufficient semantic understanding in existing analysis methods, and the strict requirements for data security and privacy. Generative artificial intelligence (GAI) with powerful language understanding and generation capabilities has the potential to address these challenges. Large language models (LLMs) as a concrete realization of GAI are well-suited for analyzing DCI logs, replacing human experts and enhancing accuracy. Additionally, LLMs enable intelligent interactions with network administrators, automating tasks and improving operational efficiency. Moreover, fine-tuning with open-source LLMs protects data privacy and enhances log analysis accuracy. Therefore, we introduce LLMs and propose a log analysis method with instruction tuning using LLaMA2 for log parsing, anomaly detection and classification, anomaly analysis, and report generation. Real log data extracted from the field-deployed network was used to design and construct instruction tuning datasets. We utilized the dataset for instruction tuning and demonstrated and evaluated the effectiveness of the proposed scheme. The results indicate that this scheme improves the performance of log analysis tasks, especially a 14% improvement in exact match rate for log parsing, a 13% improvement in F1-score for anomaly detection and classification, and a 23% improvement in usability for anomaly analysis, compared with the best baselines.","1943-0639","","10.1364/JOCN.527874","","https://ieeexplore.ieee.org/stamp/stamp.jsp?arnumber=10734084","","Optical fiber networks;Tuning;Anomaly detection;Security;Accuracy;Data models;Knowledge engineering;Semantics;Monitoring;Analytical models","","4","","","","24 Oct 2024","","","IEEE","IEEE Journals"
