"Inferring Questions from Programming Screenshots","F. Ahmed; X. Tan; F. Adewole; S. Datta; M. Nayebi","York University, Toronto, ON, Canada; York University, Toronto, ON, Canada; York University, Toronto, ON, Canada; York University, Toronto, ON, Canada; York University, Toronto, ON, Canada",2025 IEEE/ACM 22nd International Conference on Mining Software Repositories (MSR),"13 Jun 2025","2025","","","750","755","The integration of generative AI into developer forums like Stack Overflow presents an opportunity to enhance problem-solving by allowing users to post screenshots of code or Integrated Development Environments (IDEs) instead of traditional text-based queries. This study evaluates the effectiveness of various large language models (LLMs)—specifically LLAMA, GEMINI, and GPT-4o in interpreting such visual inputs. We employ prompt engineering techniques, including in-context learning, chain-of-thought prompting, and few-shot learning, to assess each model’s responsiveness and accuracy. Our findings show that while GPT-4o shows promising capabilities, achieving over $60 \%$ similarity to baseline questions for $51.75 \%$ of the tested images, challenges remain in obtaining consistent and accurate interpretations for more complex images. This research advances our understanding of the feasibility of using generative AI for image-centric problem-solving in developer communities, highlighting both the potential benefits and current limitations of this approach while envisioning a future where visual-based debugging copilot tools become a reality.","2574-3864","979-8-3315-0183-9","10.1109/MSR66628.2025.00111","","https://ieeexplore.ieee.org/stamp/stamp.jsp?arnumber=11025629","Large language model;stack overflow","Visualization;Accuracy;Large language models;Debugging;Programming;Software;Problem-solving;Prompt engineering;Data mining;Few shot learning","","","","47","IEEE","13 Jun 2025","","","IEEE","IEEE Conferences"
"An Improved Defender–Attacker–Defender Model for Transmission Line Defense Considering Offensive Resource Uncertainties","Y. Xiang; L. Wang","GEIRI North America, San Jose, CA, USA; GEIRI North America, San Jose, CA, USA",IEEE Transactions on Smart Grid,"22 Apr 2019","2019","10","3","2534","2546","Developing efficient strategies for defending electric power systems against attacks is a major concern for contemporary power grids, especially when uncertainties are involved. This paper addresses the allocation of the defensive resource to minimize the damage when there are uncertainties regarding the resource that the attacker has. A multiple-attack-scenario (MAS) defender-attacker-defender (DAD) model is proposed by extending the conventional trilevel DAD model. The proposed model considers the uncertainties related to the offensive resource and the interactions involving the security personnel at the top-level, the attacker at the middle-level, and the power system operator at the bottom-level. The column-and-constraint generation algorithm is implemented by decomposing the MAS DAD model into an upper-level problem for the security personnel, and a lower-level problem for the attacker involving the optimal power flow analysis-based corrective power redispatch implemented by the power system operator. Case studies are performed based on the IEEE RTS79 and 57-bus systems, and the results validate that the proposed method is able to minimize the damage when uncertainties are involved in the offensive resource. This paper can offer meaningful insights into power system protection involving uncertainties.","1949-3061","","10.1109/TSG.2018.2803783","National Science Foundation(grant numbers:ECCS1711617,ECCS1739485); Research Growth Initiative Program of the University of Wisconsin–Milwaukee(grant numbers:101X360); ","https://ieeexplore.ieee.org/stamp/stamp.jsp?arnumber=8286941","Robust optimization;power system security;trilevel programming;power system uncertainty","Uncertainty;Optimization;Power grids;Security;Robustness;Programming","","72","","34","IEEE","8 Feb 2018","","","IEEE","IEEE Journals"
"Designing for Emergent Security in Heterogeneous Human-Machine teams","P. N. Brown","Department of Computer Science, University of Colorado, Colorado Springs",2019 IEEE 58th Conference on Decision and Control (CDC),"12 Mar 2020","2019","","","2175","2180","This work seeks to design decisionmaking rules for autonomous agents to jointly influence and optimize the behavior of teamed human decisionmakers in the presence of an adversary. We study a situation in which computational jobs are scheduled on servers by a collection of autonomous machines in concert with self-interested human decisionmakers, and the human and machine schedulers must react to an adversary's attack on one of the servers. We show a simple machine scheduling policy such that if all schedulers have permission to schedule jobs on all servers, increasing the penetration of machine schedulers always increases the level of security in the system, even when the machine schedulers have no explicit coordination or communication amongst themselves. However, we show a companion result in which simple constraints on server availability can nullify the machine schedulers' ability to effectively influence human schedulers; here, even if machine schedulers control an overwhelming majority of jobs, are socially-aware, and fully coordinated amongst themselves, they are incapable of influencing human decisionmakers to mitigate the harm of an attack.","2576-2370","978-1-7281-1398-2","10.1109/CDC40024.2019.9030174","","https://ieeexplore.ieee.org/stamp/stamp.jsp?arnumber=9030174","","Servers;Security;Delays;Optimal scheduling;Aggregates;Man-machine systems;Autonomous agents","","","","22","IEEE","12 Mar 2020","","","IEEE","IEEE Conferences"
"The Zero-trust Paradigm: Concepts, Architectures and Applications","C. Katsis; E. Bertino",NA; NA,"The Zero-trust Paradigm: Concepts, Architectures and Applications","","2025","","","","","Existing measures aimed at securing network perimeters have demonstrated insufficiency in preventing breaches within an organization’s infrastructure. This inadequacy stems from the escalating resource capabilities of adversaries and the increasing sophistication of multi-step attack strategies, rendering breaches feasible. Zero Trust Architecture (ZTA), also known as perimeter-less security, is a recent paradigm that challenges the conventional notion of network security by considering both internal and external networks as potentially compromised and that threats exist at all times in the network. The notion of ZTA has been introduced as a fine-grained defense approach. It assumes that no entities outside and inside the protected system can be trusted and, therefore, requires articulated and high coverage deployment of security controls. However, ZTA is a complex notion that does not have a single design solution, rather, it consists of numerous interconnected concepts and processes that need to be assessed prior to deciding on a solution. In this monograph, the authors cover the principles and architectural foundations of ZTA following the guidelines by NIST, and provide a detailed analysis of ZTA proposed by research and industry. The monograph also describes an approach for the automatic generation of Zero Trust (ZT) policies based on application communication requirements, network topology, and organizational information. This approach was designed to meet a critical need of ZTA, that is, the generation and implementation of a large number of fine-grained policies. Finally, the monograph discusses several research directions, including the incorporation of threat intelligence into ZT networks and the use of large language models.","","9781638285731","","","https://ieeexplore.ieee.org/xpl/ebooks/bookPdfWithBanner.jsp?fileName=11031166.pdf&bkn=11031165&pdfType=book","","","","","","","","12 Jun 2025","","","now","Now Foundations and Trends Books"
"Anomaly Detection in Security Logs using Sequence Modeling","S. Gökstorp; J. Nyberg; Y. Kim; P. Johnson; G. Dán","Division of Network and Systems Engineering, KTH Royal Institute of Technology, Stockholm, Sweden; Division of Network and Systems Engineering, KTH Royal Institute of Technology, Stockholm, Sweden; Division of Network and Systems Engineering, KTH Royal Institute of Technology, Stockholm, Sweden; Division of Network and Systems Engineering, KTH Royal Institute of Technology, Stockholm, Sweden; Division of Network and Systems Engineering, KTH Royal Institute of Technology, Stockholm, Sweden",NOMS 2024-2024 IEEE Network Operations and Management Symposium,"2 Jul 2024","2024","","","1","9","As cyberattacks are becoming more sophisticated, automated activity logging and anomaly detection are becoming important tools for defending computer systems. Recent deep learning-based approaches have demonstrated promising results in cybersecurity contexts, typically using supervised learning combined with large amounts of labeled data. Self-supervised learning has seen growing interest as a method of training models because it does not require labeled training data, which can be difficult and expensive to collect. However, existing self-supervised approaches to anomaly detection in user authentication logs either suffer from low precision or rely on large pre-trained natural language models. This makes them slow and expensive both during training and inference. Building on previous works, we therefore propose an end-to-end trained self-supervised transformer-based sequence model for anomaly detection in user authentication events. Thanks in part to an adapted masked-language modeling (MLM) learning task and domain knowledge-based improvements to the anomaly detection method, our proposed model outperforms previous long short-term memory (LSTM)-based approaches at detecting red-team activity in the ""Comprehensive, Multi-Source Cyber-Security Events"" authentication event dataset, improving the area under the receiver operating characteristic curve (AUC) from 0.9760 to 0.9989 and achieving an average precision of 0.0410. Our work presents the first application of end-to-end trained self-supervised transformer models to user authentication data in a cybersecurity context, and demonstrates the potential of transformer-based approaches for anomaly detection.","2374-9709","979-8-3503-2793-9","10.1109/NOMS59830.2024.10575561","","https://ieeexplore.ieee.org/stamp/stamp.jsp?arnumber=10575561","cybersecurity;misuse detection;anomaly detection;sequence modeling;machine learning;transformer;LSTM","Training;Adaptation models;Computational modeling;Authentication;Training data;Self-supervised learning;Transformers","","2","","25","IEEE","2 Jul 2024","","","IEEE","IEEE Conferences"
"From Deepfakes to Digital Truths: The Role of Watermarking in AI-Generated Image Verification","J. J. Thakkar; A. Kaur","Dept of Computer Science, New Jersey Institute of Technology, New Jersey, USA; Dept of Computer Science, New Jersey Institute of Technology, New Jersey, USA",2024 47th International Conference on Telecommunications and Signal Processing (TSP),"30 Jul 2024","2024","","","216","222","The evolution of Artificial Intelligence (AI), Machine Learning (ML), and Deep Learning (DL) has introduced deepfake technology. Deepfake technology is a form of digital manipulation that alters video, image, and audio content with the help of Generative AI. Those deepfakes have increased concerns in various fields, including education, art, and they also raise ethical and security concerns due to their potential for deceptive content. Reviewing the increasing challenge of identifying high-quality deepfakes, there's a pressing need for robust measures to counter them. This review explores various watermarking techniques and their use to protect content authenticity and origin. Watermarking embeds a subtle watermark and provides a strong defense against deepfake technologies and similar AI-driven tools. The paper discusses current watermarking methods, their strengths and weaknesses, and potential improvements to verify AI-generated content.","2768-3311","979-8-3503-6559-7","10.1109/TSP63128.2024.10605975","","https://ieeexplore.ieee.org/stamp/stamp.jsp?arnumber=10605975","Artificial Intelligence;Content Authentication;Deepfake Detection;Digital Media Integrity;Digital Watermarking;Generative AI;Machine Learning","Deepfakes;Ethics;Reviews;Watermarking;Pressing;Learning (artificial intelligence);Media","","1","","29","IEEE","30 Jul 2024","","","IEEE","IEEE Conferences"
"Evidences of AI powered Use Cases and Challenges in E-tailing from leading Indian E-tailers","G. Ranjit; S. Subramoniam; K. Jnaneswar","APJAKTU and CETSOM College of Engineering Trivandrum, Trivandrum, India; CET School of Management College of Engineering Trivandrum, Trivandrum, India; CET School of Management College of Engineering Trivandrum, Trivandrum, India",2024 15th International Conference on Computing Communication and Networking Technologies (ICCCNT),"4 Nov 2024","2024","","","1","6","The paper highlights the usage and challenges of artificial intelligence in etailing, citing use cases from leading Indian etailers like Amazon and Flipkart. Both organizations have embraced artificial intelligence in a number of ways to improve its operations and enhance customer experience. AI has emerged as a powerful tool that has significantly impacted etailers throughout the globe and especially in India. The results of the study show that both etailers have harnessed the transformative capabilities of AI to secure a strong market position. While Amazon employs machine learning, chatbot assistants, product recommendations, and generative AI, Flipkart applies AI for customized search, issue detection, Microsoft partnership, project Mira to name a few. This article is a reflection of how these leading Indian e-tailers has devoted resources to developing AI capabilities and also exposes the challenges involved like security risks, perception regarding ethics, technology integration, culture wars and quality of data.","2473-7674","979-8-3503-7024-9","10.1109/ICCCNT61001.2024.10725605","","https://ieeexplore.ieee.org/stamp/stamp.jsp?arnumber=10725605","artificial intelligence;e-tailing;machine learning;chatbot;generative AI;Mira","Technological innovation;Companies;Machine learning;Reflection;Product design;Quality assessment;Electronic commerce;Security;Artificial intelligence;Guidelines","","1","","21","IEEE","4 Nov 2024","","","IEEE","IEEE Conferences"
"Securing Next-Generation Wireless Networks Against Native GenAI Attacks: An Evidence-Theoretic Approach","M. S. Munir; S. Proddatoori; M. Muralidhara; M. Gamarra; W. Saad; Z. Han; S. Shetty","School of Computing, Analytics, and Modeling, University of West Georgia, Carrollton, GA, USA; Old Dominion University, Norfolk, VA, USA; Old Dominion University, Norfolk, VA, USA; Electrical and Computer Engineering, Virginia Tech, Arlington, VA, USA; Electrical and Computer Engineering, University of Houston, Houston, TX, USA; AFRL, Rome, NY, USA; Old Dominion University, Norfolk, VA, USA",2025 International Wireless Communications and Mobile Computing (IWCMC),"2 Jul 2025","2025","","","805","811","Intelligent poisoning attacks will pose fundamental challenges for sixth-generation (6G) wireless network security due to the massive deployment of native AI in radio units as well as in core networks. Network metrics and parameters, which are inherently uncertain, can become susceptible to intelligent poisoning through native generative AI (GenAI) mechanisms. In this paper, GenAI-driven intelligent attacks in wireless networks are investigated in order to understand their impact and severity by using uncertainty-informed root cause analysis. Then, a new approach for mitigating GenAI-driven attacks is proposed through the use of trustworthy service aggregation. First, a joint decision problem is formulated for generating intelligent adversarial attacks, understanding uncertain attack severity, and mitigating them in wireless networks. Second, a novel evidencetheoretic trustworthy AI (ET-TAI) framework is developed to address the formulated problem by understanding the root-cause of the native GenAI-driven intelligent attack and establishing defense in wireless networks. In particular, the proposed ET-TAI framework enables a narrow GenAI scheme that is designed to penetrate intelligent adversarial attacks in wireless networks’ metrics and parameters. Then a Dempster–Shafer-based mechanism that is deployed to capture the uncertain behavior of those intelligent attacks through prior evidence to quantify the trust for further mitigation. Extensive experimental analysis shows the proposed ET-TAI framework’s efficacy in understanding the trust in GenAI-driven intelligent poisoning attacks on network parameters and metrics by quantifying root causes and mitigating rates. Results show that the GenAI can penetrate intelligent poisoning attacks with high reconstruction capabilities of 95% for downlink services.","2376-6506","979-8-3315-0887-6","10.1109/IWCMC65282.2025.11059708","National Science Foundation; Air Force Research Laboratory; ","https://ieeexplore.ieee.org/stamp/stamp.jsp?arnumber=11059708","Native Generative AI;Intelligent Attacks;Evidence Theory;Trustworthy AI","Measurement;Root cause analysis;Accuracy;Generative AI;Wireless networks;Prevention and mitigation;Autoencoders;Vectors;Security;Mutual information","","1","","12","IEEE","2 Jul 2025","","","IEEE","IEEE Conferences"
"AI Powered Plant Disease Detection and Diagnosis","A. Sasane; V. Yerkar; A. Wanjare; K. Zende; G. Yadav; Y. Ingle","Department of Artificial Intelligence & Data Science, Vishwakarma Institute of Information Technology, Pune, India; Department of Artificial Intelligence & Data Science, Vishwakarma Institute of Information Technology, Pune, India; Department of Artificial Intelligence & Data Science, Vishwakarma Institute of Information Technology, Pune, India; Department of Artificial Intelligence & Data Science, Vishwakarma Institute of Information Technology, Pune, India; Department of Artificial Intelligence & Data Science, Vishwakarma Institute of Information Technology, Pune, India; Department of Artificial Intelligence & Data Science, Vishwakarma Institute of Information Technology, Pune, India",2025 International Conference on Emerging Smart Computing and Informatics (ESCI),"9 May 2025","2025","","","1","6","Certain plant diseases cause extensive damage in agriculture; this leads results in a huge loss, and poses a major risk to food security. In general, conventional techniques of diagnosing these diseases are time- consuming, expensive and depend solely on human operator’s experience. As part of this study, we suggest an entirely new architecture for disease detection, diagnostics, and remedies using Ensemble Learning, Generative AI, and, Explainable AI (XAI). It combines deep learning method Convolutional Neural Networks (CNNs), Random Forest classifiers and transformer-based generative models to give diagnosis and suggest treatment processes. LIME and heat plots of attention make the behavior of the system clear to users and contribute to the perfect implementation of artificial intelligence technology in agriculture. This framework is also both timely and suitable for the development and practice of sustainable agriculture especially in the developing world where professional input on agriculture is hard to come by.","2996-1815","979-8-3315-1568-3","10.1109/ESCI63694.2025.10988070","","https://ieeexplore.ieee.org/stamp/stamp.jsp?arnumber=10988070","Plant Disease Detection;Convolutional Neural Networks (CNN);Ensemble Learning;Generative AI (GenAI);Explainable AI (XAI)","Plant diseases;Accuracy;Explainable AI;Generative AI;Soil;Transformers;Agriculture;Convolutional neural networks;Ensemble learning;Random forests","","","","19","IEEE","9 May 2025","","","IEEE","IEEE Conferences"
"Machine Learning in Ambient Assisted Living for Enhanced Elderly Healthcare: A Systematic Literature Review","A. A. Mir; A. S. Khalid; S. Musa; M. Faizal Ahmad Fauzi; N. Norfiza Abdul Razak; T. Boon Tang","Malaysian Institute of Information Technology, Universiti Kuala Lumpur, Kuala Lumpur, Malaysia; Malaysian Institute of Information Technology, Universiti Kuala Lumpur, Kuala Lumpur, Malaysia; Malaysian Institute of Information Technology, Universiti Kuala Lumpur, Kuala Lumpur, Malaysia; Faculty of Engineering, Multimedia University, Cyberjaya, Selangor, Malaysia; Department of Electrical and Electronic Engineering, Jalan IKRAM-UNITEN, Kajang, Selangor, Malaysia; Centre for Intelligent Signal and Imaging Research, Universiti Teknologi PETRONAS, Seri Iskandar, Perak, Malaysia",IEEE Access,"2 Jul 2025","2025","13","","110508","110527","As the global population ages, Ambient Assisted Living (AAL) systems have become essential in supporting the elderly to maintain independence and quality of life. Such systems integrate advanced technologies such as machine learning (ML), internet of things (IoT), and sensors to enhance safety and healthcare delivery. However, deploying such technologies raises significant challenges, especially in managing privacy, ensuring ethical compliance, and gaining user acceptance. This systematic literature review (SLR) explores the current state and advancements in AAL technologies, with a specific focus on their applications in elderly care. It synthesizes current methodologies, including predictive analytics, Explainable AI (XAI), and Generative AI (GenAI), while also evaluating the role of vision-based systems and multi-modal data fusion. It examines how such technologies are implemented to improve lives while also highlighting critical areas requiring attention, particularly privacy and ethical considerations. The review methodically analyzes articles and papers from the year 2020, selected based on their relevance to AAL technologies, their use of ML algorithms, and their focus on elderly care. The findings reveal the need for interpretability in AI-driven decisions and the role of GenAI in synthetic data generation and personalized conversational assistants. While ML and IoT significantly enhance AAL systems through predictive healthcare and personalized interventions, they also pose substantial privacy risks. The review identifies privacy as a critical concern due to the sensitive nature of the data collected and the vulnerabilities inherent in digital systems. Issues around data privacy, security breaches, and the need for robust privacy-preserving mechanisms are recurrent themes. This SLR illustrates the potential of AAL systems in elderly care and emphasizes the crucial requirement of addressing privacy and ethical issues to ensure such technologies are both beneficial and secure. The findings serve as a foundation for understanding the current state of AAL technologies and guide future advancements in elderly healthcare.","2169-3536","","10.1109/ACCESS.2025.3580961","Government Linked University (GLU) Research Collaborative Fund (GRCF) 2023, managed by the Center for Research and Innovation (CoRI), Universiti Kuala Lumpur(grant numbers:CoRI/GRCF2023_01); ","https://ieeexplore.ieee.org/stamp/stamp.jsp?arnumber=11039768","Ambient assisted living;elderly;explainable AI;generative AI;healthcare;Internet of Things;machine learning;predictive analytics;privacy","Older adults;Medical services;Data privacy;Sensors;Prediction algorithms;Monitoring;Ambient assisted living;Internet of Things;Ethics;Real-time systems","","","","59","CCBY","18 Jun 2025","","","IEEE","IEEE Journals"
