"On the Role of LLM to Forecast the Next Pandemic","T. Ruga; E. Vocaturo; E. Zumpano","CNR-NANOTEC, DIMES, University of Calabria, Italy; CNR-NANOTEC, DIMES, University of Calabria, Italy; CNR-NANOTEC, DIMES, University of Calabria, Italy",2024 IEEE International Conference on Bioinformatics and Biomedicine (BIBM),"10 Jan 2025","2024","","","6567","6573","Large Language Models (LLMs) have emerged as powerful tools in medical applications, demonstrating signifi-cant potential for analyzing vast clinical datasets, identifying patterns, and facilitating early detection of health anomalies. These capabilities are particularly relevant for detecting both individual disease onset and potential pandemic scenarios at a population level. The integration of LLMs into medical workflows could revolutionize how data-driven insights are harnessed for pandemic prediction and management, although implementing these technologies requires careful consideration of critical issues, particularly data privacy and security. This paper presents a comprehensive examination of current research at the intersection of LLMs and pandemic response, analyzing the literature from both bibliometric and medical perspectives. Through the selection of 849 publications across major databases, we provide an overview of the current state of research in this domain, identify emerging patterns from a clinical standpoint, and evaluate potential implications for future pandemic prediction. Our findings reveal significant trends in the application of LLMs to pandemic-related challenges, highlighting both opportunities and critical areas requiring further investigation, particularly in mental health impacts and early warning systems. The analysis reveals that while LLMs show promise in early detection and pattern recognition, challenges remain in data privacy, model interpretability, and the integration of diverse data sources. This research serves as a foundation for understanding how LLMs can be effectively deployed in pandemic prediction and management, while acknowledging the complexities and ethical considerations inherent in such applications.","2156-1133","979-8-3503-8622-6","10.1109/BIBM62325.2024.10822835","Health; ","https://ieeexplore.ieee.org/stamp/stamp.jsp?arnumber=10822835","Large Language Models;LLMs;Healthcare;Pandemic;Literature Review","Data privacy;Pandemics;Reviews;Soft sensors;Large language models;Mental health;Medical services;Predictive models;Market research;Pattern recognition","","","","13","IEEE","10 Jan 2025","","","IEEE","IEEE Conferences"
"TAKA Cybersecurity Chatbot","M. Bhanushali; H. Parekh; R. Mistry; Y. Mane","Department of Information Technology, Universal College of Engineering, Mumbai; Department of Information Technology, Universal College of Engineering, Mumbai; Department of Information Technology, Universal College of Engineering, Mumbai; Department of Information Technology, Universal College of Engineering, Mumbai",2023 International Conference on Advanced Computing Technologies and Applications (ICACTA),"23 Jan 2024","2023","","","1","6","The internet has become an integral part of our daily lives, with smartphones and websites being used for communication, entertainment, shopping, banking, and more. However, this increased dependence on technology has also increased the risk of cyber threats such as hacking, identity theft, and malware attacks. Cybersecurity awareness and education are essential to safeguard against cyber threats. Collaboration between security experts can help prevent attacks and safeguard against cybercrime. Despite the numerous platforms available across various domains, we have discovered that there is currently no platform that can effectively bridge the gap between common people, developers, and cyber security researchers to protect people on the internet. This has led us to develop TAKA (meaning of TAKA in Japanese is to GIVE. Our research work aims to GIVE Security to every person in the world through our chatbot service), a conversational AI that provides continuous assistance to its users in protecting themselves from various cyber threats that occur on the Internet on a daily basis. TAKA is a conversational AI built using the RASA chatbot framework, designed to provide various cyber security services to protect its users. The chatbot offers protection against phishing links and emails, spam messages and spam calls, a range of inbuilt cyber security tools, and includes resources for security researchers and daily security and vulnerability news for developers.","","979-8-3503-4834-7","10.1109/ICACTA58201.2023.10393016","","https://ieeexplore.ieee.org/stamp/stamp.jsp?arnumber=10393016","Conversational AI;Cyber Security;inbuilt cyber security tools","Unsolicited e-mail;Phishing;Natural languages;Chatbots;Real-time systems;Malware;Computer security","","","","19","IEEE","23 Jan 2024","","","IEEE","IEEE Conferences"
"Autonomous Cyberattack with Security-Augmented Generative Artificial Intelligence","J. Gregory; Q. Liao","Department of Computer Science, Central Michigan University, Mount Pleasant, USA; Department of Computer Science, Central Michigan University, Mount Pleasant, USA",2024 IEEE International Conference on Cyber Security and Resilience (CSR),"24 Sep 2024","2024","","","270","275","Ethical hacking and penetration testing is a vital task by cybersecurity professionals to find and exploit possible vulnerabilities in a system before malicious actors do. However, system hacking has a high barrier to entry that necessitates years of experiential learning and formal education. The rapid development of generative artificial intelligence (AI) may potentially lower the barrier to entry. This research experiments with automatic penetration testing via large language models (LLMs) augmented with security information. This research uses a locally hosted Mistral 7B model with Low-Rank Adaptation (LoRA) fine-tuning and Retrieval-Augmented Generation (RAG) to improve penetration testing. When the LLMs are fine tuned with limited and unstructured security data such as privilege escalation articles from a few public web sites, the system succeeds in achieving privilege escalation on Linux hosts. The results of this research suggest that no-cost LLM-assisted penetration testing is possible even on ordinary PCs using locally hosted models. Future research is needed to achieve more diversified attacks and discover zero-day vulnerabilities, perhaps with better prompt engineering, models, and security data.","","979-8-3503-7536-7","10.1109/CSR61664.2024.10679470","","https://ieeexplore.ieee.org/stamp/stamp.jsp?arnumber=10679470","Cybersecurity;Generative Artificial Intelligence;Machine Learning;Large Language Models;Low-Rank Adaptation;Retrieval-Augmented Generation;Penetration Testing;Hacking;Attacks and Defense;Vulnerability","Adaptation models;Large language models;Linux;Data models;Software;Web sites;Prompt engineering","","","","19","IEEE","24 Sep 2024","","","IEEE","IEEE Conferences"
"On the Adversarial Robustness of Multi-Modal Foundation Models","C. Schlarmann; M. Hein",Tübingen AI Center University of Tübingen; Tübingen AI Center University of Tübingen,2023 IEEE/CVF International Conference on Computer Vision Workshops (ICCVW),"25 Dec 2023","2023","","","3679","3687","Multi-modal foundation models combining vision and language models such as Flamingo or GPT-4 have recently gained enormous interest. Alignment of foundation models is used to prevent models from providing toxic or harmful output. While malicious users have successfully tried to jailbreak foundation models, an equally important question is if honest users could be harmed by malicious third-party content. In this paper we show that imperceivable attacks on images $\left({{\varepsilon _\infty } = 1/255}\right)$ in order to change the caption output of a multi-modal foundation model can be used by malicious content providers to harm honest users e.g. by guiding them to malicious websites or broadcast fake information. This indicates that countermeasures to adversarial attacks should be used by any deployed multi-modal foundation model. Note: This paper contains fake information to illustrate the outcome of our attacks. It does not reflect the opinion of the authors.","2473-9944","979-8-3503-0744-3","10.1109/ICCVW60793.2023.00395","Deutsche Forschungsgemeinschaft; ","https://ieeexplore.ieee.org/stamp/stamp.jsp?arnumber=10350690","adversarial robustness;multi modal models;security;foundation models","Visualization;Computer vision;Perturbation methods;Computational modeling;Conferences;Robustness;Behavioral sciences","","28","","41","IEEE","25 Dec 2023","","","IEEE","IEEE Conferences"
"LLMs got the Funk: leveraging LLM, Prompt Engineering and Fine-Tuning for Topic Modeling on Brazilian Funk Lyrics","J. Yepez; B. Tavares; F. Peres; K. Becker","Institute of Informatics - Federal University of Rio Grande do Sul (UFRGS); Institute of Informatics - Federal University of Rio Grande do Sul (UFRGS); Institute of Philosophy and Human Sciences - Federal University of Rio Grande do Sul (UFRGS), Porto Alegre, Brazil; Institute of Informatics - Federal University of Rio Grande do Sul (UFRGS)",2024 IEEE/WIC International Conference on Web Intelligence and Intelligent Agent Technology (WI-IAT),"5 May 2025","2024","","","133","140","Music can serve as a mirror of social conditions, and studying social phenomena requires proper computational tools to evaluate the discourses in song lyrics on a large scale. Brazilian Funk (BRFunk) is a popular genre that emerged from the favelas in Rio de Janeiro, regarded as controversial for merging stories of resilience and social criticism, with themes such as violence, drugs, and women objectification. These themes portray the social conditions of daily life in Brazilian slums ifavelas). In this paper, we propose a novel topic modeling approach that explores the power of Large Language Models (LLM) and pre-trained models to extract insights from song lyrics, using BRFunk as a case study. The generative power of LLM is leveraged through prompt engineering to summarize lyrics excerpts into themes in an iterative process to create a reliable distribution of themes. Pre-trained models are then deployed to condensate the themes into a non-redundant and cohesive set of topics using BERTopic, and through BERT fine-tuned models that classify new lyrics excerpts according to these topics. Using the top 100 BRFunk songs of 2023, we illustrate how this large-scale computational strategy is an efficient ally for understanding social phenomena and cultural movements.","","979-8-3315-0494-6","10.1109/WI-IAT62293.2024.00026","CAPES; CNPq; ","https://ieeexplore.ieee.org/stamp/stamp.jsp?arnumber=10973446","Topic modeling;Large Language Model;Prompting Engineer;BERT;BRFunk","Drugs;Computational modeling;Large language models;Merging;Reliability engineering;Prompt engineering;Mirrors;Iterative methods;Intelligent agents;Resilience","","","","21","IEEE","5 May 2025","","","IEEE","IEEE Conferences"
"Large Language Models-Aided Program Debloating","B. Lin; S. Wang; Y. Qin; L. Chen; X. Mao","National University of Defense Technology, Changsha, China; National University of Defense Technology, Changsha, China; National University of Defense Technology, Changsha, China; National University of Defense Technology, Changsha, China; National University of Defense Technology, Changsha, China",IEEE Transactions on Software Engineering,"","2025","PP","99","1","19","As software grows in complexity to accommodate diverse features and platforms, software bloating has emerged as a significant challenge, adversely affecting performance and security. However, existing approaches inadequately address the dual objectives of debloating: maintaining functionality by preserving essential features and enhancing security by reducing security issues. Specifically, current software debloating techniques often rely on input-based analysis, using user inputs as proxies for the specifications of desired features. However, these approaches frequently overfit provided inputs, leading to functionality loss and potential security vulnerabilities. To address these limitations, we propose LEADER, a program debloating framework enhanced by Large Language Models (LLMs), which leverages their semantic understanding, generative capabilities, and decision-making strengths. LEADER mainly consists of two modules: (1) a documentation-guided test augmentation module designed to preserve functionality, which leverages LLMs to comprehend program documentation and generates sufficient tests to cover the desired features comprehensively, and (2) a multi-advisor-aided program debloating module that employs a neuro-symbolic pipeline to ensure that the security of the software can be perceived during debloating. This module combines debloating and security advisors for analysis and employs an LLM as a decision-maker to eliminate undesired code securely. Extensive evaluations on widely used benchmarks demonstrate the efficacy of LEADER. It achieves a 95.5% test case pass rate and reduces program size by 42.5%. Notably, it reduces the introduction of vulnerabilities during debloating by 79.1% and decreases pre-existing vulnerabilities by 16.5% more than CovA. These results demonstrate that LEADER surpasses the state-of-the-art tool CovA in functionality and security. These results underscore the potential of LEADER to set a new standard in program debloating by effectively balancing functionality and security.","1939-3520","","10.1109/TSE.2025.3594673","","https://ieeexplore.ieee.org/stamp/stamp.jsp?arnumber=11106926","Software debloating;program reduction;large language model","Security;Codes;Software;Documentation;Fuzzing;Decision making;Training;Semantics;Large language models;Benchmark testing","","","","","IEEE","1 Aug 2025","","","IEEE","IEEE Early Access Articles"
"Proposing a New Security Game with Reward and Penalty","R. Yoshioka; Y. Sakurai; S. Oyama; M. Shinoda","Nagoya Institute of Technology, Nagoya, Japan; Nagoya Institute of Technology, Nagoya, Japan; Nagoya City University, Nagoya, Japan; Nara Womens' University, Nara, Japan",2023 IEEE/WIC International Conference on Web Intelligence and Intelligent Agent Technology (WI-IAT),"19 Dec 2023","2023","","","205","212","We propose a new security game that takes into account both rewards and penalties. Security games have been widely studied in the field of multi-agent systems for many years. We abstract the security game that targets a situation where the defender must leave one vault open for a transaction as a number guessing game with reward and penalty. We investigate this security game in both simultaneous and sequential forms. We analyze the attacker's Max-Min strategy and the defender's Min-Max strategy in these games. Furthermore, we clarify the sufficient conditions for the penalty in which the defender chooses all remaining numbers. If the penalty increment is large, i.e., if the defender also incurs sufficient cost to defend the later safes, both the attacker and the defender must consider the possibility of using all the safes, but the defender can minimize the expected value of the loss by a simple strategy. On the other hand, if the penalty increment is small, the number of safes to be used is small, and thus the amount of loss may be improved, but the defender's strategy will not be as simple. The defender's strategy is formulated as a linear programming problem in this paper. We show what strategies the defender chooses as the penalty increases in the proposed security game for both simultaneous and sequential forms through computational experiments.","","979-8-3503-0918-8","10.1109/WI-IAT59888.2023.00033","JSPS KAKENHI(grant numbers:JP18H03337 and 21K12191); JST CREST(grant numbers:JP-MJCR21Dl); ","https://ieeexplore.ieee.org/stamp/stamp.jsp?arnumber=10350066","Multi-Agent Systems;Security Game;Number Guessing;Max-Min Strategy;Equilibrium Strategy","Sufficient conditions;Costs;Decision making;Games;Minimax techniques;Linear programming;Security","","","","11","IEEE","19 Dec 2023","","","IEEE","IEEE Conferences"
"TrojanPuzzle: Covertly Poisoning Code-Suggestion Models","H. Aghakhani; W. Dai; A. Manoel; X. Fernandes; A. Kharkar; C. Kruegel; G. Vigna; D. Evans; B. Zorn; R. Sim","University of California, Santa Barbara; Microsoft Corporation; Microsoft Corporation; Microsoft Corporation; Microsoft Corporation; University of California, Santa Barbara; University of California, Santa Barbara; University of Virginia; Microsoft Corporation; Microsoft Corporation",2024 IEEE Symposium on Security and Privacy (SP),"5 Sep 2024","2024","","","1122","1140","With tools like GitHub Copilot, automatic code suggestion is no longer a dream in software engineering. These tools, based on large language models, are typically trained on massive corpora of code mined from unvetted public sources. As a result, these models are susceptible to data poisoning attacks where an adversary manipulates the model’s training by injecting malicious data. Poisoning attacks could be designed to influence the model’s suggestions at run time for chosen contexts, such as inducing the model into suggesting insecure code payloads. To achieve this, prior attacks explicitly inject the insecure code payload into the training data, making the poison data detectable by static analysis tools that can remove such malicious data from the training set. In this work, we demonstrate two novel attacks, Covert and TrojanPuzzle, that can bypass static analysis by planting malicious poison data in out-of-context regions such as docstrings. Our most novel attack, TrojanPuzzle, goes one step further in generating less suspicious poison data by never explicitly including certain (suspicious) parts of the payload in the poison data, while still inducing a model that suggests the entire payload when completing code (i.e., outside docstrings). This makes TrojanPuzzle robust against signature-based dataset-cleansing methods that can filter out suspicious sequences from the training data. Our evaluation against models of two sizes demonstrates that both Covert and TrojanPuzzle have significant implications for practitioners when selecting code used to train or tune code-suggestion models.","2375-1207","979-8-3503-3130-1","10.1109/SP54263.2024.00140","National Science Foundation; ","https://ieeexplore.ieee.org/stamp/stamp.jsp?arnumber=10646865","Large Language Models;Generative AI;Code Generation;Data Poisoning;Trustworthy AI","Training;Codes;Toxicology;Training data;Static analysis;Transformers;Data models","","9","","54","IEEE","5 Sep 2024","","","IEEE","IEEE Conferences"
"Unlocking the Secrets of Prompt Engineering: Master the art of creative language generation to accelerate your journey from novice to pro","G. Mizrahi; D. Serfaty",NA; NA,Unlocking the Secrets of Prompt Engineering: Master the art of creative language generation to accelerate your journey from novice to pro,"","2024","","","","","Enhance your writing with AI by mastering prompt engineering techniques and become an expert in developing and utilizing LLM prompts across applicationsKey FeaturesMaster prompt engineering techniques to harness AI's writing potentialDiscover diverse LLM applications for content creation and beyondLearn through practical examples, use cases, and hands-on guidancePurchase of the print or Kindle book includes a free PDF eBookBook DescriptionUnlocking the Secrets of Prompt Engineering is your key to mastering the art of AI-driven writing. This book propels you into the world of large language models (LLMs), empowering you to create and apply prompts effectively for diverse applications, from revolutionizing content creation and chatbots to coding assistance. Starting with the fundamentals of prompt engineering, this guide provides a solid foundation in LLM prompts, their components, and applications. Through practical examples and use cases, you'll discover how LLMs can be used for generating product descriptions, personalized emails, social media posts, and even creative writing projects like fiction and poetry. The book covers advanced use cases such as creating and promoting podcasts, integrating LLMs with other tools, and using AI for chatbot development. But that’s not all. You'll also delve into the ethical considerations, best practices, and limitations of using LLM prompts as you experiment and optimize your approach for best results. By the end of this book, you'll have unlocked the full potential of AI in writing and content creation to generate ideas, overcome writer's block, boost productivity, and improve communication skills.What you will learnExplore the different types of prompts, their strengths, and weaknessesUnderstand the AI agent's knowledge and mental modelEnhance your creative writing with AI insights for fiction and poetryDevelop advanced skills in AI chatbot creation and deploymentDiscover how AI will transform industries such as education, legal, and othersIntegrate LLMs with various tools to boost productivityUnderstand AI ethics and best practices, and navigate limitations effectivelyExperiment and optimize AI techniques for best resultsWho this book is forThis book is for a wide audience, including writers, marketing and business professionals, researchers, students, tech enthusiasts, and creative individuals. Anyone looking for strategies and examples for using AI co-writing tools like ChatGPT effectively in domains such as content creation, drafting emails, and inspiring artistic works, will find this book especially useful. If you are interested in AI, NLP, and innovative software for personal or professional use, this is the book for you.","","9781835088265","","","https://ieeexplore.ieee.org/xpl/ebooks/bookPdfWithBanner.jsp?fileName=10460891.pdf&bkn=10460890&pdfType=book","","","","","","","","6 Mar 2024","","","Packt Publishing","Packt Publishing eBooks"
"Code Gradients: Towards Automated Traceability of LLM-Generated Code","M. North; A. Atapour-Abarghouei; N. Bencomo","CS, Durham University, Durham, UK; CS, Durham University, Durham, UK; CS, Durham University, Durham, UK",2024 IEEE 32nd International Requirements Engineering Conference (RE),"21 Aug 2024","2024","","","321","329","Large language models (LLMs) have recently seen huge growth in capability and usage. Within software engineering, LLMs are increasingly being used by developers to generate code. Code generated by an LLM can be seen essentially a continuous mapping from requirements to code. This represents a great opportunity within requirements engineering to use this mapping to provide traceability from requirements to LLM-generated code. The challenge is that the black-box nature of LLMs makes it difficult to trace requirements, while traditional approaches require extensive post-hoc testing or expert analysis. In this research preview, we explore the use of LLM explainability techniques to trace LLM-generated code back to requirements. By inspecting the gradients of LLM output, we develop a first attempt at tracing LLM inputs through to its generated code. We use this to estimate which low-level requirements have been met. Furthermore, through an automated iterative process, we re-query the LLM, instructing it to rewrite its code to meet the missing requirements. Our results suggest that the gradients of LLM outputs can be used to trace requirements through LLM code generation and that this traceability could potentially be used to improve generated code to better meet requirements. Future work is required to fully validate this result, but this represents a first step towards automatic traceability and verification of AI generated code.","2332-6441","979-8-3503-9511-2","10.1109/RE59067.2024.00038","","https://ieeexplore.ieee.org/stamp/stamp.jsp?arnumber=10628471","Requirements Engineering;Large Language Models;Traceability","Codes;Large language models;Natural languages;Buildings;Closed box;Requirements engineering;Iterative methods","","5","","39","IEEE","21 Aug 2024","","","IEEE","IEEE Conferences"
