"Enhancing Reasoning Capacity of SLM Using Cognitive Enhancement","J. Pan; S. L. Wong; X. W. Chia; Y. Yuan","Home Team Science and Technology Agency, Singapore; Home Team Science and Technology Agency, Singapore; Home Team Science and Technology Agency, Singapore; Home Team Science and Technology Agency, Singapore",2025 International Conference on Artificial Intelligence in Information and Communication (ICAIIC),"19 Mar 2025","2025","","","0366","0371","Large Language Models (LLMs) have been applied to automate cyber security activities and processes including cyber investigation and digital forensics. However, the use of such models for cyber investigation and digital forensics should address accountability and security considerations. Accountability ensures models have the means to provide explainable reasonings and outcomes. This information can be extracted through explicit prompt requests. For security considerations, it is crucial to address privacy and confidentiality of the involved data during data processing as well. One approach to deal with this consideration is to have the data processed locally using a local instance of the model. Due to limitations of locally available resources, namely memory and GPU capacities, a Smaller Large Language Model (SLM) will typically be used. These SLMs have significantly fewer parameters compared to the LLMs. However, such size reductions have notable performance reduction, especially when tasked to provide reasoning explanations. In this paper, we aim to mitigate performance reduction through the integration of cognitive strategies that humans use for problem-solving. We term this as cognitive enhancement through prompts. Our experiments showed significant improvement gains of the SLMs' performances when such enhancements were applied. We believe that our exploration study paves the way for further investigation into the use of cognitive enhancement to optimize SLM for cyber security applications.","2831-6983","979-8-3315-0702-2","10.1109/ICAIIC64266.2025.10920811","","https://ieeexplore.ieee.org/stamp/stamp.jsp?arnumber=10920811","Smaller Large Language Model;Cognitive Enhancement;Digital Forensics","Data privacy;Large language models;Digital forensics;Graphics processing units;Data processing;Cognition;Data models;Security;Problem-solving;Computer crime","","","","35","IEEE","19 Mar 2025","","","IEEE","IEEE Conferences"
"IoT Botnet Detection: Application of Vision Transformer to Classification of Network Flow Traffic","H. Wasswa; T. Lynar; A. Nanyonga; H. Abbass","School of Engineering and Information Technology, University of New South Wales, Canberra, Australia; School of Engineering and Information Technology, University of New South Wales, Canberra, Australia; School of Engineering and Information Technology, University of New South Wales, Canberra, Australia; School of Engineering and Information Technology, University of New South Wales, Canberra, Australia",2023 Global Conference on Information Technologies and Communications (GCITC),"18 Apr 2024","2023","","","1","6","Despite the demonstrated effectiveness of transformer models in NLP, and image and video classification, the available tools for extracting features from captured IoT network flow packets fail to capture sequential patterns in addition to the absence of spatial patterns consequently limiting transformer model application. This work introduces a novel preprocessing method to adapt transformer models, the vision transformer (ViT) in particular, for IoT botnet attack detection using network flow packets. The approach involves feature extraction from .pcap files and transforming each instance into a 1-channel 2D image shape, enabling ViT-based classification. Also, the ViT model was enhanced to allow use any classifier besides Multilayer Perceptron (MLP) that was deployed in the initial ViT paper. Models including the conventional feed forward Deep Neural Network (DNN), LSTM and Bidirectional-LSTM (BLSTM) demonstrated competitive performance in terms of precision, recall, and F1-score for multiclass-based attack detection when evaluated on two IoT attack datasets.","","979-8-3503-0816-7","10.1109/GCITC60406.2023.10426522","","https://ieeexplore.ieee.org/stamp/stamp.jsp?arnumber=10426522","IoT botnet;IoT security;attack detection;transformer;vision transformer","Adaptation models;Botnet;Stacking;Artificial neural networks;Transforms;Transformers;Feature extraction","","1","","26","IEEE","18 Apr 2024","","","IEEE","IEEE Conferences"
"Movable-Antenna Position Optimization for Physical-Layer Security via Discrete Sampling","W. Mei; X. Wei; Y. Liu; B. Ning; Z. Chen","National Key Laboratory of Wireless Communications, University of Electronic Science and Technology of China, Chengdu, China; National Key Laboratory of Wireless Communications, University of Electronic Science and Technology of China, Chengdu, China; School of Information and Communication Engineering, University of Electronic Science and Technology of China, Chengdu, China; National Key Laboratory of Wireless Communications, University of Electronic Science and Technology of China, Chengdu, China; National Key Laboratory of Wireless Communications, University of Electronic Science and Technology of China, Chengdu, China",GLOBECOM 2024 - 2024 IEEE Global Communications Conference,"11 Mar 2025","2024","","","4750","4755","Fluid antennas (FAs) and mobile antennas (MAs) are innovative technologies in wireless communications that are able to proactively improve channel conditions by dynamically adjusting the transmit/receive antenna positions within a given spatial region. In this paper, we investigate an MA-enhanced multiple-input single-output (MISO) secure communication system, aiming to maximize the secrecy rate by jointly optimizing the positions of multiple MAs. Instead of continuously searching for the optimal MA positions as in prior works, we propose to discretize the transmit region into multiple sampling points, thereby converting the continuous antenna position optimization into a discrete sampling point selection problem. However, this point selection problem is combinatory and thus difficult to be optimally solved. To tackle this challenge, we ingeniously transform this combinatory problem into a recursive path selection problem in graph theory and propose a partial enumeration algorithm to obtain its optimal solution without the need for high-complexity exhaustive search. To further reduce the complexity, a linear-time sequential update algorithm is also proposed to obtain a high-quality suboptimal solution. Numerical results show that our proposed algorithms yield much higher secrecy rates as compared to the conventional FPA and other baseline schemes.","2576-6813","979-8-3503-5125-5","10.1109/GLOBECOM52923.2024.10901621","National Natural Science Foundation of China; ","https://ieeexplore.ieee.org/stamp/stamp.jsp?arnumber=10901621","","Fluids;Transmitting antennas;Transforms;Mobile antennas;Search problems;Graph theory;MISO;Security;Global communication;Optimization","","1","","21","IEEE","11 Mar 2025","","","IEEE","IEEE Conferences"
"Textual Differential Privacy for Context-Aware Reasoning with Large Language Model","J. Yu; J. Zhou; Y. Ding; L. Zhang; Y. Guo; H. Sato","The University of Tokyo, Tokyo, Japan; Independent Researcher, Tokyo, Japan; Hiroshima University, Hiroshima, Japan; The University of Tokyo, Tokyo, Japan; The University of Tokyo, Tokyo, Japan; National Institute of Informatics / The University of Tokyo, Tokyo, Japan","2024 IEEE 48th Annual Computers, Software, and Applications Conference (COMPSAC)","26 Aug 2024","2024","","","988","997","Large language models (LLMs) have demonstrated proficiency in various language tasks but encounter difficulties in specific domain or scenario. These challenges are mitigated through prompt engineering techniques such as retrieval-augmented generation, which improves performance by integrating contextual information. However, concerns regarding the privacy implications of context-aware reasoning architectures persist, particularly regarding the transmission of sensitive data to LLMs service providers, potentially compromising personal privacy. To mitigate these challenges, this paper introduces Tex-tual Differential Privacy, a novel paradigm aimed at safeguarding user privacy in LLMs-based context-aware reasoning. The proposed Differential Embedding Hash algorithm anonymizes sensitive information while maintaining the reasoning capability of LLMs. Additionally, a quantification scheme for privacy loss is proposed to better understand the trade-off between privacy protection and loss. Through rigorous analysis and experimentation, the effectiveness and robustness of the proposed paradigm in mitigating privacy risks associated with context-aware reasoning tasks are demonstrated. This paradigm addresses privacy concerns in context-aware reasoning architectures, enhancing the trust and utility of LLMs in various applications.","2836-3795","979-8-3503-7696-8","10.1109/COMPSAC61105.2024.00135","","https://ieeexplore.ieee.org/stamp/stamp.jsp?arnumber=10633584","Large Language Model;Differential Privacy;Context-Aware Reasoning;Named -Entity Recognition;Retrieval-Augmented Generation","Privacy;Differential privacy;Systematics;Large language models;Computer architecture;Cognition;Robustness","","","","32","IEEE","26 Aug 2024","","","IEEE","IEEE Conferences"
"LLM-Based AI Agent for VNF Deployment in OpenStack Environment","S. Nam; N. Van Tu; J. W. -K. Hong","Department of Computer Science and Engineering, POSTECH, Pohang, Korea; Department of Computer Science and Engineering, POSTECH, Pohang, Korea; Department of Computer Science and Engineering, POSTECH, Pohang, Korea",NOMS 2025-2025 IEEE Network Operations and Management Symposium,"15 Jul 2025","2025","","","1","7","This paper presents a novel approach to automating the deployment of Virtual Network Functions (VNFs) in an OpenStack environment using Large Language Models (LLMs). Building on the concept of Intent-Driven Networking (IDN), which allows network administrators to manage complex networks via natural language commands, we explore the feasibility of using LLMs to automate VNF deployment tasks. A dataset of Method of Procedure (MOP) documents was created and utilized to prompt LLMs to generate Python code for deploying and configuring VNFs. Our LLM-based AI agent framework tests the generated code within an OpenStack environment, comparing the performance of various LLMs. Our findings highlight both the potential and current challenges of using LLMs in network automation, suggesting pathways for future research, including advanced prompt engineering and real-time error correction.","2374-9709","979-8-3315-3163-8","10.1109/NOMS57970.2025.11073607","","https://ieeexplore.ieee.org/stamp/stamp.jsp?arnumber=11073607","IDN;LLM;NFV;Automated Network Manage-ment","Codes;Automation;Large language models;Natural languages;Buildings;Complex networks;Real-time systems;Error correction;Prompt engineering","","","","20","IEEE","15 Jul 2025","","","IEEE","IEEE Conferences"
"Teach me : AI-Powered Voice Chat Robot Using Internet of Things","K. B. B. R; R. A; S. R; K. S. T; R. Meena","Easwari Engineering College, Chennai, India; Easwari Engineering College, Chennai, India; Easwari Engineering College, Chennai, India; Easwari Engineering College, Chennai, India; Easwari Engineering College, Chennai, India",2025 International Conference on Emerging Systems and Intelligent Computing (ESIC),"16 Apr 2025","2025","","","333","337","This paper presents TEACH ME: An Artificial Intelligence-Powered Voice Chat Robot Integrated with the Internet of Things (IoT), designed to facilitate flexible, voice-powered communication with connected devices Leveraging Large Language Models (LLMs). TEACH ME Natural Language Processing Increases (NLP) Powerful, robust robotic voice translation enables them to create, engage in active conversations, and respond in human-like ways that integrate LLMs with the IoT extend beyond traditional systems for experiencing it is highly personalized and contextual, and allows users to interact with smart devices This system design seamlessly combines the capabilities of LLMs with IoT devices, 1999—creating new opportunities for applications in areas such as smart home automation, education, customer support, etc. TEACH ME’s key components include real-time voice recognition, advanced response generation, and IoT-powered task performance. Examines applicability and future directions.","","979-8-3315-2210-0","10.1109/ESIC64052.2025.10962703","","https://ieeexplore.ieee.org/stamp/stamp.jsp?arnumber=10962703","Artificial Intelligence;IoT;Voice Chat Robot;Personalized Learning;NLP;Educational Technology;TeachMe;Student Engagement;Intelligent Tutoring Systems","Performance evaluation;Large language models;Oral communication;Speech recognition;Smart homes;Natural language processing;Real-time systems;Internet of Things;Smart devices;Robots","","","","10","IEEE","16 Apr 2025","","","IEEE","IEEE Conferences"
"iRisk: A Scalable Microservice for Classifying Issue Risks Based on Crowdsourced App Reviews","V. M. A. De Lima; J. R. Barbosa; R. M. Marcacini","Três Lagoas Campus (CPTL), Federal University of Mato Grosso do Sul (UFMS), Três Lagoas, Brazil; Institute of Informatics (INF), Federal University of Goiás (UFG), Goiânia, Brazil; Institute of Mathematics and Computer Sciences (ICMC), University of são Paulo (USP), São Carlos, Brazil",2024 IEEE International Conference on Software Maintenance and Evolution (ICSME),"19 Dec 2024","2024","","","858","862","Analyzing mobile app reviews is essential for identifying trends and issue patterns that affect user experience and app reputation in app stores. A risk matrix provides a straightforward, intuitive method to prioritize software maintenance actions to mitigate negative ratings. However, manually constructing a risk matrix is time-consuming, and stakeholders often struggle to understand the context of risks due to varied descriptions and the sheer volume of reviews. Therefore, machine learning-based methods are needed to extract risks and classify their priority effectively. While existing studies have automated risk matrix generation in software development, they have not explored app reviews or utilized Large Language Models (LLMs) in a scalable architecture. To address this gap, we present iRisk (scalable microservice for classifying issue Risks), a tool for generating a risk matrix based on crowdsourced app reviews using LLM. We present i-LLAMA, a fine-tuned version of LLaMA 3, optimized to detect and prioritize app-related issues using a risk analysis dataset of reviews categorized by severity and likelihood of occurrence. This dataset is also publicly available. Our contributions include the open-source resources to support the software maintenance and evolution industry, fine-tuning of LLaMA 3, and a scalable microservice architecture to handle large volumes of data. The iRisk can manage app issues and risks and provide an automated dashboard and visualizations for decision-making, monitoring, and risk mitigation. The tool is available on GitHub11https://github.com/vitormesaque/iRisk, and a presentation about the tool can be found in this video22https://irisk.mappidea.com.","2576-3148","979-8-3503-9568-6","10.1109/ICSME58944.2024.00091","","https://ieeexplore.ieee.org/stamp/stamp.jsp?arnumber=10794993","Opinion Mining;Large language model;App Reviews;Risk Matrix;Issue Prioritization","Software maintenance;Reviews;Microservice architectures;Computer architecture;User experience;Stakeholders;Risk analysis;Monitoring;Software development management;Risk mitigation","","","","20","IEEE","19 Dec 2024","","","IEEE","IEEE Conferences"
"Fairness Testing Through Extreme Value Theory","V. Monjezi; A. Trivedi; V. Kreinovich; S. Tizpaz-Niari",University of Illinois Chicago; University of Colorado Boulder; University of Texas at El Paso; University of Illinois Chicago,2025 IEEE/ACM 47th International Conference on Software Engineering (ICSE),"23 Jun 2025","2025","","","1501","1513","Data-driven software is increasingly being used as a critical component of automated decision-support systems. Since this class of software learns its logic from historical data, it can encode or amplify discriminatory practices. Previous research on algorithmic fairness has focused on improving “average-case” fairness. On the other hand, fairness at the extreme ends of the spectrum, which often signifies lasting and impactful shifts in societal attitudes, has received significantly less emphasis. Leveraging the statistics of extreme value theory (EVT), we propose a novel fairness criterion called extreme counterfactual discrimination (ECD). This criterion estimates the worst-case amounts of disadvantage in outcomes for individuals solely based on their memberships in a protected group. Utilizing tools from search-based software engineering and generative AI, we present a randomized algorithm that samples a statistically significant set of points from the tail of ML outcome distributions even if the input dataset lacks a sufficient number of relevant samples. We conducted several experiments on four ML models (deep neural networks, logistic regression, and random forests) over 10 socially relevant tasks from the literature on algorithmic fairness. First, we evaluate the generative AI methods and find that they generate sufficient samples to infer valid EVT distribution in 95% of cases. Remarkably, we found that the prevalent bias mitigators reduce the average-case discrimination but increase the worst-case discrimination significantly in 35% of cases. We also observed that even the tail-aware mitigation algorithm-MiniMax-Fairness-increased the worst-case discrimination in 30% of cases. We propose a novel ECD-based mitigator that improves fairness in the tail in 90% of cases with no degradation of the average-case discrimination. We hope that the EVT framework serves as a robust tool for evaluating fairness in both average-case and worst-case discrimination.","1558-1225","979-8-3315-0569-1","10.1109/ICSE55347.2025.00070","NSF(grant numbers:CCF-2317206,CCF-2317207); ","https://ieeexplore.ieee.org/stamp/stamp.jsp?arnumber=11029970","software testing;fairness;extreme value theory","Hands;Logistic regression;Generative AI;Prevention and mitigation;Software algorithms;Software;Logic;Random forests;Software engineering;Testing","","1","","74","IEEE","23 Jun 2025","","","IEEE","IEEE Conferences"
"Connectivity Based Multi-Agent System Communication Network in Polymorphic Network","Y. Lu; X. Jing; H. Liu; S. Li; Q. Shan","School of Navigation, Dalian Maritime University, Dalian, China; School of Transportation Engineering, Dalian Maritime University, Dalian, China; School of Navigation, Dalian Maritime University, Dalian, China; School of Marine Electrical Engineering, Dalian Maritime University, Dalian, China; School of Navigation, Dalian Maritime University, Dalian, China",2023 International Conference on Ubiquitous Communication (Ucom),"27 Sep 2023","2023","","","455","459","With the development of artificial intelligence and network technology, the mission of multi-agent systems(MAS) has become more complex. The cooperative behavior between agents depends on the transmission of data information, i.e. the connected communication network. Therefore, combining the ideas of high security, high robustness, high efficiency and high availability of polymorphic network, a method for maintaining the connectivity of multi-agent system communication network is proposed. Firstly, an efficient and low complexity algorithm for determining the connectivity of multi-agent system communication network is proposed. Then, based on the above method, the method for maintaining the connectivity of multi-agent system communication network is designed. Finally, a simulation example is given to verify the feasibility of the proposed method.","","979-8-3503-4043-3","10.1109/Ucom59132.2023.10257615","Fundamental Research Funds for the Central Universities(grant numbers:3132023147); National Natural Science Foundation of China(grant numbers:52201407,51939001,61976033); ","https://ieeexplore.ieee.org/stamp/stamp.jsp?arnumber=10257615","Multi-Agent System;Polymorphic Network;Connectivity Maintenance","Security management;Maintenance engineering;Reliability theory;Data processing;Robustness;Internet;Communication networks","","1","","16","IEEE","27 Sep 2023","","","IEEE","IEEE Conferences"
"Improving Accuracy of LLM-based Code Clone Detection U sing Functionally Equivalent Methods","R. Inoue; Y. Higo","Osaka University, Japan; Osaka University, Japan","2024 IEEE/ACIS 22nd International Conference on Software Engineering Research, Management and Applications (SERA)","26 Sep 2024","2024","","","24","27","Avstract-A code clone is a code snippet identical or similar to another in the source code. The presence of code clones causes the spread of bugs, which means that efficient code clone detection and appropriate refactoring are necessary. Code clone detection using large language models (in short, LLMs) is more accurate than conventional tools that do not use LLMs for code clones with low syntactic similarity. However, even for LLM-based clone detection tools, detecting such code clones is still difficult, and there is room for improvement. In this study, we improved the accuracy of LLM-based code clone detection through fine-tuning using FEMPDataset. The results showed that our fine-tuning improved the accuracy of code clone detection.","2770-8209","979-8-3503-9134-3","10.1109/SERA61261.2024.10685589","","https://ieeexplore.ieee.org/stamp/stamp.jsp?arnumber=10685589","code clone;large language model;fine tuning;functionally equivalent methods","Codes;Accuracy;Source coding;Large language models;Computer bugs;Cloning;Syntactics","","5","","18","IEEE","26 Sep 2024","","","IEEE","IEEE Conferences"
"Exploring the Capability of ChatGPT in Test Generation","G. Yi; Z. Chen; Z. Chen; W. E. Wong; N. Chau","State Key Laboratory for Novel Software Technology, Nanjing University, Nanjing, China; University of Texas at Dallas, Richardson, Texas, USA; State Key Laboratory for Novel Software Technology, Nanjing University, Nanjing, China; University of Texas at Dallas, Richardson, Texas, USA; University of Texas at Dallas, Richardson, Texas, USA","2023 IEEE 23rd International Conference on Software Quality, Reliability, and Security Companion (QRS-C)","19 Feb 2024","2023","","","72","80","The design of test is a crucial step in the field of software testing. The quality of test significantly impacts the effectiveness of software testing, with well-designed test cases improving the efficiency of bug detection. However, manual test case design and writing are often considered time-consuming and labor-intensive. With the emergence of large language models (LLMs), especially ChatGPT, the potential of LLMs in the field of test generation has become evident. Pretrained LLMs can learn and understand code in various programming languages and design test cases using multiple testing frameworks. In this paper, we used ChatGPT to generate tests for some tested projects. Through experiments, we found that ChatGPT has some gaps compared to traditional test generation tools, but its performance is closer to manual testing. However, the tests generated by ChatGPT exhibit higher readability. We believe that ChatGPT is better suited to serve as a manual testing assistant, helping understand the tested code and providing testing ideas.","2693-9371","979-8-3503-5939-8","10.1109/QRS-C60940.2023.00013","National Natural Science Foundation of China(grant numbers:61932012); ","https://ieeexplore.ieee.org/stamp/stamp.jsp?arnumber=10429996","Test Generation;LLM;ChatGPT","Software testing;Codes;Manuals;Writing;Chatbots;Software reliability;Test pattern generators","","9","","32","IEEE","19 Feb 2024","","","IEEE","IEEE Conferences"
